B07CKXLQW7,B01JGYNJ94,"Costume Agent Big Lebowski Costume Pajama - Sweater Pajama Pants from The Dude Costume Big Lebowski | Men Pajama for Halloween Costume, Cosplay, Comic Con, Everyday Use & Themed Birthday Party",biglpants001-XXL,57,0,0.02%,0.00%,67,0,0.02%,0.00%,98.33%,0.00%,5,0,8.77%,0.00%,$169.75,$0.00,5,0
B07BNVPY2K,B01JSFN2Y8,DC Comics Suicide Squad Harley Quinn DELUXE Sequins Panty (Small) Red/Blue,suicidesquad004-S,569,9,0.19%,0.28%,823,23,0.21%,0.53%,99.00%,100.00%,5,0,0.88%,0.00%,$139.75,$0.00,5,0
B01KKO7ZLW,B01KKO82XW,STAR WARS Stormtrooper Top and Pants Costume Set (Women's Large),starwars164-L,92,0,0.03%,0.00%,120,0,0.03%,0.00%,100.00%,0.00%,5,1,5.43%,0.00%,$149.45,$29.65,5,1
B072K9Y1SC,B01LYKP3ZX,"Pro Wrestling Costume Boots (Small, Black)",wrestlingboots-SB,66,0,0.02%,0.00%,81,0,0.02%,0.00%,93.33%,0.00%,5,0,7.58%,0.00%,$299.95,$0.00,5,0
B072K9Y1SC,B01M0UQKL4,"Pro Wrestling Costume Boots (Large, Red)",wrestlingboots-Lred,181,2,0.06%,0.06%,230,2,0.06%,0.05%,97.97%,50.00%,5,0,2.76%,0.00%,$284.95,$0.00,5,0
B072K9Y1SC,B01M1HYNAR,"Pro Wrestling Costume Boots (Large, Blue)",wrestlingboots-LBlu,207,3,0.07%,0.09%,236,4,0.06%,0.09%,98.26%,100.00%,5,0,2.42%,0.00%,$284.95,$0.00,5,0
B07CKR9PHS,B01N51TMZL,Artbox Hulkamania Yellow T-Shirt (Youth Large),hulk001yl,21,0,0.01%,0.00%,25,0,0.01%,0.00%,87.50%,0.00%,5,0,23.81%,0.00%,$99.75,$0.00,5,0
B074DZJMB1,B074DZJMB1,Mime Costume Makeup Cosmetic Kit,mimecosmetickit,167,4,0.06%,0.12%,194,4,0.05%,0.09%,96.91%,100.00%,5,0,2.99%,0.00%,$74.75,$0.00,5,0
B0756JW1H6,B0756JW1H6,Glittery Logo Peel and Stick Temporary Arm Tattoo,5782-BatmanGlitteryArmTattoo,51,0,0.02%,0.00%,64,0,0.02%,0.00%,90.63%,0.00%,5,0,9.80%,0.00%,$34.75,$0.00,5,0
B075FWWL9R,B075FWWL9R,Beast Adult Costume Wig and Beard,1147-BeastWigandBeard,36,0,0.01%,0.00%,56,0,0.01%,0.00%,98.21%,0.00%,5,0,13.89%,0.00%,$134.75,$0.00,5,0
B075Z4K1XJ,B075Z27KRR,Marvel Super Heroes All Over Sweetheart Dress (Adult Large) Multicoloured,A9249-MarvelDress-L,41,1,0.01%,0.03%,62,1,0.02%,0.02%,98.31%,100.00%,5,0,12.20%,0.00%,$244.75,$0.00,5,0
B0767MLQ4Y,B0767MLQ4Y,Suicide Squad Cosplay Accessory Two Glove Set,EMSQ6009TV-HarleyQuinnGloveSET,99,0,0.03%,0.00%,129,0,0.03%,0.00%,98.45%,0.00%,5,0,5.05%,0.00%,$114.75,$0.00,5,0
B076JJDRSQ,B076HBHLQY,Briefly Stated National Lampoon's Christmas Vacation Clark's Dinosaur Pajama Set (Adult Small),NL029-ChristmasVacaPajama-FBA-S,44,0,0.01%,0.00%,53,0,0.01%,0.00%,86.54%,0.00%,5,0,11.36%,0.00%,$244.75,$0.00,5,0
B076HGNJX8,B076HFSX43,Briefly Stated A Christmas Story Bunny Union Suit Pajama Costume (Adult Large),CY034-ChristmasStoryUnionSuit-L,124,0,0.04%,0.00%,152,0,0.04%,0.00%,100.00%,0.00%,5,0,4.03%,0.00%,$319.75,$0.00,5,0
B07BRZNC83,B07C9HWGQD,Hulk Hogan Hulkamania Sleeveless Red T-Shirt (Adult Small),hulk003redN-S,43,1,0.01%,0.03%,47,1,0.01%,0.02%,90.24%,100.00%,5,0,11.63%,0.00%,$124.75,$0.00,5,0
B08778FTBG,B07F1Y94ZL,Undergirl Harley Quinn Argyle All Over Print Lounge Pants Medium Red,WB0943-HQAllOverRedPants-M,29,0,0.01%,0.00%,47,0,0.01%,0.00%,83.72%,0.00%,5,0,17.24%,0.00%,$64.75,$0.00,5,0
B07TCNNZSK,B07FXW36F7,Toy Story Buzz Lightyear Costume Juniors T-Shirt (XX-Large) White,DSTS26LGS-BuzzLightyearJuniotsTshirt-XXL,57,0,0.02%,0.00%,76,0,0.02%,0.00%,60.81%,0.00%,5,0,8.77%,0.00%,$109.75,$0.00,5,0
B07H5N8923,B07H5N8923,Adult Unisex Harley Girl Character Halloween Cosplay Costume Gloves Accessory One Size,ssharleyquinnglove1,99,0,0.03%,0.00%,142,0,0.04%,0.00%,95.07%,0.00%,5,0,5.05%,0.00%,$84.75,$0.00,5,0
B076HGNJX8,B07JD2L3M6,Briefly Stated A Christmas Story Bunny Union Suit Pajama Costume (Adult XX-Large) Pink,CY034-ChristmasStoryUnionSuit-XXL,76,0,0.03%,0.00%,103,0,0.03%,0.00%,92.47%,0.00%,5,0,6.58%,0.00%,$339.75,$0.00,5,0
B07KQKS62D,B07NSDBN21,I Love Xmas HOHOHO Light Up (LED) and Bells on Sleeve Ugly Christmas Sweater White,ILoveXmasUCS-XL,182,3,0.06%,0.09%,206,3,0.05%,0.07%,96.50%,100.00%,5,1,2.75%,33.33%,$349.05,$69.25,5,1
B08DBLLK8N,B07Q1MXLGL,Underboss Wu-Tang Logo Men's Boxer Briefs - L Black,LN0017-94-WuTangBoxer-L,32,1,0.01%,0.03%,38,1,0.01%,0.02%,100.00%,100.00%,5,0,15.63%,0.00%,$69.75,$0.00,5,0
B07TXLBL2M,B07V3NVV6S,"COSTUME AGENT Detective Blue Clues Costume Adult - Blue and Detective Striped Blue Shirt for Blues Clues Halloween Costume Men & Women | Costume Accessories for Cosplay, Comic Con, Theme Birthday Party COSTUME AGENT Detective Blue Clues Costume Adult - Blue and Detective Striped Green Shirt for Blues Clues Halloween Costume Men & Women | Costume Accessories for Cosplay, Comic Con, Theme Birthday Party",204070-DetectiveGREENShirt-XXL,61,1,0.02%,0.03%,93,2,0.02%,0.05%,94.05%,100.00%,5,0,8.20%,0.00%,$184.75,$0.00,5,0
B07WW21L8L,B07WW21L8L,Halloween Costume Cosplay Bottom Half Semi Rimless Rize Kamishiro Glasses,100589-BottomHalfSemiRimlessGlasses,121,0,0.04%,0.00%,177,0,0.05%,0.00%,99.44%,0.00%,5,0,4.13%,0.00%,$74.75,$0.00,5,0
B08231Z9XF,B082315R27,"Horse Man Ugly Christmas Sweater (Adult, X-Large, Orange)",HorsermanUCS-Orange-XL,41,0,0.01%,0.00%,62,0,0.02%,0.00%,88.14%,0.00%,5,0,12.20%,0.00%,$249.95,$0.00,5,0
B0887M6B4H,B0887TY2V1,Hollywood Champion Adult White T-Shirt,3001-White-ChampionShirt-S,19,0,0.01%,0.00%,23,0,0.01%,0.00%,100.00%,0.00%,5,0,26.32%,0.00%,$114.75,$0.00,5,0
B07BZM5RL8,B08FCNLPQ6,Marvel Incredible Hulk Sublimated Adult Long Sleeve Costume T-Shirt (Adult 4X-Large) Multi,incredhulk013-4XL,34,0,0.01%,0.00%,42,0,0.01%,0.00%,83.78%,0.00%,5,0,14.71%,0.00%,$149.75,$0.00,5,0
B08FRQ5PLV,B08FRQQ213,Rowdy Roddy Piper Hot Rod Kilt Skirt and Belt Halloween Costume Set - S/M Red,220762-RoddyPiperKiltBelt-S/M,193,0,0.06%,0.00%,283,0,0.07%,0.00%,98.94%,0.00%,5,0,2.59%,0.00%,$124.75,$0.00,5,0
B07YBDSTJZ,B08GGD8HMS,Flint Tropics White Basketball Shorts Adult Halloween Costume,220783-FlintTropicShorts-L/XL,51,1,0.02%,0.03%,64,1,0.02%,0.02%,98.21%,100.00%,5,0,9.80%,0.00%,$184.75,$0.00,5,0
B08GV79ZN3,B08GTVJG9J,Halloween and Cosplay Costume - Bert and Ernie Sesame Street T-Shirt Medium,4U8ML-BERT-CostumeShirt-M,183,1,0.06%,0.03%,243,1,0.06%,0.02%,97.74%,100.00%,5,0,2.73%,0.00%,$149.75,$0.00,5,0
B08GYB3TT6,B08GYCG2S7,Dodgeball Average Joe's Women's Halloween Costume Set,220757-AverageJoesWomensSet-M,44,1,0.01%,0.03%,51,2,0.01%,0.05%,100.00%,100.00%,5,0,11.36%,0.00%,$274.75,$0.00,5,0
B08JQNVQFV,B08JRGQG3Q,Mad Engine Power Rangers Logo Halloween Costume Crew Socks (Green),PKPR042-PowerRangersSocks-Green,72,0,0.02%,0.00%,88,0,0.02%,0.00%,95.29%,0.00%,5,0,6.94%,0.00%,$49.75,$0.00,5,0
B08KSJLP51,B08KSJS4Q2,M&M's Candy Character Full Body Adult T-Shirt Tee Red,M&M-Red-ADULT-Shirt-XL,55,1,0.02%,0.03%,88,1,0.02%,0.02%,98.65%,100.00%,5,0,9.09%,0.00%,$104.75,$0.00,5,0
B08LQMJN5L,B08LQR1TNF,"Power Rangers Green Costume T-Shirt(Green,X-Large)",PowerRangers-Green-SLShirt-XL,272,3,0.09%,0.09%,329,4,0.08%,0.09%,10.16%,0.00%,5,0,1.84%,0.00%,$99.75,$0.00,5,0
B08LQMJN5L,B08LQVTJFB,"Power Rangers Pink Costume T-Shirt(Pink,XXL)",PowerRangers-Pink-SLShirt-3XL,871,8,0.29%,0.25%,"1,004",14,0.26%,0.32%,77.53%,66.67%,5,0,0.57%,0.00%,$99.75,$0.00,5,0
B08LQMJN5L,B08LQW4L4P,"Power Rangers Green Costume T-Shirt(Green,Medium)",PowerRangers-Green-SLShirt-M,280,4,0.09%,0.12%,374,6,0.10%,0.14%,17.24%,0.00%,5,0,1.79%,0.00%,$99.75,$0.00,5,0
B08NTPNSL1,B08NTNKT33,Briefly Stated Top Gun Flight Suit Costume Pajama Union Suit - XL,XO011MBSTV-TopGunPajamaSuit-XL,276,1,0.09%,0.03%,325,1,0.08%,0.02%,99.07%,100.00%,5,0,1.81%,0.00%,$134.95,$0.00,5,0
B08NTPNSL1,B08NTPT64G,Briefly Stated Top Gun Flight Suit Costume Pajama Union Suit - L,XO011MBSTV-TopGunPajamaSuit-L,31,0,0.01%,0.00%,45,0,0.01%,0.00%,70.00%,0.00%,5,0,16.13%,0.00%,$134.95,$0.00,5,0
B08TB5D1NV,B08TB5D1NV,Doctor Who Tardis Police Booth Hooded One Piece Pajama Costume Union Suit Blue,drwhokigurumi001,115,0,0.04%,0.00%,154,0,0.04%,0.00%,98.05%,0.00%,5,0,4.35%,0.00%,$124.75,$0.00,5,0
B08LQMJN5L,B08XJW4DB5,"Mighty Morphin Power Rangers Red Blue Yellow Pink Green Black White Blue Costume T-Shirt (Yellow, X-Large)",PowerRangers-Yellow-SLShirt-XL,222,5,0.07%,0.15%,272,5,0.07%,0.12%,39.67%,75.00%,5,0,2.25%,0.00%,$99.75,$0.00,5,0
B09345RR9J,B09345RR9J,"Teenage Mutant Ninja Turtles TMNT Boys Costume Youth T-Shirt (as1, Alpha, x_s, Regular, Michelangelo)",TMNTShirt-Youth-Mike-XS,70,1,0.02%,0.03%,94,2,0.02%,0.05%,96.00%,100.00%,5,0,7.14%,0.00%,$99.75,$0.00,5,0
B09CR9V2F5,B09CRKY7GH,Costume Agent Willy's Wonderland The Janitor Blue T-Shirt,WillysWonderland-Shirt-L,106,3,0.04%,0.09%,132,3,0.03%,0.07%,95.83%,100.00%,5,0,4.72%,0.00%,$124.75,$0.00,5,0
B09DXKDKB8,B09DXK6W7S,"Power Rangers Mighty Morphin Yellow Boys Youth Armor Costume T-Shirt (LG, Yellow)",PRangersShirtYouth-Yellow-L,103,2,0.03%,0.06%,129,3,0.03%,0.07%,93.81%,0.00%,5,0,4.85%,0.00%,$99.75,$0.00,5,0
B09F16VD4T,B09F1528JW,Star Wars The Mandalorian Baby Yoda Pajamas Black Lounge Pants (Small),RWTM23BMN-BabyYodaPants-S,34,0,0.01%,0.00%,41,0,0.01%,0.00%,97.44%,0.00%,7,0,20.59%,0.00%,$111.65,$0.00,5,0
B09HL9G86S,B09HLB9FHC,Cousin Eddie Christmas White Shoes Halloween Costume Footwear (Numeric_11),100581-CousinEddieShoe-11,67,0,0.02%,0.00%,90,0,0.02%,0.00%,89.29%,0.00%,5,0,7.46%,0.00%,$374.95,$0.00,5,0
B09HN87WTD,B09HN6P3DJ,Legal Blonde Robe Women's Halloween Costume Cosplay Bathrobe (Blue),220841-Blonde-BlueRobe,97,1,0.03%,0.03%,145,1,0.04%,0.02%,93.62%,100.00%,5,0,5.15%,0.00%,$99.75,$0.00,5,0
B09HR7L8YM,B09HR7L8YM,Ripple Junction Naruto Cosplay Halloween Costume Jumpsuit Pajamas with Hood for Unisex Adults Orange,NSPH3266-NarutoPajamas,472,2,0.16%,0.06%,628,2,0.16%,0.05%,98.89%,100.00%,5,0,1.06%,0.00%,$249.75,$0.00,5,0
B07GC722RG,B09JCNR7Y4,Dodgeball Average Joe's Adult Yellow Jersey Costume Set (XX-Large),dodgeball003N-2XL,9,0,0.00%,0.00%,13,0,0.00%,0.00%,100.00%,0.00%,6,0,66.67%,0.00%,$270.94,$0.00,5,0
B09LJ47KZM,B09LJRJTBL,"COSTUME AGENT Jumbo Christmas Balls - 15/18/25/30 Inch Oversized Ornaments | Extra Large Giant Holiball Inflatable Ornaments for Indoor Outdoor Christmas Decorations, Weddings & Birthday Parties",102025-InfOrnament-18-Silver-FBA,82,4,0.03%,0.12%,101,5,0.03%,0.12%,96.10%,100.00%,8,0,9.76%,0.00%,$239.92,$0.00,5,0
B09LVT6QSS,B09LRD62R7,Ripple Junction Rick and Morty Monster Face Pattern Adult Lounge Pants,RMSA3879TV-RickMortyPants-L,81,0,0.03%,0.00%,102,0,0.03%,0.00%,97.96%,0.00%,6,0,7.41%,0.00%,$149.70,$0.00,5,0
B00MEDQ1XQ,B0B835YCSW,"Costume Agent A League of Their Own Costume 3 Pcs - Rockford Peaches Costume AAGPBL with Red Hat & Belt | Baseball Dress for Comic Con, Cosplay, Themed Birthday Party & Halloween Costumes for Women",leagueoftheirowncostume-FBA-3X/4X,96,1,0.03%,0.03%,130,1,0.03%,0.02%,95.58%,100.00%,5,0,5.21%,0.00%,$294.95,$0.00,5,0
B0B8TC39K9,B0B8TB814S,Good Burger Movie Button Up Shirt Hat and Name Tag Costumes for Halloween & Cosplay,220884-GoodBurgerCostume-M,76,3,0.03%,0.09%,126,8,0.03%,0.19%,95.00%,100.00%,5,0,6.58%,0.00%,$202.95,$0.00,5,0
B0B8TC39K9,B0B8TBDHTJ,Good Burger Movie Button Up Shirt Hat and Name Tag Costumes for Halloween & Cosplay,220884-GoodBurgerCostume-L,25,1,0.01%,0.03%,30,2,0.01%,0.05%,85.19%,100.00%,5,0,20.00%,0.00%,$199.95,$0.00,5,0
B0BGMDXHGL,B0BGMFXM9G,"Bel Air Prince Green Shirt, Shorts and Hat Halloween Costume Cosplay",220901-FreshPrinceCostume-M,240,3,0.08%,0.09%,301,5,0.08%,0.12%,95.92%,100.00%,5,0,2.08%,0.00%,$244.95,$0.00,5,0
B0BKQZZ84J,B0BKR4DG7W,Adult Unisex Avatar The Last Airbender Animated TV Series Jogger Lounge Pants,NDLA0FGMBJ-AvatarPanelPants-M,41,1,0.01%,0.03%,49,1,0.01%,0.02%,95.00%,100.00%,5,0,12.20%,0.00%,$79.75,$0.00,5,0
B07BRZNC83,B0C34C878Z,Adult Unisex Hulk Hogan Hulkamania Wrestler Red Sleeveless Costume T-Shirt,hulk003redN-4XL,17,2,0.01%,0.06%,21,3,0.01%,0.07%,95.24%,100.00%,5,1,29.41%,50.00%,$124.50,$24.70,5,1
B07D1Z7CTQ,B00015HG2Y,Led Zeppelin 1977 American Tour Black Mens T-Shirt Tee,ledzeppelin002-M,80,1,0.03%,0.03%,99,1,0.03%,0.02%,98.85%,100.00%,4,0,5.00%,0.00%,$87.80,$0.00,4,0
B07D1Z7CTQ,B00015HG38,Led Zeppelin 1977 American Tour Black Mens T-Shirt Tee,ledzeppelin002-L,108,0,0.04%,0.00%,132,0,0.03%,0.00%,99.14%,0.00%,4,0,3.70%,0.00%,$87.80,$0.00,4,0
B07CLSVKTR,B000A5N868,"WWE Hulk Hogan Hulkamania Men's T-shirt, Gold XXL [Apparel]",hulk001-XXL,53,2,0.02%,0.06%,66,2,0.02%,0.05%,93.33%,100.00%,4,0,7.55%,0.00%,$91.80,$0.00,4,0
B000AOA0TC,B000AOA0TC,Donald Trump You're Fired Costume Wig,firedwig,28,0,0.01%,0.00%,34,0,0.01%,0.00%,94.12%,0.00%,4,0,14.29%,0.00%,$39.80,$0.00,4,0
B07CG7FJWP,B000BTD79Q,Red Foxx 9 Cross Yo Lips Adult Mens T-Shirt Tee,sanford068-XL,89,1,0.03%,0.03%,112,1,0.03%,0.02%,96.26%,100.00%,4,0,4.49%,0.00%,$79.80,$0.00,4,0
B07CHMY955,B000CD76MK,Napoleon Dynamite Endurance T-Shirt Light Blue,pedro004-L,45,0,0.01%,0.00%,47,0,0.01%,0.00%,91.49%,0.00%,4,0,8.89%,0.00%,$71.80,$0.00,4,0
B07C1KZMTW,B000HQ6QV4,A-Team Bullet Holes T-Shirt Black (XXL),ATeam002-XXL,12,1,0.00%,0.03%,16,3,0.00%,0.07%,100.00%,100.00%,5,0,41.67%,0.00%,$84.75,$0.00,4,0
B07C1KZMTW,B000HQAY62,A-Team Bullet Holes T-Shirt Black (Small),ATeam002-S,31,0,0.01%,0.00%,42,0,0.01%,0.00%,87.80%,0.00%,4,0,12.90%,0.00%,$67.80,$0.00,4,0
B07BZFXNL7,B000LNH6EY,Don't Hassel The Hoff t-Shirt Blue,Hoff001-XXL,34,0,0.01%,0.00%,38,0,0.01%,0.00%,94.59%,0.00%,4,0,11.76%,0.00%,$63.80,$0.00,4,0
B07BTQMG6B,B000WNLIP6,Office Space Initech Software Company Logo T-Shirt Gray,Offspace001-XL,23,0,0.01%,0.00%,27,0,0.01%,0.00%,100.00%,0.00%,4,0,17.39%,0.00%,$75.80,$0.00,4,0
B07CBSCYDF,B000YY6HV8,Peanuts Charlie Brown Costume T-Shirt,Peanuts001-M,134,2,0.04%,0.06%,176,2,0.05%,0.05%,98.80%,100.00%,4,0,2.99%,0.00%,$87.80,$0.00,4,0
B07C4TCVBR,B0012O6H2S,SNL Saturday Night Live Christopher Walken More Cowbell Black T-Shirt (XXL),SNL011-XXL,40,0,0.01%,0.00%,50,0,0.01%,0.00%,85.71%,0.00%,4,0,10.00%,0.00%,$79.80,$0.00,4,0
B002E0107G,B002DZX7BY,Revenge of the Nerds High On Stress White T-Shirt Tee,revengenerds002-L,18,0,0.01%,0.00%,23,0,0.01%,0.00%,94.44%,0.00%,4,0,22.22%,0.00%,$79.96,$0.00,4,0
B002W8PVGG,B002W8S4S8,"The Power Rangers Green Rangers Costume Adult T-shirt Tee, Green, XX-Large",powerrangers009-XXL,99,0,0.03%,0.00%,112,0,0.03%,0.00%,100.00%,0.00%,4,0,4.04%,0.00%,$87.80,$0.00,4,0
B07BRRYDGL,B003455FWQ,SNL Saturday Night Live More Cowbell Vintage Tan with Brown Ringers T-Shirt Tee,SNL007tan-XXL,88,2,0.03%,0.06%,102,2,0.03%,0.05%,99.00%,100.00%,4,0,4.55%,0.00%,$79.80,$0.00,4,0
B07CKD4WHR,B0039X164O,Always Sunny In Philadelphia Irish Pub Distressed Black T-Shirt Tee,alsunny001b-S,15,1,0.00%,0.03%,21,2,0.01%,0.05%,100.00%,100.00%,4,0,26.67%,0.00%,$59.85,$0.00,4,0
B003D0SUCO,B003D10IO6,Always Sunny In Philadelphia Charlie Wildcard Black T-Shirt Tee,alsunny012-XXL,28,0,0.01%,0.00%,37,0,0.01%,0.00%,94.29%,0.00%,4,0,14.29%,0.00%,$85.80,$0.00,4,0
B003D0SUCO,B003D12KVU,Always Sunny In Philadelphia Charlie Wildcard Black T-Shirt Tee,alsunny012-XL,132,0,0.04%,0.00%,163,0,0.04%,0.00%,95.92%,0.00%,4,0,3.03%,0.00%,$85.80,$0.00,4,0
B07C2M7LCQ,B003EH5S3A,Always Sunny In Philadelphia Flip Cup Flipadelphia Heather Gray T-Shirt Tee,alsunny015-L,24,0,0.01%,0.00%,26,0,0.01%,0.00%,100.00%,0.00%,4,0,16.67%,0.00%,$79.80,$0.00,4,0
B07CRPG11R,B003G45S3G,It's Always Sunny In Philidelphia Paddy's Irish Pub Adult Tee Shirt XXL,alsunny001black-XXL,34,0,0.01%,0.00%,46,0,0.01%,0.00%,97.83%,0.00%,4,0,11.76%,0.00%,$79.80,$0.00,4,0
B07BSTHY1T,B003JUYJH8,"American Classics MASH 4077th MASH Vintage Green T-shirt Tee Large, Military Green",mash003-L,38,0,0.01%,0.00%,46,0,0.01%,0.00%,97.62%,0.00%,4,0,10.53%,0.00%,$87.80,$0.00,4,0
B07CRH8JPJ,B003P4OWH0,Chuck Nerd Herd Logo Black Adult T-Shirt Tee,chucknbc002-L,21,0,0.01%,0.00%,23,0,0.01%,0.00%,85.71%,0.00%,4,0,19.05%,0.00%,$79.80,$0.00,4,0
B07CJV7V6G,B003TOPJWS,Double Dare Logo Costume Blue Adult T-Shirt Tee,doubledare001blue-XL,34,0,0.01%,0.00%,39,0,0.01%,0.00%,100.00%,0.00%,4,0,11.76%,0.00%,$79.80,$0.00,4,0
B07CP4MWG5,B003TX3IB8,Legends of the Hidden Temple Green Monkeys Adult Costume T-Shirt Tee,legendstemplegreen-XL,39,0,0.01%,0.00%,49,0,0.01%,0.00%,95.56%,0.00%,4,0,10.26%,0.00%,$67.80,$0.00,4,0
B07CP4MWG5,B003TX3ICC,Legends of the Hidden Temple Green Monkeys Adult Costume T-Shirt Tee,legendstemplegreen-XXL,27,0,0.01%,0.00%,33,0,0.01%,0.00%,93.55%,0.00%,4,0,14.81%,0.00%,$67.80,$0.00,4,0
B07CP4MWG5,B003TX5E7E,Legends of the Hidden Temple Green Monkeys Adult Costume T-Shirt Tee,legendstemplegreen-S,148,0,0.05%,0.00%,170,0,0.04%,0.00%,100.00%,0.00%,4,0,2.70%,0.00%,$67.80,$0.00,4,0
B07CP4MWG5,B003TX98T4,Legends of the Hidden Temple Red Jaguars Adult Costume T-Shirt Tee,legendstemplered-XL,40,0,0.01%,0.00%,52,0,0.01%,0.00%,100.00%,0.00%,4,0,10.00%,0.00%,$67.80,$0.00,4,0
B07CP4MWG5,B003TXDA16,Legends of the Hidden Temple Orange Iguanas Adult Costume T-Shirt Tee,legendstempleorg-M,47,0,0.02%,0.00%,63,0,0.02%,0.00%,100.00%,0.00%,4,0,8.51%,0.00%,$67.80,$0.00,4,0
B075LLWNXF,B003VVH2NI,Plumtree Scott Pilgrim Band Logo Gold T-Shirt Tee (X-Large),plumtree001-XL,130,1,0.04%,0.03%,152,1,0.04%,0.02%,97.95%,100.00%,4,0,3.08%,0.00%,$99.80,$0.00,4,0
B075LLWNXF,B003VVIUW0,Plumtree Scott Pilgrim Band Logo Gold T-Shirt Tee (Small),plumtree001-S,192,1,0.06%,0.03%,241,1,0.06%,0.02%,96.00%,100.00%,4,0,2.08%,0.00%,$99.80,$0.00,4,0
B07C62L4JJ,B003WRG8T0,Step Brothers Shoe Sneakers Hanging Black Adult T-Shirt Tee (Large),stepbros001-L,64,0,0.02%,0.00%,83,0,0.02%,0.00%,98.80%,0.00%,4,0,6.25%,0.00%,$75.80,$0.00,4,0
B07C62L4JJ,B003WRJ23O,Step Brothers Shoe Sneakers Hanging Black Adult T-Shirt Tee (XXL),stepbros001-XXL,56,0,0.02%,0.00%,61,0,0.02%,0.00%,95.08%,0.00%,4,0,7.14%,0.00%,$75.80,$0.00,4,0
B07BR4GFYJ,B0040TAU9I,The Heavyweights Tony Perkis Power Camp Hope Black Adult T-Shirt Tee,heavyweights001-XXL,105,0,0.03%,0.00%,136,0,0.03%,0.00%,98.52%,0.00%,4,0,3.81%,0.00%,$75.80,$0.00,4,0
B07BV5755Y,B0045VJ92K,Hoosiers Hickory High School 15 Basketball Costume Burgundy Jersey Tank Top (Large),hoosiers003-L,37,0,0.01%,0.00%,44,0,0.01%,0.00%,97.50%,0.00%,4,0,10.81%,0.00%,$79.80,$0.00,4,0
B07C9J829C,B004RBU68O,Beer Bear+Deer Mac Navy Adult T-shirt Tee (XX-Large),alsunny022-XXL,24,0,0.01%,0.00%,33,0,0.01%,0.00%,100.00%,0.00%,4,0,16.67%,0.00%,$99.80,$0.00,4,0
B0052FPCEW,B0052FPCEW,Scott Pilgrim vs. The World Pixel Skull Adult Black with White Ringers T-shirt Tee (Adult X-Large),scottpilgrim004-XL,82,1,0.03%,0.03%,112,1,0.03%,0.02%,96.43%,100.00%,4,0,4.88%,0.00%,$87.80,$0.00,4,0
B07C5J9R6F,B0054RW296,Scott Pilgrim vs. The World Movie Wristband (Black & White),scottpilgrimwristband-BlackandWhite,74,0,0.02%,0.00%,104,0,0.03%,0.00%,69.61%,0.00%,7,0,9.46%,0.00%,$27.65,$0.00,4,0
B07C5J9R6F,B0054RW2H8,Scott Pilgrim vs. The World Movie Wristband (Gold & Maroon),scottpilgrimwristband-GoldandMaroon,126,0,0.04%,0.00%,172,0,0.04%,0.00%,82.53%,0.00%,6,0,4.76%,0.00%,$29.70,$0.00,4,0
B07BXLZL7N,B005C51156,Superman Distressed Logo With Striped Sleeves Black Adult T-shirt Tee (Adult Large),super044stripes-L,20,0,0.01%,0.00%,23,0,0.01%,0.00%,95.45%,0.00%,4,0,20.00%,0.00%,$79.80,$0.00,4,0
B005QR8VIA,B005QR8WQQ,Simpsons Duff Beer Light Blue Sleeveless Adult T-Shirt Tee (Adult XX-Large),simp023-XXL,30,0,0.01%,0.00%,34,0,0.01%,0.00%,96.88%,0.00%,4,0,13.33%,0.00%,$91.80,$0.00,4,0
B07CM11HRV,B007A2IVHU,Melting Sheldon Cooper The Big Bang Theory Black T-Shirt (Adult XX-Large),rubiks002-XXL,37,0,0.01%,0.00%,43,0,0.01%,0.00%,97.37%,0.00%,4,0,10.81%,0.00%,$67.80,$0.00,4,0
B07CM9C4K7,B008BVENR6,The Big Bang Theory Soft Kitty Warm Kitty BLACK Mens T-Shirt (Adult Large),bigbang017BLACK-L,81,1,0.03%,0.03%,100,1,0.03%,0.02%,100.00%,100.00%,4,0,4.94%,0.00%,$79.80,$0.00,4,0
B07CRRFN3R,B008PGR5AE,My Little Pony Twilight Sparkle Face Juniors Lilac Costume Hoodie with Mane & Horn (Juniors Small),mypony014-S,313,1,0.10%,0.03%,372,1,0.10%,0.02%,95.70%,100.00%,4,0,1.28%,0.00%,$38.85,$0.00,4,0
B008QYCK28,B008QYGV5A,The Big Bang Theory Sheldon 73 Navy Mens T-Shirt (Adult X-Large),bigbang042-XL,25,0,0.01%,0.00%,29,0,0.01%,0.00%,95.24%,0.00%,4,0,16.00%,0.00%,$67.80,$0.00,4,0
B07C4NS96P,B008VVEFWE,Power Rangers Red Hooded Costume Sweatshirt (Adult Medium),powerrangerssweatshirtRed-M,55,0,0.02%,0.00%,67,0,0.02%,0.00%,91.67%,0.00%,4,0,7.27%,0.00%,$215.80,$0.00,4,0
B07CCKRN8V,B008XJ88FE,Karate Kid The DELUXE Daniel Mens Replica Gi Costume (X-Large),karatekiddanielcostumetdlxXL-Deluxe-XL,270,2,0.09%,0.06%,378,3,0.10%,0.07%,98.68%,100.00%,4,0,1.48%,0.00%,$191.80,$0.00,4,0
B01NH0FP93,B00939OI6G,Inflatable Adult Chub Suit ® Costume (Green),chubsuitcostume001-Green,58,2,0.02%,0.06%,79,3,0.02%,0.07%,85.51%,66.67%,4,1,6.90%,50.00%,$111.52,$27.67,4,1
B009D3IAFW,B009D3IAFW,TV Store The Hangover Alan Costume Accessories Set (Baby Carrier 2 Sunglasses Beard),alanbabycarriercostume,411,5,0.14%,0.15%,507,5,0.13%,0.12%,97.24%,100.00%,4,0,0.97%,0.00%,$199.80,$0.00,4,0
B07BLJD6FC,B009G6E2D0,Hulkamania World Champ Costume Yellow Snapsuit Infant Onesie Baby Romper (18 Months),hulk006-18M,34,0,0.01%,0.00%,39,0,0.01%,0.00%,97.44%,0.00%,4,0,11.76%,0.00%,$79.80,$0.00,4,0
B07CR1X62V,B009OL332S,The Heavyweights Tony Perkis Power Camp Hope Black Adult Sleeveless Tank Top (Adult XX-Large),heavyweights001TANK-XXL,38,0,0.01%,0.00%,47,0,0.01%,0.00%,100.00%,0.00%,4,0,10.53%,0.00%,$75.80,$0.00,4,0
B07CT7MP5V,B00AIXUMHA,TMNT Teenage Mutant Ninja Turtles Costume Green Raphael Toddler T-shirt (Red Raphael) (Toddler 2T),tmnt016RAPHAELtoddler-2T,280,3,0.09%,0.09%,367,3,0.09%,0.07%,99.71%,100.00%,4,0,1.43%,0.00%,$67.96,$0.00,4,0
B07C111JH7,B00BOVQJFE,Top Gun Logo and Maverick Name Adult Heather Navy T-Shirt (Adult XXX-Large),topgun002-XXXL,113,1,0.04%,0.03%,153,1,0.04%,0.02%,99.32%,100.00%,4,0,3.54%,0.00%,$87.80,$0.00,4,0
B0CC3M934X,B00CF7KTIE,Saved By The Bell Kelly Kapowski Bayside Off The Shoulder Gray Juniors/Ladies Sweatshirt,sbb015-S,54,1,0.02%,0.03%,71,1,0.02%,0.02%,88.57%,0.00%,4,0,7.41%,0.00%,$127.80,$0.00,4,0
B00CF8PFRI,B00CF8PFRI,Saved By The Bell Kelly Kapowski Bayside Off The Shoulder Gray Juniors/Ladies Sweatshirt,sbb015-L,76,1,0.03%,0.03%,116,1,0.03%,0.02%,100.00%,100.00%,4,0,5.26%,0.00%,$127.80,$0.00,4,0
B0CC3M934X,B00CF8PFRI,Saved By The Bell Kelly Kapowski Bayside Off The Shoulder Gray Juniors/Ladies Sweatshirt,sbb015-L,84,0,0.03%,0.00%,118,0,0.03%,0.00%,100.00%,0.00%,4,0,4.76%,0.00%,$127.80,$0.00,4,0
B07CMHJ9J7,B00CMQWPS0,Los Pollos Hermanos Logo T-Shirt Tee,breakingbad004navy-M,94,2,0.03%,0.06%,124,2,0.03%,0.05%,99.14%,100.00%,4,0,4.26%,0.00%,$79.80,$0.00,4,0
B00CO9NYWG,B00CO9NZPW,BATMAN DC Comics Logo Bandeau Monokini One-Piece Black Swimsuit (Ladies Medium),batmanswim005-M,262,3,0.09%,0.09%,349,5,0.09%,0.12%,98.57%,100.00%,4,0,1.53%,0.00%,$175.80,$0.00,4,0
B07BZDXRQC,B00CP8M07G,M&M M&M's Candy Red Silly Character Face Adult T-Shirt (Adult Small),mm001Nred-S,315,4,0.10%,0.12%,405,4,0.10%,0.09%,97.87%,100.00%,6,2,1.90%,50.00%,$137.24,$45.44,4,1
B00HYGRXQC,B00CVFB1GE,Ripple Junction The Wizard of Oz Dorothy Ruby Red Slippers Socks,wizardozsocks002,56,0,0.02%,0.00%,67,0,0.02%,0.00%,98.51%,0.00%,4,0,7.14%,0.00%,$47.56,$0.00,4,0
B00DNGZ96S,B00DNGYXHO,"Teenage Mutant Ninja Turtles TMNT Costume Green T-Shirt with Eye Mask (Adult Small, Green/Purple)",tmnt045Don-S,274,4,0.09%,0.12%,336,4,0.09%,0.09%,94.29%,0.00%,4,0,1.46%,0.00%,$87.80,$0.00,4,0
B00DNGZ96S,B00DNGZ20Q,Teenage Mutant Ninja Turtles TMNT Michelangelo Costume Green T-shirt with Orange Eye Mask (Adult Medium),tmnt045Mike-M,62,1,0.02%,0.03%,79,1,0.02%,0.02%,93.24%,100.00%,4,0,6.45%,0.00%,$87.80,$0.00,4,0
B00ELP3FFC,B00ELP3FFC,Bubba Gump Shrimp Red Hat Cap,forestgumphat1,127,1,0.04%,0.03%,162,2,0.04%,0.05%,91.36%,100.00%,4,0,3.15%,0.00%,$63.80,$0.00,4,0
B00EOYR6VO,B00EOYR6VO,How I Met Your Mother Rubber Duck Barney Stinson Costume Fancy Dress Suit Up Tie,ducktie,83,1,0.03%,0.03%,113,1,0.03%,0.02%,87.61%,100.00%,5,0,6.02%,0.00%,$29.75,$0.00,4,0
B08CBGNVJJ,B00FH82B5M,Tuxedo Tux Adult Red Inflatable Chub Suit ® Costume (Red),chubsuitcostume002-red,136,4,0.04%,0.12%,178,5,0.05%,0.12%,96.63%,100.00%,4,0,2.94%,0.00%,$99.96,$0.00,4,0
B07C58YG3R,B00FI3OMJO,Jeffrey The Dude Zip Up Costume Cardigan Sweater,bigl032-M,47,1,0.02%,0.03%,62,1,0.02%,0.02%,96.61%,0.00%,4,0,8.51%,0.00%,$271.80,$0.00,4,0
B07C58YG3R,B00FI3ONI4,Jeffrey The Dude Zip Up Costume Cardigan Sweater (Adult Large) Tan,bigl032-L,209,2,0.07%,0.06%,249,2,0.06%,0.05%,98.35%,100.00%,4,0,1.91%,0.00%,$271.80,$0.00,4,0
B00FI3OPXC,B00FI3OSY8,80's Movie Day Off Button Up Costume Sweater Vest Black/Gold,ferris010-L,43,0,0.01%,0.00%,60,0,0.02%,0.00%,93.75%,0.00%,4,0,9.30%,0.00%,$159.80,$0.00,4,0
B00FT6HRRO,B00FT6HW7Y,Monsters University Roar Omega Roar Adult Dark Red T-Shirt (Adult Medium),monstersinc009-M,64,1,0.02%,0.03%,76,1,0.02%,0.02%,98.67%,100.00%,4,0,6.25%,0.00%,$79.80,$0.00,4,0
B07BV15X7N,B00FZ3LTPC,Power Rangers Blue Baby Ranger Romper Onesie (12-18 Months),powerrangers018blue-12/18,50,0,0.02%,0.00%,60,0,0.02%,0.00%,96.61%,0.00%,4,0,8.00%,0.00%,$79.80,$0.00,4,0
B07BV15X7N,B00FZ3LUQ0,Power Rangers Red Baby Ranger Costume Romper Onesie (12-18 Months),powerrangers018red-12/18,75,1,0.02%,0.03%,87,1,0.02%,0.02%,100.00%,100.00%,4,0,5.33%,0.00%,$79.80,$0.00,4,0
B07BV15X7N,B00GABP1SO,"Power Rangers Baby Ranger Costume Romper Onesie (0-6 Months, Yellow)",powerrangers018yellow-0/6,190,0,0.06%,0.00%,227,0,0.06%,0.00%,97.66%,0.00%,4,0,2.11%,0.00%,$79.80,$0.00,4,0
B07BSTHY1T,B00J4WIZ8E,MASH Vintage Adult T-Shirt Military Green,mash003-XXL,41,2,0.01%,0.06%,45,2,0.01%,0.05%,97.67%,100.00%,4,0,9.76%,0.00%,$87.80,$0.00,4,0
B07CRCX3L4,B00JZZI53A,The Big Bang Theory Sheldon Bats Adult Green T-Shirt (Adult Medium),bigbang072-M,73,0,0.02%,0.00%,84,0,0.02%,0.00%,96.30%,0.00%,4,0,5.48%,0.00%,$79.80,$0.00,4,0
B00NO30O6K,B00NO30O6K,The Ultimate Warrior 3-Stripe Wristband Set (Includes 2 Wrisbands),ultimatewarriorwristbands,62,1,0.02%,0.03%,78,1,0.02%,0.02%,96.15%,100.00%,4,0,6.45%,0.00%,$47.80,$0.00,4,0
B07C87QPG7,B00O940PSK,Mermaid Tail Blue Fin Costume (L/XL),mermaidfin001BLUE-L/XL,116,2,0.04%,0.06%,134,2,0.03%,0.05%,98.43%,100.00%,4,0,3.45%,0.00%,$79.80,$0.00,4,0
B06ZY1Z4SF,B00U0HJN10,Ripple Junction Caddyshack Bushwood Country Club Heather Red T-Shirt (Adult Medium),caddy010-M,26,0,0.01%,0.00%,31,0,0.01%,0.00%,93.10%,0.00%,4,0,15.38%,0.00%,$79.80,$0.00,4,0
