B009SDRDYG,B009SDREEK,World Wrestling Entertainment WWE Old School Macho Man Glasses Adult Lime Green Tank Top Shirt (Adult Medium),wwe056-M,185,3,0.06%,0.09%,246,9,0.06%,0.20%,98.78%,100.00%,5,1,2.70%,33.33%,$94.56,$18.76,5,1
B0727MMDV3,B00BL9HCYG,Batman All Over Logo Halter Top & Bikini Bottom Swim Suit (Juniors X-Large),batmanswim004-XL,311,1,0.09%,0.03%,420,1,0.10%,0.02%,98.81%,100.00%,5,0,1.61%,0.00%,$199.95,$0.00,5,0
B07BHZCF1V,B00BMVIQA2,Hulkamania Red and Yellow Tie-Dye Wrestling Legging Tights Pants (Adult Small),hulkpants001-S,92,3,0.03%,0.09%,125,5,0.03%,0.11%,99.18%,100.00%,5,0,5.43%,0.00%,$134.75,$0.00,5,0
B07CMHJ9J7,B00CMQWSLE,Los Pollos Hermanos Logo T-Shirt Tee,breakingbad004navy-XXL,94,4,0.03%,0.11%,114,4,0.03%,0.09%,84.91%,100.00%,5,1,5.32%,25.00%,$99.55,$19.75,5,1
B07BZDXRQC,B00CP8M9SQ,Adult M&M’S Character Big Face T-Shirt,mm001Ngrn-S,278,5,0.08%,0.14%,344,5,0.08%,0.11%,99.42%,75.00%,6,2,2.16%,40.00%,$137.24,$45.44,5,1
B00DNGZ96S,B00DNGZ20Q,Teenage Mutant Ninja Turtles TMNT Michelangelo Costume Green T-shirt with Orange Eye Mask (Adult Medium),tmnt045Mike-M,43,1,0.01%,0.03%,53,3,0.01%,0.07%,100.00%,100.00%,5,1,11.63%,100.00%,$109.53,$21.73,5,1
B00E0R6364,B00E0R6364,Wrestler Extreme Warrior Makeup Temporary Tattoo Ultimate Wig & Armbands Costume Set,ultimatewarriorset,87,0,0.03%,0.00%,110,0,0.03%,0.00%,99.09%,0.00%,5,0,5.75%,0.00%,$149.75,$0.00,5,0
B00ELP3FFC,B00ELP3FFC,Bubba Gump Shrimp Red Hat Cap,forestgumphat1,138,0,0.04%,0.00%,176,0,0.04%,0.00%,96.02%,0.00%,5,0,3.62%,0.00%,$79.75,$0.00,5,0
B07CGRM51M,B00EVYMKJU,Disney Monsters University OK Oozma Kappa Member Adult Green T-Shirt (Adult Medium),monstersinc003-M,92,1,0.03%,0.03%,119,1,0.03%,0.02%,99.15%,100.00%,5,0,5.43%,0.00%,$99.75,$0.00,5,0
B07CGRM51M,B00EVYMLRQ,Disney Monsters University OK Oozma Kappa Member Adult Green T-Shirt (Adult Large),monstersinc003-L,61,0,0.02%,0.00%,70,0,0.02%,0.00%,97.14%,0.00%,5,0,8.20%,0.00%,$99.75,$0.00,5,0
B07CGRM51M,B00EVYMOAU,Disney Monsters University OK Oozma Kappa Member Adult Green T-Shirt (Adult XX-Large),monstersinc003-XXL,28,0,0.01%,0.00%,36,0,0.01%,0.00%,94.12%,0.00%,5,0,17.86%,0.00%,$99.75,$0.00,5,0
B08CBHNZY8,B00FH80HQC,Tuxedo Tux Adult Orange Inflatable Chub Suit ® Costume,chubsuitcostume002-orange,183,2,0.06%,0.06%,251,4,0.06%,0.09%,98.41%,100.00%,5,0,2.73%,0.00%,$114.95,$0.00,5,0
B07CJYFD4H,B00FH813II,Power Rangers The Green Tunic Tank Dress with Socks (Juniors Small),powerrangers017green-S,221,2,0.07%,0.06%,263,3,0.06%,0.07%,94.94%,100.00%,5,0,2.26%,0.00%,$89.75,$0.00,5,0
B08CBGNVJJ,B00FH82B5M,Tuxedo Tux Adult Red Inflatable Chub Suit ® Costume (Red),chubsuitcostume002-red,256,1,0.08%,0.03%,351,1,0.08%,0.02%,99.15%,100.00%,5,0,1.95%,0.00%,$124.95,$0.00,5,0
B00FI3OPXC,B00FI3OSY8,80's Movie Day Off Button Up Costume Sweater Vest Black/Gold,ferris010-L,51,0,0.02%,0.00%,66,0,0.02%,0.00%,96.23%,0.00%,5,0,9.80%,0.00%,$199.75,$0.00,5,0
B0BPD3DTKT,B00FQS9CF0,"Breaking Bad Men's Los Pollos Hermanos Apron, Yellow, One Size",breakingbadapron001,"2,401",40,0.73%,1.15%,"3,346",60,0.79%,1.32%,0.92%,55.56%,55,55,2.29%,137.50%,$914.34,$914.34,5,5
B07BV15X7N,B00FZ3LQY6,Power Rangers Pink Baby Ranger Romper Onesie (12-18 Months),powerrangers018pink-12/18,138,1,0.04%,0.03%,171,1,0.04%,0.02%,99.40%,100.00%,5,0,3.62%,0.00%,$99.75,$0.00,5,0
B07BV15X7N,B00FZ3LSDU,"Power Rangers Baby Ranger Costume Romper Onesie (0-6 Months, Blue)",powerrangers018blue-0/6,188,1,0.06%,0.03%,226,1,0.05%,0.02%,97.54%,0.00%,5,0,2.66%,0.00%,$99.75,$0.00,5,0
B07BV15X7N,B00FZ3LSZI,Power Rangers Blue Baby Ranger Costume Romper Onesie (6-12 Months),powerrangers018blue-6/12,60,0,0.02%,0.00%,68,0,0.02%,0.00%,91.04%,0.00%,5,0,8.33%,0.00%,$99.75,$0.00,5,0
B07BV15X7N,B00FZ3LTPC,Power Rangers Blue Baby Ranger Romper Onesie (12-18 Months),powerrangers018blue-12/18,63,0,0.02%,0.00%,71,0,0.02%,0.00%,92.54%,0.00%,5,0,7.94%,0.00%,$99.75,$0.00,5,0
B07BV15X7N,B00FZ3LTV6,Power Rangers Red Baby Ranger Costume Romper Onesie (6-12 Months),powerrangers018red-6/12,129,0,0.04%,0.00%,151,0,0.04%,0.00%,100.00%,0.00%,5,0,3.88%,0.00%,$99.75,$0.00,5,0
B07BV15X7N,B00GABP1SE,"Power Rangers Baby Ranger Costume Romper Onesie (12-18 Months, Yellow)",powerrangers018yellow-12/18,76,0,0.02%,0.00%,91,0,0.02%,0.00%,100.00%,0.00%,5,0,6.58%,0.00%,$99.75,$0.00,5,0
B07BTS225F,B00O18BESO,Reversible Adult Black and Red Superhero Costume Cape (Adult),superherocape002ADULTblk-red,91,0,0.03%,0.00%,119,0,0.03%,0.00%,96.36%,0.00%,5,0,5.49%,0.00%,$64.75,$0.00,5,0
B07BXLNHT4,B00OG9E6P6,Costume Agent USA American Flag Lounge Pants Pajamas (XX-Large),usa002-XXL,21,1,0.01%,0.03%,25,1,0.01%,0.02%,100.00%,0.00%,6,1,28.57%,100.00%,$155.44,$25.69,5,1
B00OJOXUJG,B00OJOXZEG,DC Comics Superman Silver Logo Men's Performance Compression Athletic T-Shirt (Adult Large),super068-L,123,1,0.04%,0.03%,148,1,0.03%,0.02%,96.55%,100.00%,5,0,4.07%,0.00%,$99.75,$0.00,5,0
B07YZTT6F3,B00U0IHP5U,Ripple Junction The Big Lebowski Team Dude Bowling Gold Button-Down Shirt Costume (Adult 3X-Large),bigldudecostume001-3XL,105,3,0.03%,0.09%,118,3,0.03%,0.07%,96.77%,100.00%,5,0,4.76%,0.00%,$199.75,$0.00,5,0
B0089Z0MP6,B00XIFZCPM,Teenage Mutant Ninja Turtles Green Leonardo Costume Infant Baby Onesie Romper (Blue Belt) (24 Months),tmntonesieBLUE-24M,267,2,0.08%,0.06%,343,2,0.08%,0.04%,98.57%,100.00%,5,0,1.87%,0.00%,$99.75,$0.00,5,0
B07BVRDM88,B012H8AR0U,Rockford Peaches AAGPBL Baseball Girls Costume Dress (7/8),leagueoftheirownGIRLS-FBA-7/8,93,2,0.03%,0.06%,109,2,0.03%,0.04%,98.99%,100.00%,5,0,5.38%,0.00%,$189.75,$0.00,5,0
B0147HQ3WA,B0145PIKNO,Where's Waldo DELUXE Costume Set (Adult XX-Large),waldocostumeDELUXE-XXL,191,5,0.06%,0.14%,228,5,0.05%,0.11%,99.11%,100.00%,5,0,2.62%,0.00%,$154.75,$0.00,5,0
B07C5D48QB,B015L2QQ2M,Macho Man Star Printed Costume Bandana (Orange),machomanbandana-Orange,141,2,0.04%,0.06%,168,2,0.04%,0.04%,96.93%,100.00%,5,0,3.55%,0.00%,$49.75,$0.00,5,0
B0164H11CS,B0164H175E,Friday After Next Top Flight Security Shirt and Whistle Costume Set (L/XL),fridaysecurityset-L-XL,161,3,0.05%,0.09%,217,4,0.05%,0.09%,96.77%,100.00%,8,0,4.97%,0.00%,$175.60,$0.00,5,0
B07BSTHY1T,B01BKOJED8,Mash Men's M.A.S.H. 4077th Red Cross T-Shirt Military Green M,mash003-M,87,3,0.03%,0.09%,103,3,0.02%,0.07%,95.79%,100.00%,6,0,6.90%,0.00%,$131.70,$0.00,5,0
B01H4BDMDO,B01H4BDMDO,Bioworld Suicide Squad Harley Quinn Puddin Replica Choker,puddinchoker1,319,0,0.10%,0.00%,399,0,0.09%,0.00%,99.25%,0.00%,5,0,1.57%,0.00%,$89.75,$0.00,5,0
B01HQI448M,B01HQI448M,DC Comics Suicide Squad Harley Quinn Joker Temporary Tattoos,suicidesquadtattoos,152,2,0.05%,0.06%,196,3,0.05%,0.07%,98.47%,100.00%,5,0,3.29%,0.00%,$59.75,$0.00,5,0
B01IC2QU10,B01IC2QU10,Bioworld Suicide Squad Harley Quinn Women's Costume Bomber Jacket (Large),suicidesquad010-L,663,8,0.20%,0.23%,885,12,0.21%,0.26%,99.89%,100.00%,5,0,0.75%,0.00%,$299.95,$0.00,5,0
B07CR1F94G,B01IC2QU3S,Bioworld Suicide Squad Harley Quinn Women's Costume Bomber Jacket (Medium) Multicoloured,suicidesquad010-M,318,3,0.10%,0.09%,416,3,0.10%,0.07%,99.26%,100.00%,5,0,1.57%,0.00%,$299.95,$0.00,5,0
B01J6J58SO,B01J6J5GWM,M&M's Chocolate Candy Character Face Yellow T-Shirt (Juniors X-Large),mm003JRSyellow-XL,125,2,0.04%,0.06%,159,3,0.04%,0.07%,99.33%,100.00%,5,0,4.00%,0.00%,$119.75,$0.00,5,0
B01J6J58SO,B01J6J5JRE,M&M's Chocolate Candy Character Face Red T-Shirt (Juniors Large),mm003JRSred-L,126,0,0.04%,0.00%,170,0,0.04%,0.00%,86.11%,0.00%,6,1,4.76%,0.00%,$143.46,$23.71,5,1
B01J6J58SO,B01J6J5LZ4,M&M's Chocolate Candy Character Face Yellow T-Shirt (Juniors Large),mm003JRSyellow-L,134,1,0.04%,0.03%,196,1,0.05%,0.02%,94.83%,100.00%,5,0,3.73%,0.00%,$119.75,$0.00,5,0
B07CKXLQW7,B01JGYNF7K,"Costume Agent Big Lebowski Costume Pajama - Sweater Pajama Pants from The Dude Costume Big Lebowski | Men Pajama for Halloween Costume, Cosplay, Comic Con, Everyday Use & Themed Birthday Party",biglpants001-S,343,6,0.10%,0.17%,436,7,0.10%,0.15%,99.31%,100.00%,5,0,1.46%,0.00%,$169.75,$0.00,5,0
B0CBSWQ4J8,B01LBRL9EG,Superhero Gotham Black Costume Boots (Medium 10-11),100578BLACK-M,160,2,0.05%,0.06%,201,2,0.05%,0.04%,100.00%,100.00%,6,1,3.75%,50.00%,$460.93,$76.18,5,1
B07BVHH2NT,B01LZYQJ3M,SNL Garth Algar Wig Standard,wayneGARTHwig,161,2,0.05%,0.06%,198,2,0.05%,0.04%,55.56%,50.00%,5,0,3.11%,0.00%,$109.75,$0.00,5,0
B072K9Y1SC,B01M0UQKL4,"Pro Wrestling Costume Boots (Large, Red)",wrestlingboots-Lred,318,5,0.10%,0.14%,398,5,0.09%,0.11%,98.32%,33.33%,5,0,1.57%,0.00%,$284.95,$0.00,5,0
B01M18TSKJ,B01M18TSKJ,DC Comics The Flash Bolt with Wings Adult Beanie Red,theflashbeanie,114,1,0.03%,0.03%,134,1,0.03%,0.02%,96.27%,100.00%,5,0,4.39%,0.00%,$99.75,$0.00,5,0
B072K9Y1SC,B01M1HYNAR,"Pro Wrestling Costume Boots (Large, Blue)",wrestlingboots-LBlu,214,3,0.07%,0.09%,242,4,0.06%,0.09%,98.39%,100.00%,5,0,2.34%,0.00%,$284.95,$0.00,5,0
B07CKR9PHS,B01N51TMZL,Artbox Hulkamania Yellow T-Shirt (Youth Large),hulk001yl,20,0,0.01%,0.00%,27,0,0.01%,0.00%,76.92%,0.00%,5,0,25.00%,0.00%,$99.75,$0.00,5,0
B074DZJMB1,B074DZJMB1,Mime Costume Makeup Cosmetic Kit,mimecosmetickit,185,4,0.06%,0.11%,210,4,0.05%,0.09%,97.14%,100.00%,5,0,2.70%,0.00%,$74.75,$0.00,5,0
B074PDG4GM,B074PDG4GM,"Concept One Accessories Bob's Burgers Louise Cosplay Fleece Hat, Pink, One Size",ETBO6011-COLouiseHat,163,2,0.05%,0.06%,212,3,0.05%,0.07%,94.34%,100.00%,5,0,3.07%,0.00%,$74.75,$0.00,5,0
B074XDM9ZN,B074XK7MP7,Capstone Headwear Watchdogs Dedsec Hacking Group Adjustable Baseball Cap (Gray),DedSecHat001-Gray,99,0,0.03%,0.00%,135,0,0.03%,0.00%,99.23%,0.00%,5,0,5.05%,0.00%,$49.75,$0.00,5,0
B075LRP365,B075MH61JD,Men's Mime Costume Set with Makeup Kit (Adult Large),220697-MENS-MimeCostumeSet-L,65,2,0.02%,0.06%,86,2,0.02%,0.04%,93.90%,100.00%,6,1,9.23%,50.00%,$269.25,$44.50,5,1
B0767MLQ4Y,B0767MLQ4Y,Suicide Squad Cosplay Accessory Two Glove Set,EMSQ6009TV-HarleyQuinnGloveSET,101,1,0.03%,0.03%,144,1,0.03%,0.02%,97.92%,100.00%,5,0,4.95%,0.00%,$114.75,$0.00,5,0
B076JJDRSQ,B076HFK8ZL,Briefly Stated National Lampoon's Christmas Vacation Clark's Dinosaur Pajama Set (Adult Medium),NL029-ChristmasVacationPajamaSet-M,149,1,0.05%,0.03%,172,1,0.04%,0.02%,98.83%,100.00%,6,0,4.03%,0.00%,$299.70,$0.00,5,0
B076JJDRSQ,B076HFKLDY,Briefly Stated National Lampoon's Christmas Vacation Clark's Dinosaur Pajama Set (Adult X-Large),NL029-ChristmasVacationPajamaSet-XL,221,1,0.07%,0.03%,282,1,0.07%,0.02%,100.00%,100.00%,5,0,2.26%,0.00%,$249.75,$0.00,5,0
B076L13NW2,B076L13NW2,Captain Costume with Printed Underpants and Cape Inflatable CHUB Suit® (Teen) Multicoloured,CaptainUnderpants-ChubSuit-Teen,181,0,0.06%,0.00%,220,0,0.05%,0.00%,96.36%,0.00%,5,0,2.76%,0.00%,$199.75,$0.00,5,0
B07CR6TL95,B0778V3FCR,Costume Agent National Lampoons Christmas Vacation Glass Moose Mug (2 Pack),MooseMug001-2Pack,293,3,0.09%,0.09%,360,6,0.08%,0.13%,99.44%,100.00%,5,0,1.71%,0.00%,$199.95,$0.00,5,0
B07FDFQY9X,B07FDFQY9X,Colonial Boy Costume Accessory White Deluxe Wig,BoysColonialWig-1192,73,0,0.02%,0.00%,99,0,0.02%,0.00%,100.00%,0.00%,13,0,17.81%,0.00%,$168.35,$0.00,5,0
B07FDJPVZY,B07FDJPVZY,Ben Franklin President Costume Accessory Deluxe Wig,BenFranklin-1193,65,0,0.02%,0.00%,84,0,0.02%,0.00%,96.43%,0.00%,5,0,7.69%,0.00%,$64.75,$0.00,5,0
B07FNTHLRM,B07FNWVJ7L,Custom Robe Add Your Own Text Name or Image Costume Robe (Adult Blue),customRobe-Blue,215,9,0.07%,0.26%,296,9,0.07%,0.20%,96.23%,100.00%,6,0,2.79%,0.00%,$257.94,$0.00,5,0
B07TCNNZSK,B07FXSY2MD,Toy Story Buzz Lightyear Costume Juniors T-Shirt (Medium) White,DSTS26LGS-BuzzLightyearJuniotsTshirt-M,83,1,0.03%,0.03%,119,1,0.03%,0.02%,67.80%,100.00%,5,0,6.02%,0.00%,$109.75,$0.00,5,0
B08JZGFKGH,B07GK26CJJ,"Teenage Mutant Ninja Turtles TMNT Mens Costume T-Shirt(Michelangelo,XXXL)",tmnt016-Mike-Mens-3XL,166,1,0.05%,0.03%,200,1,0.05%,0.02%,50.00%,0.00%,5,0,3.01%,0.00%,$99.75,$0.00,5,0
B07H5N8923,B07H5N8923,Adult Unisex Harley Girl Character Halloween Cosplay Costume Gloves Accessory One Size,ssharleyquinnglove1,104,0,0.03%,0.00%,135,0,0.03%,0.00%,91.11%,0.00%,5,0,4.81%,0.00%,$84.75,$0.00,5,0
B08DBLLK8N,B07PX92QK3,Wu-Tang Logo Men's Boxer Briefs - XL Black,LN0017-94-WuTangBoxer-XL,41,0,0.01%,0.00%,44,0,0.01%,0.00%,100.00%,0.00%,6,0,14.63%,0.00%,$83.70,$0.00,5,0
B07TXLBL2M,B07V2JX2MF,"Adult Halloween Costume ""Blue and Detective"" Green Striped Shirt (Medium, Green)",204070-DetectiveGREENShirt-M,75,0,0.02%,0.00%,92,0,0.02%,0.00%,93.98%,0.00%,5,0,6.67%,0.00%,$184.75,$0.00,5,0
B07TXLBL2M,B07V5R7LVY,"Adult Halloween Costume ""Blue and Detective"" Green Striped Shirt (Large, Green)",204070-DetectiveGREENShirt-L,102,2,0.03%,0.06%,127,3,0.03%,0.07%,97.37%,100.00%,5,0,4.90%,0.00%,$184.75,$0.00,5,0
B07TTDH4CV,B07V6T28KC,Adult Halloween Costume Kip's Uncle Rico Shirt Blue,204071-UncleRicoShirt-M,97,1,0.03%,0.03%,112,1,0.03%,0.02%,97.22%,100.00%,5,0,5.15%,0.00%,$149.75,$0.00,5,0
B07TWJ6LMY,B07VX8NBZC,Fireman Fire Fighter Child Costume Jacket and Pants Set (Personalized 6/7),Custom-220710-FiremanChildCostume-6-7,19,0,0.01%,0.00%,37,0,0.01%,0.00%,90.91%,0.00%,5,0,26.32%,0.00%,$199.75,$0.00,5,0
B07WSQJPWK,B07WTPPMBS,Train Conductor Engineer Child Deluxe Halloween Costume Set (4/5),220714-TrainEngineerChildCostume-4/5,32,0,0.01%,0.00%,42,0,0.01%,0.00%,95.00%,0.00%,5,0,15.63%,0.00%,$169.75,$0.00,5,0
B07WTXJYVT,B07WTXJYVT,Adult Unisex Rex Kwon Do NP Movie Halloween Costume Cosplay Yellow Glasses,100606-SemiRimlessYellowGlasses,90,0,0.03%,0.00%,108,0,0.03%,0.00%,89.81%,0.00%,5,0,5.56%,0.00%,$54.75,$0.00,5,0
B07YGTK3FZ,B07YGS6YQB,Underboss Rick and Morty Adult Dimension Portal T-Shirt and Lounge Pants Pajama Set Multicoloured,RM0314-TShirtPantsPajamaSet-L,84,0,0.03%,0.00%,98,0,0.02%,0.00%,95.74%,0.00%,5,0,5.95%,0.00%,$149.95,$0.00,5,0
B08FF2LQ1R,B08FDYKJNT,Ghostbuster Venkman Adult Short Sleeve Costume T-Shirt with Back Print,G0MSC20-VenkmanShirt-L,46,2,0.01%,0.06%,56,2,0.01%,0.04%,94.23%,100.00%,5,0,10.87%,0.00%,$109.75,$0.00,5,0
B08FF2LQ1R,B08FF1LVWB,Ghostbuster ZEDDEMORE Adult Short Sleeve Costume T-Shirt with Back Print,FYMSC20-ZeddemoreShirt-XL,72,0,0.02%,0.00%,90,0,0.02%,0.00%,98.82%,0.00%,5,0,6.94%,0.00%,$109.75,$0.00,5,0
B08FF2LQ1R,B08FF1YK7C,Ghostbuster Venkman Adult Short Sleeve Costume T-Shirt with Back Print,G0MSC20-VenkmanShirt-XL,28,0,0.01%,0.00%,42,0,0.01%,0.00%,100.00%,0.00%,5,0,17.86%,0.00%,$109.75,$0.00,5,0
B07YBDSTJZ,B08GGD8HMS,Flint Tropics White Basketball Shorts Adult Halloween Costume,220783-FlintTropicShorts-L/XL,60,0,0.02%,0.00%,82,0,0.02%,0.00%,97.33%,0.00%,5,0,8.33%,0.00%,$184.75,$0.00,5,0
B08GQBCTTG,B08GQ91KHH,Jaws Shark Quint Adult Halloween Costume Complete Set Multicoloured,220767-QuintCostumeSet-L,21,0,0.01%,0.00%,29,0,0.01%,0.00%,76.00%,0.00%,5,0,23.81%,0.00%,$349.75,$0.00,5,0
B08GYB3TT6,B08GYCG2S7,Dodgeball Average Joe's Women's Halloween Costume Set,220757-AverageJoesWomensSet-M,34,0,0.01%,0.00%,39,0,0.01%,0.00%,97.06%,0.00%,5,0,14.71%,0.00%,$274.75,$0.00,5,0
B08J8DD8RV,B08J89X3JJ,Mad Engine Toy Story Buzz Lightyear All the Buzz Costume Pajama Shirt and Pants Set White,10068387-BuzzPajamaSet-XL,52,0,0.02%,0.00%,61,0,0.01%,0.00%,89.66%,0.00%,5,0,9.62%,0.00%,$244.75,$0.00,5,0
B08JQNVQFV,B08JQQ7PB2,Mad Engine Power Rangers Logo Halloween Costume Crew Socks (Blue),PKPR041-PowerRangersSocks-Blue,80,0,0.02%,0.00%,111,0,0.03%,0.00%,97.30%,0.00%,5,0,6.25%,0.00%,$49.75,$0.00,5,0
B08JQNVQFV,B08JRGQG3Q,Mad Engine Power Rangers Logo Halloween Costume Crew Socks (Green),PKPR042-PowerRangersSocks-Green,96,0,0.03%,0.00%,118,0,0.03%,0.00%,95.69%,0.00%,5,0,5.21%,0.00%,$49.75,$0.00,5,0
B08KSJLP51,B08KSKTHSZ,M&M's Candy Character Full Body Adult T-Shirt Tee Red,M&M-Red-ADULT-Shirt-L,63,1,0.02%,0.03%,74,1,0.02%,0.02%,95.00%,100.00%,5,0,7.94%,0.00%,$104.75,$0.00,5,0
B08LQMJN5L,B08LQPQKQF,"Power Rangers Pink Costume T-Shirt(Pink,XXL)",PowerRangers-Pink-SLShirt-2XL,156,6,0.05%,0.17%,195,10,0.05%,0.22%,60.45%,37.50%,5,0,3.21%,0.00%,$99.75,$0.00,5,0
B08LQMJN5L,B08LQT3JHD,"Power Rangers Blue Costume T-Shirt(Blue,3XL)",PowerRangers-Blue-SLShirt-3XL,671,5,0.20%,0.14%,773,8,0.18%,0.18%,63.23%,0.00%,5,0,0.75%,0.00%,$99.75,$0.00,5,0
B08TB5D1NV,B08TB5D1NV,Doctor Who Tardis Police Booth Hooded One Piece Pajama Costume Union Suit Blue,drwhokigurumi001,111,0,0.03%,0.00%,153,0,0.04%,0.00%,97.39%,0.00%,6,0,5.41%,0.00%,$149.70,$0.00,5,0
B08LQMJN5L,B08XJW4DB5,"Mighty Morphin Power Rangers Red Blue Yellow Pink Green Black White Blue Costume T-Shirt (Yellow, X-Large)",PowerRangers-Yellow-SLShirt-XL,225,8,0.07%,0.23%,281,9,0.07%,0.20%,39.69%,50.00%,5,0,2.22%,0.00%,$99.75,$0.00,5,0
B09DXKDKB8,B09DXK6W7S,"Power Rangers Mighty Morphin Yellow Boys Youth Armor Costume T-Shirt (LG, Yellow)",PRangersShirtYouth-Yellow-L,125,0,0.04%,0.00%,180,0,0.04%,0.00%,97.70%,0.00%,5,0,4.00%,0.00%,$99.75,$0.00,5,0
B09DXKDKB8,B09DXK78RJ,"Power Rangers Mighty Morphin Green Boys Youth Armor Costume T-Shirt(XS, Green)",PRangersShirtYouth-Green-XS,488,7,0.15%,0.20%,671,8,0.16%,0.18%,17.29%,16.67%,5,0,1.02%,0.00%,$99.75,$0.00,5,0
B09F16VD4T,B09F1528JW,Star Wars The Mandalorian Baby Yoda Pajamas Black Lounge Pants (Small),RWTM23BMN-BabyYodaPants-S,39,0,0.01%,0.00%,55,0,0.01%,0.00%,94.23%,0.00%,7,0,17.95%,0.00%,$111.65,$0.00,5,0
B09F7VYMP9,B09F7VYMP9,Karate Movie Mr Myagi Daniel Movie Headband Halloween Costume Cosplay,karateheadband1,158,1,0.05%,0.03%,195,1,0.05%,0.02%,98.46%,100.00%,5,0,3.16%,0.00%,$64.75,$0.00,5,0
B07CKFHYJT,B09G3GSDN4,Step Brothers Pablo Cruise Adult Gray and Maroon Raglan T-Shirt (3X-Large),stepbros010-3XL,27,0,0.01%,0.00%,29,0,0.01%,0.00%,100.00%,0.00%,5,0,18.52%,0.00%,$127.75,$0.00,5,0
B09H7NJJTR,B09H7NQKJX,Chucky Costume Good Guys Doll Child Halloween Cosplay (2T),220850-ChuckieCostume-2T,530,1,0.16%,0.03%,622,1,0.15%,0.02%,98.36%,100.00%,5,0,0.94%,0.00%,$319.95,$0.00,5,0
B09HL9G86S,B09HLB9FHC,Cousin Eddie Christmas White Shoes Halloween Costume Footwear (Numeric_11),100581-CousinEddieShoe-11,71,1,0.02%,0.03%,91,1,0.02%,0.02%,92.05%,100.00%,5,0,7.04%,0.00%,$374.95,$0.00,5,0
B09HN87WTD,B09HN6P3DJ,Legal Blonde Robe Women's Halloween Costume Cosplay Bathrobe (Blue),220841-Blonde-BlueRobe,96,6,0.03%,0.17%,146,11,0.03%,0.24%,93.66%,100.00%,5,1,5.21%,16.67%,$99.55,$19.75,5,1
B09HR7L8YM,B09HR7L8YM,Ripple Junction Naruto Cosplay Halloween Costume Jumpsuit Pajamas with Hood for Unisex Adults Orange,NSPH3266-NarutoPajamas,490,3,0.15%,0.09%,649,3,0.15%,0.07%,99.08%,100.00%,5,0,1.02%,0.00%,$249.75,$0.00,5,0
B07GC722RG,B09JCNVSR1,Dodgeball Average Joe's Adult Yellow Jersey Costume Set (X-Large),dodgeball003N-XL,84,0,0.03%,0.00%,95,0,0.02%,0.00%,100.00%,0.00%,5,0,5.95%,0.00%,$229.95,$0.00,5,0
B09LJ47KZM,B09LJ4NHDR,"COSTUME AGENT Jumbo Christmas Balls - 15/18/25/30 Inch Oversized Ornaments | Extra Large Giant Holiball Inflatable Ornaments for Indoor Outdoor Christmas Decorations, Weddings & Birthday Parties",102025-InfOrnament-18-Pink-FBA,111,5,0.03%,0.14%,140,8,0.03%,0.18%,98.40%,100.00%,6,1,5.41%,20.00%,$179.64,$29.69,5,1
B09LVT6QSS,B09LRD62R7,Ripple Junction Rick and Morty Monster Face Pattern Adult Lounge Pants,RMSA3879TV-RickMortyPants-L,113,0,0.03%,0.00%,134,0,0.03%,0.00%,99.22%,0.00%,6,0,5.31%,0.00%,$149.70,$0.00,5,0
B0B1JJVZFV,B0B1JJQQMK,"Custom Blanket with Personalized Photo and Name Superhero Fleece Blankets (Smash, 30x40 Fleece)",SHero-30x40fleece-Hulk,68,0,0.02%,0.00%,91,0,0.02%,0.00%,97.33%,0.00%,5,0,7.35%,0.00%,$169.75,$0.00,5,0
B0B8F5BTT3,B0B8F1DW3Z,South Colorado Kid Jacket and Gloves Deluxe Halloween Costume Cosplay,220905-KyleCostume-M,176,3,0.05%,0.09%,233,3,0.05%,0.07%,91.87%,100.00%,5,0,2.84%,0.00%,$224.95,$0.00,5,0
B0B8F5BTT3,B0B8F3WK24,South Colorado Kid Jacket and Gloves Deluxe Halloween Costume Cosplay,220905-KyleCostume-S,164,2,0.05%,0.06%,225,2,0.05%,0.04%,91.83%,100.00%,5,0,3.05%,0.00%,$224.95,$0.00,5,0
B0BHXX6CX3,B0B8GMNC94,"Cheetos Men's Chester Cheetah Fleece Costume Union Suit, Sun Orange/White, Small",ChesterCheetosSuit-S,278,3,0.08%,0.09%,348,3,0.08%,0.07%,71.30%,100.00%,5,0,1.80%,0.00%,$194.75,$0.00,5,0
B0B94SZLD5,B0B94VS7J2,Adult Unisex Marty McFly Denim Shirt Red Puffy Vest Halloween Cosplay Costume,220895-MartyMcflyCostume-L,32,0,0.01%,0.00%,50,0,0.01%,0.00%,88.89%,0.00%,5,0,15.63%,0.00%,$349.75,$0.00,5,0
B0BBHDTHX5,B0BBHFY1QL,Ninja Super Hero Turtle Eye Mask Halloween Costume Cosplay (Red),103013-TmntEyeMask-Red,41,1,0.01%,0.03%,50,3,0.01%,0.07%,100.00%,100.00%,14,10,34.15%,"1,000.00%",$81.00,$57.20,5,1
B0BKTNRYQT,B0BKTPCKT4,Adult Unisex Star Wars The Mandalorian Baby Yoda Character Soup Lounge Pants,RWTM23KMNP-BabyYodaSoupPants-L,21,0,0.01%,0.00%,27,0,0.01%,0.00%,100.00%,0.00%,5,0,23.81%,0.00%,$99.75,$0.00,5,0
B0BM5H22S7,B0BM556HXB,Spongebob Squarepants Pineapple House Lounge Pants,NDSS0K5M-PineappleHousePants-XL,40,1,0.01%,0.03%,49,1,0.01%,0.02%,97.78%,100.00%,5,1,12.50%,100.00%,$49.65,$9.85,5,1
B0B9YMJ1HL,B0C9G96PN7,"Rainbow Star Pink Pines Cartoon Cosplay Sweater, Full Knitted Halloween Costume",220892-MabelPinesSweater-XS,82,1,0.03%,0.03%,101,1,0.02%,0.02%,95.35%,100.00%,5,0,6.10%,0.00%,$245.75,$0.00,5,0
B07CLSVKTR,B000A5N868,"WWE Hulk Hogan Hulkamania Men's T-shirt, Gold XXL [Apparel]",hulk001-XXL,54,1,0.02%,0.03%,63,1,0.01%,0.02%,93.10%,100.00%,4,0,7.41%,0.00%,$91.80,$0.00,4,0
B07BZPQQZY,B000A5QYDM,Miami Vice Adult Black T-Shirt (Adult X-Large),miami036-XL,30,2,0.01%,0.06%,40,4,0.01%,0.09%,100.00%,100.00%,4,1,13.33%,50.00%,$79.60,$19.75,4,1
B07CLSVKTR,B000ANM1RW,"Hulk Hogan ""hulkamania"" T-shirt Gold (3X)",hulk001-XXXL,44,1,0.01%,0.03%,50,2,0.01%,0.04%,97.92%,100.00%,4,0,9.09%,0.00%,$91.80,$0.00,4,0
B07CHMY955,B000CD8V4M,Napoleon Dynamite Endurance T-Shirt Light Blue,pedro004-XL,47,1,0.01%,0.03%,52,1,0.01%,0.02%,86.27%,0.00%,4,0,8.51%,0.00%,$71.80,$0.00,4,0
B07C1BT38J,B000FI4RN8,Napoleon Dynamite Tina You Fat Lard T-Shirt Blue,pedro009-M,53,0,0.02%,0.00%,58,0,0.01%,0.00%,98.25%,0.00%,5,0,9.43%,0.00%,$84.75,$0.00,4,0
B07CKLCZBG,B000LNE66U,Dodgeball Adult Unisex Movie Average Joe's Team Halloween Cosplay T-Shirt Yellow,Joes001-S,12,0,0.00%,0.00%,13,0,0.00%,0.00%,84.62%,0.00%,5,0,41.67%,0.00%,$99.75,$0.00,4,0
B07BTQMG6B,B000WNLIP6,Office Space Initech Software Company Logo T-Shirt Gray,Offspace001-XL,24,0,0.01%,0.00%,27,0,0.01%,0.00%,100.00%,0.00%,4,0,16.67%,0.00%,$75.80,$0.00,4,0
B000WO1UXK,B000WO1UXK,Wristband Gold / Yellow Terry Cotton,hulkwristband,52,0,0.02%,0.00%,66,0,0.02%,0.00%,100.00%,0.00%,6,0,11.54%,0.00%,$10.74,$0.00,4,0
B07CBSCYDF,B000YY6HV8,Peanuts Charlie Brown Costume T-Shirt,Peanuts001-M,131,0,0.04%,0.00%,162,0,0.04%,0.00%,99.35%,0.00%,4,0,3.05%,0.00%,$87.80,$0.00,4,0
B07C4TCVBR,B0012O6H2S,SNL Saturday Night Live Christopher Walken More Cowbell Black T-Shirt (XXL),snl011-XXL,55,0,0.02%,0.00%,66,0,0.02%,0.00%,89.39%,0.00%,4,0,7.27%,0.00%,$79.80,$0.00,4,0
B00198LNU8,B00198NFE0,Flash Gordon Logo Red Ringer White T-Shirt Tee,flash002-L,71,3,0.02%,0.09%,85,4,0.02%,0.09%,10.00%,0.00%,4,0,5.63%,0.00%,$79.80,$0.00,4,0
B07BS4HVHV,B001PKZMSE,Napoleon Dynamite Adult Vote For Pedro T-Shirt and Accessory Kit (Large),napoleonaccesssory-L,18,0,0.01%,0.00%,23,0,0.01%,0.00%,95.24%,0.00%,4,0,22.22%,0.00%,$159.80,$0.00,4,0
B07CQYL3Y2,B001PKZWWK,"Napoleon Dynamite Complete Costume Kit: Adult Vote For Pedro T-Shirt, Accessory Kit and Moon Boots (Medium)",napoleonaccesssoryboots-M,52,1,0.02%,0.03%,65,2,0.02%,0.04%,91.53%,0.00%,10,0,19.23%,0.00%,$499.50,$0.00,4,0
B07CQYL3Y2,B001PKZWX4,"Napoleon Dynamite Complete Costume Kit: Adult Vote For Pedro T-Shirt, Accessory Kit and Moon Boots (Large)",napoleonaccesssoryboots-L,49,0,0.01%,0.00%,57,0,0.01%,0.00%,98.00%,0.00%,10,0,20.41%,0.00%,$499.50,$0.00,4,0
B0026PNI8I,B0026PJK2Q,The Big Lebowski Kaoru Betto Baseball Raglan T-Shirt (Adult Medium) Brown,bigl012-M,165,2,0.05%,0.06%,187,2,0.04%,0.04%,98.91%,100.00%,4,0,2.42%,0.00%,$115.80,$0.00,4,0
B07CQYWPTL,B002FC67RQ,Tuxedo Dumb Dumber Tux Costume Light Blue T-Shirt Tee,lightbluetux-L,23,0,0.01%,0.00%,35,0,0.01%,0.00%,96.88%,0.00%,4,0,17.39%,0.00%,$79.80,$0.00,4,0
B07BTPF7SS,B002FC8B9S,Tuxedo Dumb Dumber Tux Costume Orange T-Shirt Tee,orangetux-L,30,1,0.01%,0.03%,40,1,0.01%,0.02%,100.00%,100.00%,4,0,13.33%,0.00%,$79.80,$0.00,4,0
B0030ZRE3S,B002TZDTKW,"It's Always Sunny in Philadelphia Paddy's Irish Pub Men's T-Shirt,(Green/Large)",stpatricks009-L,99,0,0.03%,0.00%,119,0,0.03%,0.00%,55.34%,0.00%,4,0,4.04%,0.00%,$79.80,$0.00,4,0
B07CSCKQPZ,B002VRLO8W,"Sanford and Son ""Buy and Sell Junk T-Shirt Grey (XXXXX-Large 5X)",sanford064-5X,23,0,0.01%,0.00%,27,0,0.01%,0.00%,100.00%,0.00%,4,0,17.39%,0.00%,$75.80,$0.00,4,0
B003I86K9Q,B0037B7LYM,"Ripple Junction Men's The Hangover Baby Carrier T-Shirt,Light Blue,Medium",hangover001-M,94,0,0.03%,0.00%,120,0,0.03%,0.00%,92.92%,0.00%,4,0,4.26%,0.00%,$79.80,$0.00,4,0
B07C2M7LCQ,B003EH2T1O,Always Sunny In Philadelphia Flip Cup Flipadelphia Heather Gray T-Shirt Tee,alsunny015-M,30,0,0.01%,0.00%,42,0,0.01%,0.00%,82.50%,0.00%,5,0,16.67%,0.00%,$99.75,$0.00,4,0
B07CRH8JPJ,B003P4OWH0,Chuck Nerd Herd Logo Black Adult T-Shirt Tee,chucknbc002-L,32,0,0.01%,0.00%,37,0,0.01%,0.00%,93.94%,0.00%,4,0,12.50%,0.00%,$79.80,$0.00,4,0
B07CP4MWG5,B003TX3IB8,Legends of the Hidden Temple Green Monkeys Adult Costume T-Shirt Tee,legendstemplegreen-XL,42,0,0.01%,0.00%,53,0,0.01%,0.00%,97.92%,0.00%,4,0,9.52%,0.00%,$67.80,$0.00,4,0
B07CP4MWG5,B003TX5E7E,Legends of the Hidden Temple Green Monkeys Adult Costume T-Shirt Tee,legendstemplegreen-S,155,0,0.05%,0.00%,175,0,0.04%,0.00%,100.00%,0.00%,4,0,2.58%,0.00%,$67.80,$0.00,4,0
B07CP4MWG5,B003TX79MW,"Legends of the Hidden Temple Adult Costume T-Shirt Tee (XXL, Blue)",legendstempleblue-XXL,42,0,0.01%,0.00%,51,0,0.01%,0.00%,97.87%,0.00%,5,0,11.90%,0.00%,$84.75,$0.00,4,0
B07C62L4JJ,B003WRJ23O,Step Brothers Shoe Sneakers Hanging Black Adult T-Shirt Tee (XXL),stepbros001-XXL,69,0,0.02%,0.00%,74,0,0.02%,0.00%,94.59%,0.00%,4,0,5.80%,0.00%,$75.80,$0.00,4,0
B07BR4GFYJ,B0040TAU9I,The Heavyweights Tony Perkis Power Camp Hope Black Adult T-Shirt Tee,heavyweights001-XXL,147,0,0.04%,0.00%,191,0,0.05%,0.00%,98.40%,0.00%,4,0,2.72%,0.00%,$75.80,$0.00,4,0
B004BTXGRA,B004BTVRKS,Christmas Vacation Dedicate This House Green Adult T-Shirt Tee (Large),christmasvaca004-L,33,0,0.01%,0.00%,38,0,0.01%,0.00%,100.00%,0.00%,4,0,12.12%,0.00%,$63.80,$0.00,4,0
