(Parent) ASIN,(Child) ASIN,Title,SKU,Sessions - Total,Sessions - Total - B2B,Session Percentage - Total,Session Percentage - Total - B2B,Page Views - Total,Page Views - Total - B2B,Page Views Percentage - Total,Page Views Percentage - Total - B2B,Featured Offer (Buy Box) Percentage,Featured Offer (Buy Box) Percentage - B2B,Units Ordered,Units Ordered - B2B,Unit Session Percentage,Unit Session Percentage - B2B,Ordered Product Sales,Ordered Product Sales - B2B,Total Order Items,Total Order Items - B2B
B015G9UX9C,B015G9UX9C,Teenage Mutant Ninja Turtles 4 Felt Eye Masks,tmnteyemaskset,"2,968",47,0.91%,1.35%,"3,960",71,0.93%,1.56%,97.22%,97.18%,216,6,7.28%,12.77%,"$3,444.24",$94.74,179,5
B0054KMWQG,B0054KMWQG,Caddyshack Bushwood Country Club Red Baseball Cap Hat,caddyshackhat001,782,14,0.24%,0.40%,"1,046",19,0.25%,0.42%,99.71%,100.00%,146,4,18.67%,28.57%,"$2,584.08",$71.08,120,4
B08HSKFR18,B08HSKFR18,Costume Agent Peephole Picture Frame Tv Show Sitcom Yellow Door Frame,PeepholeFrame,"1,235",18,0.38%,0.52%,"1,612",24,0.38%,0.53%,98.76%,100.00%,116,1,9.39%,5.56%,"$1,618.06",$13.81,105,1
B016X4YE6W,B016X4YE6W,Fight Soap Salesman Red Sunglasses,fightclubglasses001,"3,074",5,0.94%,0.14%,"4,995",5,1.18%,0.11%,53.27%,20.00%,96,0,3.12%,0.00%,"$1,723.20",$0.00,95,0
B014Q6VNV8,B014Q6VNV8,Ripple Junction Caddyshack Movie Carl Spackler Character Camo Golf Bucket Hat,caddyshackhat003,747,10,0.23%,0.29%,"1,050",12,0.25%,0.26%,100.00%,83.33%,115,2,15.39%,20.00%,"$2,063.89",$35.54,94,2
B07BMD7NCZ,B07BMD7NCZ,Michael's Secret Stuff Office TV Show Halloween Cosplay Costume Prop Accessory,SecretStuffWaterBottle,"2,790",31,0.85%,0.89%,"3,455",41,0.82%,0.90%,96.64%,100.00%,97,0,3.48%,0.00%,"$1,838.15",$0.00,94,0
B09JT5NT8K,B09JT5NT8K,Soap Loofah Bubbles Adult Costume Set Cosplay,SoapLoofahCostume,695,0,0.21%,0.00%,"1,069",0,0.25%,0.00%,99.63%,0.00%,85,0,12.23%,0.00%,"$3,499.75",$0.00,84,0
B08NCQFD4Q,B08NCQFD4Q,Yellowstone Dutton Ranch Brand Logo Men's Adjustable Hat Black,6665614-yellowstobeBaseHat,"1,482",17,0.45%,0.49%,"2,122",21,0.50%,0.46%,44.11%,52.38%,92,0,6.21%,0.00%,"$2,203.40",$0.00,83,0
B07C5D48QB,B015L2QT56,Macho Man Star Printed Costume Bandana (Red),machomanbandana-Red,500,1,0.15%,0.03%,677,2,0.16%,0.04%,98.94%,100.00%,74,0,14.80%,0.00%,$958.30,$0.00,74,0
B009Q73R1M,B009Q73R1M,Caddyshack Bushwood Country Club Golf White Baseball Hat,caddyshackhat002,896,17,0.27%,0.49%,"1,263",21,0.30%,0.46%,61.20%,52.38%,85,1,9.49%,5.88%,"$1,950.52",$22.72,68,1
B009AWAOQ4,B009AWAOQ4,SOA Sons of Anarchy Reaper Crew Fitted Baseball Cap Hat (Adult Small/Medium) Black,soahat005-S/M,"1,644",11,0.50%,0.32%,"2,221",11,0.52%,0.24%,97.21%,100.00%,67,1,4.08%,9.09%,"$1,336.45",$19.75,66,1
B07BTW25WY,B0039VWOLA,Costume Agent Big Trouble Little China Fu Manchu White Men's Tank Top (Large),btlc004-L,436,7,0.13%,0.20%,592,9,0.14%,0.20%,98.60%,100.00%,66,1,15.14%,14.29%,"$1,514.47",$22.72,65,1
B09YT1P55X,B09YT1P55X,Costume Agent Cheeseburger Backpack Universe Hamburger Daypack One Size,CheeseburgerBackPack,"2,139",12,0.65%,0.34%,"3,012",13,0.71%,0.29%,98.41%,84.62%,68,1,3.18%,8.33%,"$2,920.17",$42.52,65,1
B005Y4I6VW,B005Y4I6VW,Fear and Loathing in Las Vegas Hunter S. Thompson Costume Sunglasses - Classic Large Metal Frame Sun Glasses for Adult,fearloathingglasses,925,11,0.28%,0.32%,"1,269",21,0.30%,0.46%,99.21%,100.00%,79,1,8.54%,9.09%,"$1,101.91",$13.81,63,1
B0BPV8H5PW,B0BPTR7ZF9,Costume Agent Spider Purple Pink Superhero Ghost Pajama Zip Up Jumpsuit with Hood (5/6),220965-GhostSpiderOnesie-5-6,"1,168",10,0.36%,0.29%,"1,443",12,0.34%,0.26%,99.36%,100.00%,60,0,5.14%,0.00%,"$1,977.00",$0.00,60,0
B001OV92PS,B001OV92PS,Adult Unisex MASH TV Show Medi-Vac Logo Olive Green Adjustable Baseball Hat,mashhat002,306,6,0.09%,0.17%,391,11,0.09%,0.24%,97.70%,100.00%,64,3,20.92%,50.00%,"$1,404.14",$65.19,57,3
B0099U0LZ6,B0099U0LZ6,Sons of Anarchy SOA Reaper Crew Fitted Baseball Cap Hat (Adult Large/X-Large) Black,soahat005-L/XL,"1,386",6,0.42%,0.17%,"1,831",7,0.43%,0.15%,95.52%,100.00%,61,4,4.40%,66.67%,"$1,337.44",$86.29,57,2
B07BTW25WY,B0039VQGT6,Costume Agent Big Trouble Little China Fu Manchu White Men's Tank Top (X-Large),btlc004-XL,311,3,0.09%,0.09%,399,3,0.09%,0.07%,98.66%,100.00%,55,0,17.68%,0.00%,"$1,262.25",$0.00,52,0
B07CKDD29N,B0019CEOXC,Rocky Balboa Apollo Movie Boxing American Flag Shorts (Large) Multicolor,ApolloShorts-L,913,10,0.28%,0.29%,"1,189",11,0.28%,0.24%,99.91%,90.00%,53,0,5.81%,0.00%,"$1,101.35",$0.00,49,0
B01M0USEIQ,B01M0USEIQ,Wayne's World Blow Up Guitar Music Costume Prop,blowupguitar,423,10,0.13%,0.29%,545,11,0.13%,0.24%,98.53%,63.64%,73,1,17.26%,10.00%,"$1,237.18",$16.78,46,1
B07CRL3XFJ,B000HQ6Q3C,"Hulk Hogan ""hulkamania"" Sleeveless T-shirt Gold [Apparel] Size: Large",hulk003-L,464,5,0.14%,0.14%,616,5,0.15%,0.11%,99.33%,66.67%,45,0,9.70%,0.00%,"$1,077.75",$0.00,45,0
B07YNZVV7G,B07YNZVV7G,Costume Agent Adult Unisex Bret Hitman Hart Wrestler Replica Wrap Around Halloween Sunglasses,BretHitmanSunglasses,"1,240",5,0.38%,0.14%,"1,519",5,0.36%,0.11%,98.68%,100.00%,53,1,4.27%,20.00%,"$1,216.12",$22.72,45,1
B09KS5M1P8,B0B72CH4FY,"Teenage Mutant Ninja Turtles TMNT Boys Costume Youth T-Shirt (SM, Raphael)",TMNTShirt-Youth-Raphael-S,356,2,0.11%,0.06%,451,3,0.11%,0.07%,98.56%,100.00%,48,0,13.48%,0.00%,$957.60,$0.00,45,0
B00KBB18IG,B001L6FYWG,The Simpsons Duff Beer Mens Red Adjustable Snap Back Hat,simpsonsduffhat,"1,101",7,0.34%,0.20%,"1,410",9,0.33%,0.20%,99.22%,100.00%,45,1,4.09%,14.29%,"$1,057.27",$23.27,44,1
B07CKXLQW7,B01JGYNHFK,"COSTUME AGENT Big Lebowski Costume Pajama - Sweater Pajama Pants from The Dude Costume Big Lebowski | Men Pajama for Halloween Costume, Cosplay, Comic Con, Everyday Use &amp; Themed Birthday Party",biglpants001-XL,380,6,0.12%,0.17%,464,12,0.11%,0.26%,98.56%,100.00%,47,1,12.37%,16.67%,"$1,595.31",$33.61,44,1
B08JZGFKGH,B07GK9B91K,"Teenage Mutant Ninja Turtles TMNT Mens Costume T-Shirt(Donatello,Medium)",tmnt016-Don-Mens-M,473,8,0.14%,0.23%,636,12,0.15%,0.26%,71.03%,66.67%,44,0,9.30%,0.00%,$877.80,$0.00,44,0
B016X4YD3G,B016X4YD3G,Scarface Tony Montana Black Gradiant Sunglasses,scarfaceglasses001,"1,047",8,0.32%,0.23%,"1,502",11,0.35%,0.24%,90.01%,90.91%,46,1,4.39%,12.50%,$733.70,$15.95,43,1
B09FJ3J485,B09FJ2Y36Z,Crew Mate Astronaut Among Space Halloween Costume Inflatable Chub Suit,220859-CrewMate-Red-STD,"1,271",11,0.39%,0.32%,"1,686",12,0.40%,0.26%,100.00%,100.00%,39,0,3.07%,0.00%,$910.10,$0.00,39,0
B07CRL3XFJ,B000HQAXJK,"Hulk Hogan ""hulkamania"" Sleeveless T-shirt Gold [Apparel] Size: X-Large",hulk003-XL,290,1,0.09%,0.03%,363,1,0.09%,0.02%,97.71%,0.00%,38,0,13.10%,0.00%,$910.10,$0.00,38,0
B07BTW25WY,B0039VUMJG,Costume Agent Big Trouble Little China Fu Manchu White Men's Tank Top (Medium),btlc004-M,560,4,0.17%,0.11%,723,5,0.17%,0.11%,99.01%,100.00%,36,0,6.43%,0.00%,$826.20,$0.00,36,0
B07XYDVKMS,B07XYDVKMS,Viking Furry Blue Hat Helmet Adult Halloween Costume Accessory,100600-BlueVikingHelmet,236,3,0.07%,0.09%,311,3,0.07%,0.07%,96.78%,100.00%,51,0,21.61%,0.00%,"$1,119.45",$0.00,36,0
B07CRL3XFJ,B000HQ6Q4Q,"Hulk Hogan ""hulkamania"" Sleeveless T-shirt Gold [Apparel] Size: XX-Large",hulk003-XXL,260,1,0.08%,0.03%,331,1,0.08%,0.02%,97.84%,100.00%,36,0,13.85%,0.00%,$898.20,$0.00,35,0
B07HPD9V7Q,B07HPD9V7Q,Unisex Ultimate Warrior Wrestler Halloween Cosplay Costume Wristband & Armbands,ultimatewarriorbandSet,386,6,0.12%,0.17%,530,8,0.13%,0.18%,99.06%,62.50%,38,1,9.84%,16.67%,$567.95,$14.80,35,1
B09KS5M1P8,B0934F1DB6,"Teenage Mutant Ninja Turtles TMNT Boys Costume Youth T-Shirt(X-Small, Raphael)",TMNTShirt-Youth-Raphael-XS,669,2,0.20%,0.06%,890,4,0.21%,0.09%,98.84%,100.00%,35,0,5.23%,0.00%,$698.25,$0.00,35,0
B09BRTSWCD,B09BRTSWCD,"Changes Yellowstone Dutton Ranch Y Logo Established 1886 Kevin stner Belt Buckle 66-57, Silver",6695057-yellowstoneBeltBuckle,680,5,0.21%,0.14%,897,5,0.21%,0.11%,77.59%,80.00%,35,0,5.15%,0.00%,$838.25,$0.00,35,0
B07HHHWTBS,B07HHHWTBS,Christmas Vacation Cousin Eddie White Robe and Belt Costume Set,CousinEddieWhiteRobe-220703,760,4,0.23%,0.11%,"1,039",7,0.25%,0.15%,99.42%,85.71%,35,1,4.61%,25.00%,"$1,539.21",$43.55,34,1
B0BPV8H5PW,B0BPTLD8CX,Costume Agent Spider Purple Pink Superhero Ghost Pajama Zip Up Jumpsuit with Hood (7/8),220965-GhostSpiderOnesie-7-8,310,1,0.09%,0.03%,368,1,0.09%,0.02%,97.46%,100.00%,34,0,10.97%,0.00%,"$1,120.30",$0.00,34,0
B08JZGFKGH,B07GJXTJFL,"Teenage Mutant Ninja Turtles TMNT Mens Costume T-Shirt(Michelangelo,Large)",tmnt016-Mike-Mens-L,564,6,0.17%,0.17%,776,8,0.18%,0.18%,53.73%,71.43%,32,0,5.67%,0.00%,$638.40,$0.00,32,0
B08JZGFKGH,B07GK2B88J,"Teenage Mutant Ninja Turtles TMNT Mens Costume T-Shirt(Raphael,Large)",tmnt016-Raph-Mens-L,510,9,0.16%,0.26%,661,11,0.16%,0.24%,58.65%,57.14%,32,0,6.27%,0.00%,$638.40,$0.00,32,0
B07CRL3XFJ,B000HQ6Q28,"Hulk Hogan ""Hulkamania"" Sleeveless T-shirt Gold [Apparel] Size: Medium",hulk003-M,239,2,0.07%,0.06%,303,3,0.07%,0.07%,96.83%,33.33%,31,0,12.97%,0.00%,$742.45,$0.00,31,0
B07CMXY86F,B0046BHE8U,TV Store Superhero Costume Felt Eye Masks Assorted Colors (Red),tmntmasks-Red,607,10,0.19%,0.29%,818,12,0.19%,0.26%,98.75%,100.00%,34,0,5.60%,0.00%,$134.30,$0.00,31,0
B07CMXY86F,B0046BL756,Superhero Costume Felt Eye Masks Assorted Colors (Blue),tmntmasks-Blue,285,7,0.09%,0.20%,383,9,0.09%,0.20%,97.27%,100.00%,34,2,11.93%,28.57%,$134.22,$7.82,31,2
B07BS3YC9C,B007W58NHI,Arrested Development Distressed Bluth's Original Frozen Banana Royal Blue Heather Mens T-shirt (Adult Large),arrested011-L,129,0,0.04%,0.00%,162,0,0.04%,0.00%,96.53%,0.00%,33,0,25.58%,0.00%,$664.35,$0.00,31,0
B008YOLRDS,B008YOLRDS,Serenity Firefly Jayne Ear Flap Knit Adult Hat Beanie,serenityhat001,308,11,0.09%,0.32%,399,15,0.09%,0.33%,97.74%,100.00%,32,0,10.39%,0.00%,$702.40,$0.00,31,0
B08JZGFKGH,B07GJWVGTD,"Teenage Mutant Ninja Turtles TMNT Mens Costume T-Shirt(Leonardo,Large)",tmnt016-Leo-Mens-L,708,14,0.22%,0.40%,"1,054",23,0.25%,0.50%,50.62%,47.06%,32,0,4.52%,0.00%,$638.40,$0.00,31,0
B09KS5M1P8,B0B72DPVB2,"Teenage Mutant Ninja Turtles TMNT Boys Costume Youth T-Shirt(SM, Michelangelo)",TMNTShirt-Youth-Mike-S,307,0,0.09%,0.00%,418,0,0.10%,0.00%,98.22%,0.00%,31,0,10.10%,0.00%,$618.45,$0.00,31,0
B0041E5DF8,B0041E5DF8,The Hangover Alan Man Purse Satchel Bag,hangoversatchel,682,11,0.21%,0.32%,849,12,0.20%,0.26%,97.41%,100.00%,30,0,4.40%,0.00%,"$1,199.70",$0.00,30,0
B07CMXY86F,B0046BEKLE,Superhero Costume Felt Eye Masks Assorted Colors (Purple),tmntmasks-Purple,147,1,0.04%,0.03%,194,1,0.05%,0.02%,94.92%,100.00%,33,1,22.45%,100.00%,$130.31,$3.91,30,1
B07CKFHYJT,B00BJQKCPC,Step Brothers Pablo Cruise Adult Gray and Maroon Raglan T-Shirt (Adult X-Large),stepbros010-XL,142,3,0.04%,0.09%,161,4,0.04%,0.09%,98.65%,100.00%,30,0,21.13%,0.00%,$759.50,$0.00,30,0
B00L1MJ3YA,B00L1MJ3YA,Costume Agent USA American Flag Cape Socks,usasocks001,389,9,0.12%,0.26%,478,10,0.11%,0.22%,99.37%,100.00%,34,1,8.74%,11.11%,$406.18,$11.83,30,1
B01L2EGI58,B01L2EGI58,Rocky Black Italian Stallion Boxer Shorts (Adult Medium),rockyshorts-M,379,3,0.12%,0.09%,532,5,0.13%,0.11%,99.06%,60.00%,31,0,8.18%,0.00%,$649.45,$0.00,30,0
B0BGMZRRYL,B0BGMZRRYL,Hangover Baby Carlos Doll Carrier and Glasses Halloween Costume Cosplay Accessory Multicolor,103015-BabyCarlosDollGlasses,635,10,0.19%,0.29%,812,11,0.19%,0.24%,96.06%,100.00%,31,0,4.88%,0.00%,"$1,052.45",$0.00,30,0
B07CKDD29N,B0019CEOXM,Rocky Balboa Mens Apollo Movie Boxing American Flag Shorts (X-Large),ApolloShorts-XL,518,8,0.16%,0.23%,646,8,0.15%,0.18%,99.84%,100.00%,29,0,5.60%,0.00%,$603.55,$0.00,29,0
B002EAURCK,B002EAURCK,House M.D. Oversized Tennis Ball,houseball,348,2,0.11%,0.06%,507,2,0.12%,0.04%,70.02%,100.00%,30,1,8.62%,50.00%,$522.34,$15.79,29,1
B002STMH70,B002STMH70,Saved by the Bell AC Slater Costume Wig,acwig,329,0,0.10%,0.00%,438,0,0.10%,0.00%,98.86%,0.00%,29,0,8.81%,0.00%,$491.55,$0.00,29,0
B0044M7KWQ,B0044M7KWQ,The Hangover Alan Movie Costume Sunglasses Glasses Replica,hangoverglasses,402,4,0.12%,0.11%,517,4,0.12%,0.09%,97.87%,100.00%,30,0,7.46%,0.00%,$509.70,$0.00,29,0
B07CKFHYJT,B00BJQKC16,Step Brothers Pablo Cruise Adult Gray and Maroon Raglan T-Shirt (Adult Large),stepbros010-L,165,3,0.05%,0.09%,196,4,0.05%,0.09%,96.72%,100.00%,28,1,16.97%,33.33%,$715.34,$25.69,28,1
B09RQ4KQPB,B00OPISZQE,RIC Flair Nature Boy Costume Robe and Wig Yellow,ricflare001-yellow,727,12,0.22%,0.34%,961,17,0.23%,0.37%,96.97%,100.00%,28,1,3.85%,8.33%,"$1,258.15",$44.50,28,1
B084PZDKRH,B07GSG8ZHL,Costume Agent Personalized Add Your Own Image Custom Adult Sublimation Capes White,CustomSublimationCape-BlackWhite,492,14,0.15%,0.40%,735,16,0.17%,0.35%,98.72%,81.25%,32,0,6.50%,0.00%,$704.40,$0.00,28,0
B07SNFJ9S2,B07SNFGHJC,Unisex Astronaut Spaceman Inflatable Chub-Suit Costume Jumpsuit (Adult) White,220066-SpacemenChubSuit-Adult,130,5,0.04%,0.14%,147,5,0.03%,0.11%,98.36%,100.00%,29,3,22.31%,60.00%,"$1,158.51",$118.77,28,2
B09KS5M1P8,B09345RR9J,"Teenage Mutant Ninja Turtles TMNT Boys Costume Youth T-Shirt(X-Small, Michelangelo)",TMNTShirt-Youth-Mike-XS,599,4,0.18%,0.11%,805,4,0.19%,0.09%,96.95%,100.00%,28,0,4.67%,0.00%,$558.60,$0.00,28,0
B00MEDQ1XQ,B09GL5NX9P,"Costume Agent A League of Their Own Costume 3 Pcs - Rockford Peaches Costume AAGPBL with Red Hat & Belt | Baseball Dress for Comic Con, Cosplay, Themed Birthday Party & Halloween Costumes for Women",leagueoftheirowncostume-FBA-L/XL,535,3,0.16%,0.09%,673,3,0.16%,0.07%,99.38%,100.00%,28,0,5.23%,0.00%,"$1,651.72",$0.00,28,0
B07BTW25WY,B0039VOALM,Costume Agent Big Trouble Little China Fu Manchu White Men's Tank Top (XX-Large),btlc004-XXL,160,3,0.05%,0.09%,207,3,0.05%,0.07%,98.34%,100.00%,27,0,16.88%,0.00%,$619.65,$0.00,27,0
B07C5J9R6F,B0054RW2D2,Scott Pilgrim vs. The World Movie Wristband (Green & White),scottpilgrimwristband-GreenandWhite,189,1,0.06%,0.03%,261,1,0.06%,0.02%,91.76%,100.00%,35,0,18.52%,0.00%,$208.25,$0.00,27,0
B09542LZPC,B00FBPL6CK,"Ripple Junction Average Joes Dodgeball Costume 2 Pcs - Adult Yellow Jersey from Dodgeball Movie | Halloween Costume for Men & Women | Cosplay, Roleplay, Comic Con & Halloween Sports Costume",dodgeball003-L,286,4,0.09%,0.11%,400,5,0.09%,0.11%,99.73%,80.00%,29,0,10.14%,0.00%,"$1,449.71",$0.00,27,0
B01LBRL76Q,B01LBRLFSQ,Caribbean Pirate Black Costume Boots (Small 8-9),100576BLACK-S,"2,035",22,0.62%,0.63%,"2,915",27,0.69%,0.59%,99.75%,95.65%,27,0,1.33%,0.00%,"$2,050.65",$0.00,27,0
B07RJYX1Y6,B07RJYX1Y6,"Concept One Disney's Pixar Up Wilderness Explorer Cotton Adjustable Baseball Hat with Curved Brim, Yellow, One Size",EMUP2001TV-UpHat,"1,087",10,0.33%,0.29%,"1,563",16,0.37%,0.35%,45.55%,31.25%,28,0,2.58%,0.00%,$586.60,$0.00,27,0
B0887M6B4H,B0887TD8ZM,Hollywood Champion Adult White T-Shirt,3001-White-ChampionShirt-L,200,0,0.06%,0.00%,238,0,0.06%,0.00%,100.00%,0.00%,28,0,14.00%,0.00%,$642.60,$0.00,27,0
B09KS8CDXM,B09KS7VKZ3,It's Always Sunny in Philadelphia Paddy's Irish Pub Adjustable Hat (Dark Green),SUHT2185-PaddysHat-DarkGreen,246,2,0.08%,0.06%,371,3,0.09%,0.07%,99.44%,100.00%,27,0,10.98%,0.00%,$673.65,$0.00,27,0
B001GN1H0M,B001GN1H0M,BATMAN Halloween Costume Cosplay The Dark Knight Jok Aer Playing Cards Accessory,jokercards,663,4,0.20%,0.11%,891,10,0.21%,0.22%,93.49%,100.00%,27,0,4.07%,0.00%,$457.65,$0.00,26,0
B003SXGN7K,B003SXGN7K,Community Troy and Abed Mug,communitymug,255,2,0.08%,0.06%,377,4,0.09%,0.09%,94.43%,100.00%,29,0,11.37%,0.00%,$594.55,$0.00,26,0
B00U0HTJ2S,B00U0HTJ2S,Adult Unisex National Lampoon's Vacation Walley World Marty Moose Beanie Hat Red,VAWX2011-MooseHat,233,6,0.07%,0.17%,304,7,0.07%,0.15%,99.01%,100.00%,48,3,20.60%,50.00%,$717.15,$44.40,26,2
B07XLVBQM4,B07XLVBQM4,The Queen of Music Studded Belt and Armband Adult Halloween Costume Accessory Cosplay,100980-TheQueenMusicBeltArmband,350,2,0.11%,0.06%,499,5,0.12%,0.11%,77.15%,100.00%,28,1,8.00%,50.00%,$858.30,$29.65,26,1
B0B4F8PR2W,B0B4F8PR2W,Christmas Vacation Cousin Eddie White Robe Belt and Trapper Faux Hat Costume Set,CousinEdRobe-Hat-SET,263,1,0.08%,0.03%,379,1,0.09%,0.02%,99.47%,100.00%,27,0,10.27%,0.00%,"$1,672.65",$0.00,26,0
B07CBCX8VV,B001C40Y1I,"The Office Michael Scott's Fun Run Race Blue T-Shirt Tee, Large",Office008-L,208,1,0.06%,0.03%,248,1,0.06%,0.02%,99.16%,100.00%,26,0,12.50%,0.00%,$488.54,$0.00,25,0
B07CMXY86F,B0046BL74W,TV Store Superhero Costume Felt Eye Masks Assorted Colors (Orange),tmntmasks-Orange,171,3,0.05%,0.09%,249,3,0.06%,0.07%,96.15%,100.00%,30,0,17.54%,0.00%,$118.50,$0.00,25,0
B07CMHJ9J7,B00CMQWQAC,Los Pollos Hermanos Logo T-Shirt Tee Navy,breakingbad004navy-L,371,5,0.11%,0.14%,516,6,0.12%,0.13%,99.07%,100.00%,26,0,7.01%,0.00%,$518.70,$0.00,25,0
B07BNVPY2K,B01JSFN2Y8,DC Comics Suicide Squad Harley Quinn DELUXE Sequins Panty (Small) Red/Blue,suicidesquad004-FBA-S,594,12,0.18%,0.34%,815,26,0.19%,0.57%,99.75%,96.15%,25,1,4.21%,8.33%,$723.46,$28.66,25,1
B07GBKJVJF,B07GBJQ76X,Star Wars Imperial Officer Metal Aplique Twil Cap (Olive),ImperialOfficerCap-ECSW2060TV-Olive,470,4,0.14%,0.11%,675,6,0.16%,0.13%,100.00%,100.00%,25,0,5.32%,0.00%,$448.75,$0.00,25,0
B0BGVMPWHQ,B0BGVMPWHQ,Golfing Colorful Judge Smails Halloween Costume Fedora Hat,220930-CaddyShackHat,241,4,0.07%,0.11%,317,5,0.07%,0.11%,100.00%,100.00%,29,0,12.03%,0.00%,$848.55,$0.00,25,0
B006A9VGO4,B006A9VGO4,"Glass Das Boot Beer Mug 2 Liter As Seen in Beerfest, Garden, Lawn, Maintenance",beerfestdasboot2liter1,341,5,0.10%,0.14%,425,6,0.10%,0.13%,97.88%,83.33%,39,0,11.44%,0.00%,$622.05,$0.00,24,0
B07CKFHYJT,B00BJQKHJI,Step Brothers Pablo Cruise Adult Gray and Maroon Raglan T-Shirt (Adult XX-Large),stepbros010-XXL,216,2,0.07%,0.06%,254,3,0.06%,0.07%,99.17%,100.00%,24,0,11.11%,0.00%,$609.80,$0.00,24,0
B09KS5M1P8,B0934326MZ,"Teenage Mutant Ninja Turtles TMNT Boys Costume Youth T-Shirt(SM, Donatello)",TMNTShirt-Youth-Donatello-S,308,3,0.09%,0.09%,377,3,0.09%,0.07%,98.03%,100.00%,24,1,7.79%,33.33%,$478.60,$19.75,24,1
B09BXCJ37S,B09BXCJ37S,UP Deluxe Halloween Costume Russell Cosplay Complete Set,220839-SashFlag,932,19,0.28%,0.54%,"1,265",22,0.30%,0.48%,96.44%,100.00%,24,0,2.58%,0.00%,"$1,630.80",$0.00,24,0
B09KS5M1P8,B0B72BKG2W,"Teenage Mutant Ninja Turtles TMNT Boys Costume Youth T-Shirt(MD, Michelangelo)",TMNTShirt-Youth-Mike-M,249,1,0.08%,0.03%,330,2,0.08%,0.04%,96.62%,100.00%,24,0,9.64%,0.00%,$478.80,$0.00,24,0
B07CKXLQW7,B01JGYNNYU,"COSTUME AGENT Big Lebowski Costume Pajama - Sweater Pajama Pants from The Dude Costume Big Lebowski | Men Pajama for Halloween Costume, Cosplay, Comic Con, Everyday Use &amp; Themed Birthday Party",biglpants001-L,516,8,0.16%,0.23%,656,8,0.15%,0.18%,99.68%,100.00%,24,1,4.65%,12.50%,$814.46,$33.61,23,1
B09KS5M1P8,B0933PQFMK,"Teenage Mutant Ninja Turtles TMNT Boys Costume Youth T-Shirt(MD, Donatello)",TMNTShirt-Youth-Donatello-M,259,1,0.08%,0.03%,325,1,0.08%,0.02%,98.31%,100.00%,23,0,8.88%,0.00%,$458.85,$0.00,23,0
B09J1H1SWW,B09J1H1SWW,Mad Engine Simpsons Character All Over Backpack One Size Multicolor,99MUL-SimpsonsBackpack,529,5,0.16%,0.14%,764,11,0.18%,0.24%,99.61%,100.00%,23,0,4.35%,0.00%,"$1,125.85",$0.00,23,0
B0BF6PFKLT,B0BF6PFKLT,Ghost Ghoul Hunter Gloves and Belt Set Buster Halloween Costume,220941-GhostbustersGlovesBeltSet,572,2,0.17%,0.06%,766,2,0.18%,0.04%,98.30%,100.00%,29,2,5.07%,100.00%,"$1,013.20",$69.55,23,2
B07CSCKQPZ,B000BBDZRS,Sanford and Son Adult Unisex 1970s TV Show Redd Foxx Buy and Sell Junk T-Shirt Grey,sanford064-XXL,166,2,0.05%,0.06%,194,2,0.05%,0.04%,98.90%,0.00%,22,0,13.25%,0.00%,$416.90,$0.00,22,0
B07YZTT6F3,B00U0IHLE0,Ripple Junction The Big Lebowski Team Dude Bowling Gold Button-Down Shirt Costume (Adult X-Large),bigldudecostume001-XL,431,8,0.13%,0.23%,533,9,0.13%,0.20%,100.00%,100.00%,23,2,5.34%,25.00%,$918.05,$79.10,22,2
B07H4ZXX3F,B07H4YSWZZ,Giraffe Inflatable Halloween Costume Cosplay Jumpsuit (Adult),InflatableGiraffe-Adult,281,5,0.09%,0.14%,357,7,0.08%,0.15%,98.78%,83.33%,22,1,7.83%,20.00%,$879.38,$39.59,22,1
B09CR9V2F5,B09CRRLYX7,Costume Agent Willy's Wonderland The Janitor Blue T-Shirt,WillysWonderland-Shirt-M,129,2,0.04%,0.06%,156,2,0.04%,0.04%,94.41%,100.00%,23,0,17.83%,0.00%,$573.85,$0.00,22,0
B072SCMW48,B002SBIA6A,"Rowdy Roddy Piper Hot Rod Wrestling White Adult T-shirt Tee, XL",roddypiper001-XL,267,2,0.08%,0.06%,366,3,0.09%,0.07%,99.17%,100.00%,22,0,8.24%,0.00%,$482.90,$0.00,21,0
B07BV1W8GN,B004TNCJGM,Hangover The Alan Baby Bjorn With Graphic Human Tree Dark Khaki Adult Costume T-Shirt Tee (Large),hangover014-L,186,3,0.06%,0.09%,234,4,0.06%,0.09%,99.13%,75.00%,21,0,11.29%,0.00%,$460.95,$0.00,21,0
B00XLQUJ06,B00XLQUJ06,TMNT Teenage Mutant Ninja Turtles Multi Character Snack Container,tmntsnack001,728,7,0.22%,0.20%,960,9,0.23%,0.20%,98.65%,100.00%,21,0,2.88%,0.00%,$145.95,$0.00,21,0
B08JZGFKGH,B07GJYJCJZ,"Teenage Mutant Ninja Turtles TMNT Mens Costume T-Shirt(Donatello,X-Large)",tmnt016-Don-Mens-XL,667,9,0.20%,0.26%,860,11,0.20%,0.24%,51.09%,66.67%,21,2,3.15%,22.22%,$418.55,$39.50,21,2
B07JGYY715,B07JGYY715,Halloween Costume Accessory Hollywood Black Bandana,hollywoodbandana,169,0,0.05%,0.00%,215,0,0.05%,0.00%,98.60%,0.00%,22,0,13.02%,0.00%,$262.90,$0.00,21,0
B09KS5M1P8,B0934G8T62,"Teenage Mutant Ninja Turtles TMNT Boys Costume Youth T-Shirt(X-Small, Donatello)",TMNTShirt-Youth-Donatello-XS,552,2,0.17%,0.06%,705,2,0.17%,0.04%,96.61%,100.00%,21,0,3.80%,0.00%,$418.95,$0.00,21,0
B09KS5M1P8,B0934GHNC8,"Teenage Mutant Ninja Turtles TMNT Boys Costume Youth T-Shirt(LG, Leonardo)",TMNTShirt-Youth-Leonardo-L,548,1,0.17%,0.03%,740,2,0.17%,0.04%,97.39%,100.00%,21,0,3.83%,0.00%,$418.95,$0.00,21,0
B07CBSCYDF,B000YY4LIY,Peanuts Charlie Brown Costume T-Shirt (Adult X-Large),Peanuts001-XL,170,1,0.05%,0.03%,209,2,0.05%,0.04%,100.00%,0.00%,20,0,11.76%,0.00%,$439.00,$0.00,20,0
B07BV1W8GN,B004TNCJM6,Hangover The Alan Baby Bjorn With Graphic Human Tree Dark Khaki Adult Costume T-Shirt Tee (X-Large),hangover014-XL,147,0,0.04%,0.00%,179,0,0.04%,0.00%,96.45%,0.00%,21,0,14.29%,0.00%,$460.95,$0.00,20,0
B07CR1X62V,B009OL32A6,The Heavyweights Tony Perkis Power Camp Hope Black Adult Sleeveless Tank Top (Adult X-Large),heavyweights001TANK-XL,198,0,0.06%,0.00%,248,0,0.06%,0.00%,99.60%,0.00%,21,0,10.61%,0.00%,$397.95,$0.00,20,0
B00K34OI06,B00K34OI06,Progressive Flo Costume Set Standard White,flocostume001,"1,709",10,0.52%,0.29%,"2,149",13,0.51%,0.29%,99.95%,100.00%,22,0,1.29%,0.00%,$988.90,$0.00,20,0
B01JSH2B0C,B01JSFMZF0,Suicide Squad Harley Quinn Daddy's Little Monster Women's Top with Rips (X-Large) White/Red,suicidesquad003-XL,748,10,0.23%,0.29%,985,11,0.23%,0.24%,99.38%,100.00%,20,0,2.67%,0.00%,$579.00,$0.00,20,0
B07BNVPY2K,B01JSFN5NQ,DC Comics Suicide Squad Harley Quinn Deluxe Sequins Panty (Medium) Red/Blue,suicidesquad004-M,687,10,0.21%,0.29%,959,17,0.23%,0.37%,98.83%,100.00%,20,0,2.91%,0.00%,$595.00,$0.00,20,0
B08JZGFKGH,B07GJXVPS9,"Teenage Mutant Ninja Turtles TMNT Mens Costume T-Shirt(Donatello,Large)",tmnt016-Don-Mens-L,531,12,0.16%,0.34%,683,14,0.16%,0.31%,43.29%,45.45%,20,1,3.77%,8.33%,$398.80,$19.75,20,1
B07JD991N3,B07JBKN118,Nickelodeon Boys Henry Danger Costume Pajama Set (Boys Size 8),HenryDangerSet-BLLTV-8,913,8,0.28%,0.23%,"1,196",8,0.28%,0.18%,99.92%,100.00%,21,0,2.30%,0.00%,$586.95,$0.00,20,0
B0BKTG5GTZ,B0BKTGQBXZ,Kool Aid Trek Day Tie Dye T-Shirt for Mens and Womens Multicolor,HEKA00ZMSC-KoolAidShirt-L,630,10,0.19%,0.29%,774,10,0.18%,0.22%,99.74%,100.00%,26,0,4.13%,0.00%,$260.00,$0.00,20,0
B000H6PAGG,B000H6PAGG,X-Men Z69 BELT BUCKLE,RO-ARWZ-IIN8,550,3,0.17%,0.09%,739,6,0.17%,0.13%,98.65%,100.00%,19,1,3.45%,33.33%,$378.85,$19.75,19,1
B072SCMW48,B002SBCHYQ,"Rowdy Roddy Piper Hot Rod Wrestling White Adult T-shirt Tee, Large",roddypiper001-L,145,0,0.04%,0.00%,176,0,0.04%,0.00%,98.19%,0.00%,19,0,13.10%,0.00%,$417.05,$0.00,19,0
B013RJ5K14,B0147ARPAG,"Costume Agent Left Shark Costume Adult - Shark Costume Adults | Katy Perry Shark Halloween Costume for Men | Perfect Mascot Costume for Cosplay, Comic Con, Theme Birthday & Gender Reveal Party",sharkcostume-XXL,641,7,0.20%,0.20%,819,9,0.19%,0.20%,56.91%,28.57%,19,2,2.96%,28.57%,"$1,327.65",$138.50,19,2
B07FK33CZ5,B07FK2LT7J,NWO New World Order Red Ink Adult Black T-Shirt (X-Large),nwo003-XL,160,2,0.05%,0.06%,180,2,0.04%,0.04%,98.82%,100.00%,21,1,13.13%,50.00%,$460.73,$21.73,19,1
B08LDVVLHK,B07YX94S4T,Indiana J Holy Grail Cup Replica Halloween Costume Cosplay Prop (1 Pack),IndianaJHolyGrailCup,320,2,0.10%,0.06%,396,3,0.09%,0.07%,98.47%,100.00%,19,0,5.94%,0.00%,$284.05,$0.00,19,0
B08LQMJN5L,B08LQVG2JB,"Power Rangers Red Costume T-Shirt(Red,Large)",PowerRangers-Red-SLShirt-L,360,6,0.11%,0.17%,480,6,0.11%,0.13%,52.82%,33.33%,19,1,5.28%,16.67%,$378.85,$19.75,19,1
B09V8K2ZYY,B09V964G5D,Costume Agent New World Wrestling Adult Black T-shirt (X-Large),nwo002N-XL,73,1,0.02%,0.03%,90,1,0.02%,0.02%,84.42%,100.00%,21,1,28.77%,100.00%,$398.80,$19.75,19,1
B0BGQLJVDB,B0BGQPD86B,"Christmas Green Monster Furry Jumpsuit Shoes Gloves and Mask Halloween Costume Cosplay (Green Monster Standard Mask, L/XL)",GreenMonsterSuit-Mask1-L-XL,199,9,0.06%,0.26%,293,10,0.07%,0.22%,97.87%,100.00%,19,3,9.55%,33.33%,"$1,077.30",$178.05,19,3
B0BKTG5GTZ,B0BKTGLVKL,Kool Aid Trek Day Tie Dye T-Shirt for Mens and Womens Multicolor,HEKA00ZMSC-KoolAidShirt-XL,153,1,0.05%,0.03%,175,1,0.04%,0.02%,96.97%,100.00%,21,0,13.73%,0.00%,$210.00,$0.00,19,0
B07BS3YC9C,B007W58NMI,Arrested Development Distressed Bluth's Original Frozen Banana Royal Blue Heather Mens T-shirt (Adult X-Large),arrested011-XL,120,1,0.04%,0.03%,157,1,0.04%,0.02%,95.14%,100.00%,21,0,17.50%,0.00%,$424.95,$0.00,18,0
B07BTWHSXB,B0084DMJCC,Eastbound & Down Myrtle Beach Mermen 55 T-Shirt (X-Large) Carolina Blue,eastbound018-XL,146,1,0.04%,0.03%,195,1,0.05%,0.02%,97.28%,100.00%,18,0,12.33%,0.00%,$395.10,$0.00,18,0
B07CMHJ9J7,B00CMQWROM,Los Pollos Hermanos Logo T-Shirt Tee,breakingbad004navy-XL,151,1,0.05%,0.03%,210,1,0.05%,0.02%,97.49%,100.00%,19,0,12.58%,0.00%,$379.05,$0.00,18,0
B015TM9GTE,B015TM9GTE,Joy Inside Out Blue Costume Wig,insideoutjoywig,246,8,0.08%,0.23%,324,11,0.08%,0.24%,94.44%,100.00%,18,1,7.32%,12.50%,$340.91,$18.76,18,1
B07BTFD7NQ,B07BTFD7NQ,Hulk Hogan Hulkamania Red Feather Boa,redboa001N,147,1,0.04%,0.03%,168,1,0.04%,0.02%,98.81%,100.00%,19,0,12.93%,0.00%,$189.81,$0.00,18,0
