B07BX6YWQD,B005FRCDW6,GLee Logo Rhinestones Hot Pink Juniors T-Shirt Tee (Juniors Small),glee012-S,21,0,0.01%,0.00%,32,0,0.01%,0.00%,96.55%,0.00%,2,0,9.52%,0.00%,$39.90,$0.00,2,0
B002W8PVGG,B005JEFI5Y,Power Rangers The Green Rangers Costume T-Shirt Tee (XXXL (3X)),powerrangers009-XXXL,20,0,0.01%,0.00%,22,0,0.01%,0.00%,90.91%,0.00%,2,0,10.00%,0.00%,$43.90,$0.00,2,0
B00MEDQ1XQ,B005MYCCJQ,"Costume Agent A League of Their Own Costume 3 Pcs - Rockford Peaches Costume AAGPBL with Red Hat & Belt | Baseball Dress for Comic Con, Cosplay, Themed Birthday Party & Halloween Costumes for Women",leagueoftheirowncostume-FBA-S-M,49,0,0.02%,0.00%,60,0,0.02%,0.00%,100.00%,0.00%,2,0,4.08%,0.00%,$117.98,$0.00,2,0
B07BYYL6NT,B005N02EKG,"TV Store Hulk Hogan Hulkamania Adult Complete Costume Set (Adult Small, Yellow Sunglasses/Red Bandana)",hulkhogancostumesetYELsunREDban-S,58,0,0.02%,0.00%,71,0,0.02%,0.00%,100.00%,0.00%,2,0,3.45%,0.00%,$125.98,$0.00,2,0
B07BYYL6NT,B005N02ELA,TV Store Wrestler Halloween Costume Hogan Mania Deluxe Complete Set Cosplay Party Outfit,hulkhogancostumesetREDsunREDban-3X,62,0,0.02%,0.00%,72,0,0.02%,0.00%,94.59%,0.00%,2,0,3.23%,0.00%,$125.98,$0.00,2,0
B07BYYL6NT,B005N02EMY,TV Store Wrestler Halloween Costume Hogan Mania Deluxe Complete Set Cosplay Party Outfit,hulkhogancostumesetREDsunREDban-M,188,0,0.06%,0.00%,264,0,0.07%,0.00%,98.85%,0.00%,2,0,1.06%,0.00%,$125.98,$0.00,2,0
B07BYYL6NT,B005N02EO2,Wrestler Halloween Costume Hogan Mania Deluxe Complete Set Cosplay Party Outfit,hulkhogancostumesetYELsunYELban-XL,100,1,0.03%,0.03%,131,2,0.03%,0.05%,99.24%,100.00%,2,0,2.00%,0.00%,$125.98,$0.00,2,0
B07BYYL6NT,B005N02EQ0,TV Store Wrestler Halloween Costume Hogan Mania Deluxe Complete Set Cosplay Party Outfit,hulkhogancostumesetYELsunREDban-L,39,1,0.01%,0.03%,47,1,0.01%,0.02%,95.45%,100.00%,2,0,5.13%,0.00%,$125.98,$0.00,2,0
B07C3H94X7,B005RF3ZQO,Chuck Buy More Electronics Store Employee Green Costume Tee Polo (Adult XX-Large),chucknbc003-XXL,20,0,0.01%,0.00%,26,0,0.01%,0.00%,87.50%,0.00%,2,0,10.00%,0.00%,$59.90,$0.00,2,0
B07C3H94X7,B005RF3ZRS,Chuck Buy More Electronics Store Employee Green Costume Tee Polo (Adult Large),chucknbc003-L,25,0,0.01%,0.00%,31,0,0.01%,0.00%,92.86%,0.00%,3,0,12.00%,0.00%,$89.85,$0.00,2,0
B0921MX3VQ,B005T77N4A,Ghostbusters Full Venkman's Costume with Backpack Print Sand Adult T-Shirt Tee (Adult XXX-Large),ghost016-XXXL,37,1,0.01%,0.03%,52,1,0.01%,0.02%,96.15%,100.00%,2,0,5.41%,0.00%,$39.90,$0.00,2,0
B07BKP93SV,B005T77UV6,Ghostbusters Executioner Stantz Full Costume with Backpack Print Sand Adult T-Shirt Tee (Adult XX-Large),ghost017-XXL,16,0,0.01%,0.00%,27,0,0.01%,0.00%,96.30%,0.00%,2,0,12.50%,0.00%,$39.90,$0.00,2,0
B07CQYF4MT,B005UNJCOW,Tootsie Roll Fruit Rolls Candy Vanilla Aqua Costume Tank Dress (Juniors Small),tootsiecolortankAqua-S,34,0,0.01%,0.00%,46,0,0.01%,0.00%,95.35%,0.00%,2,0,5.88%,0.00%,$29.90,$0.00,2,0
B07CQYF4MT,B005UNJCWO,Tootsie Roll Fruit Rolls Candy Vanilla Aqua Costume Tank Dress (Juniors Medium),tootsiecolortankAqua-M,23,1,0.01%,0.03%,38,1,0.01%,0.02%,100.00%,100.00%,2,0,8.70%,0.00%,$29.90,$0.00,2,0
B07CQYF4MT,B005UNJCYC,Tootsie Roll Fruit Rolls Candy Orange Costume Tank Dress (Juniors Small),tootsiecolortankOrange-S,36,0,0.01%,0.00%,55,0,0.01%,0.00%,97.87%,0.00%,2,0,5.56%,0.00%,$29.90,$0.00,2,0
B07CQYF4MT,B005UNJDLO,Tootsie Roll Fruit Rolls Candy Orange Costume Tank Dress (Juniors Large),tootsiecolortankOrange-L,20,0,0.01%,0.00%,24,0,0.01%,0.00%,100.00%,0.00%,2,0,10.00%,0.00%,$29.90,$0.00,2,0
B07CQYF4MT,B005UNJE3Q,Tootsie Roll Fruit Rolls Candy Cherry Pink Costume Tank Dress (Juniors Medium),tootsiecolortankPink-M,31,1,0.01%,0.03%,51,3,0.01%,0.07%,97.87%,100.00%,2,0,6.45%,0.00%,$29.90,$0.00,2,0
B07CRNFFXD,B005URKK8U,Heinz Ketchup Red Juniors Tank Dress (Juniors Large),heinztankdressketchup-L,32,0,0.01%,0.00%,38,0,0.01%,0.00%,100.00%,0.00%,2,0,6.25%,0.00%,$55.90,$0.00,2,0
B07BMVR6ZV,B005XCT8W6,Sun Drop Citrus Soda Green Costume Juniors T-Shirt Tee (Juniors Large),sundrop001-L,28,0,0.01%,0.00%,32,0,0.01%,0.00%,100.00%,0.00%,2,0,7.14%,0.00%,$39.90,$0.00,2,0
B07BMVR6ZV,B005XCT998,Sun Drop Citrus Soda Green Costume Juniors T-Shirt Tee (Juniors X-Large),sundrop001-XL,19,0,0.01%,0.00%,27,0,0.01%,0.00%,96.15%,0.00%,2,0,10.53%,0.00%,$39.90,$0.00,2,0
B07C2C7K58,B007EZB1K2,Sun Drop Citrus Soda Green Costume Mens T-shirt (Adult XX-Large),sundrop001MENS-XXL,33,0,0.01%,0.00%,55,0,0.01%,0.00%,98.11%,0.00%,2,0,6.06%,0.00%,$43.90,$0.00,2,0
B07C5CW9MR,B007XHTP9U,Revenge of the Nerds Tri Lambda Black with White Mens Cardigan Sweater (Adult Medium),revengenerds005-M,55,2,0.02%,0.06%,75,2,0.02%,0.05%,94.44%,100.00%,2,0,3.64%,0.00%,$109.90,$0.00,2,0
B07CBQC87S,B0081GKTWE,Green Lantern The Logo with Striped Sleeves Green Adult T-Shirt Tee,greenlantern001stripes-XXXL,31,0,0.01%,0.00%,38,0,0.01%,0.00%,88.46%,0.00%,2,0,6.45%,0.00%,$47.90,$0.00,2,0
B07CN77BHQ,B0085N9E2O,Seinfeld #1 Dad Light Blue Mens T-Shirt (Adult Medium),sein034-M,24,1,0.01%,0.03%,27,1,0.01%,0.02%,92.00%,100.00%,2,0,8.33%,0.00%,$35.90,$0.00,2,0
B07CN77BHQ,B0085N9FVO,Seinfeld #1 Dad Light Blue Mens T-Shirt (Adult XX-Large),sein034-XXL,19,0,0.01%,0.00%,23,0,0.01%,0.00%,71.43%,0.00%,2,0,10.53%,0.00%,$35.90,$0.00,2,0
B07CFKWPKG,B0085NX5RE,How I Met Your Mother Black Silk Pajama Suit with White Shirt (Black) (Mens Large),suitpajamas001black-L,132,1,0.04%,0.03%,164,1,0.04%,0.02%,97.45%,100.00%,2,0,1.52%,0.00%,$119.90,$0.00,2,0
B07CRGMVLT,B008BVEP1U,The Big Bang Theory Soft Kitty Warm Kitty BLACK Juniors T-Shirt (Juniors Medium),bigbang017JrsBLACK-M,7,1,0.00%,0.03%,7,1,0.00%,0.02%,50.00%,100.00%,2,0,28.57%,0.00%,$39.90,$0.00,2,0
B008H3RKAK,B008H3RKAK,Spider-Man Blue Juniors Costume Tunic Tank Dress,spidermantankdressBLUE-L,114,2,0.04%,0.06%,132,2,0.03%,0.05%,97.73%,100.00%,2,0,1.75%,0.00%,$49.90,$0.00,2,0
B00F5Z98IA,B008HRXNNO,Costume Agent Wilfred Adult Deluxe Dog Costume Gray,wilfreddeluxe001,347,2,0.11%,0.06%,439,2,0.11%,0.05%,97.04%,100.00%,2,0,0.58%,0.00%,$135.98,$0.00,2,0
B008KN2HFK,B008KN2NEA,Wonder Woman Red & Blue Costume Tank Dress with Attachable Cape (Wonder Woman) (Juniors Medium),capedressWonderWoman-M,182,5,0.06%,0.15%,248,6,0.06%,0.14%,98.30%,100.00%,2,0,1.10%,0.00%,$29.90,$0.00,2,0
B07CM5NHRB,B008N156Y8,The Flintstones Fred Costume Texas Orange Mens T-shirt (Adult Small),flintstones001-S,175,4,0.06%,0.12%,280,5,0.07%,0.12%,98.57%,100.00%,2,0,1.14%,0.00%,$39.90,$0.00,2,0
B07C4NS96P,B008VVECOA,Power Rangers Pink Hooded Costume Sweatshirt (Adult Small),powerrangerssweatshirtPink-S,216,1,0.07%,0.03%,255,1,0.07%,0.02%,97.71%,100.00%,2,0,0.93%,0.00%,$99.98,$0.00,2,0
B07C4NS96P,B008VVECU4,Power Rangers Pink Hooded Costume Sweatshirt (Adult Medium),powerrangerssweatshirtPink-M,53,0,0.02%,0.00%,57,0,0.01%,0.00%,98.00%,0.00%,2,0,3.77%,0.00%,$107.90,$0.00,2,0
B07C4NS96P,B008VVEEIY,Power Rangers Blue Hooded Costume Sweatshirt (Adult X-Large),powerrangerssweatshirtBlue-XL,56,0,0.02%,0.00%,70,0,0.02%,0.00%,98.51%,0.00%,2,0,3.57%,0.00%,$107.90,$0.00,2,0
B07C4NS96P,B008VVEEOS,Power Rangers Blue Hooded Costume Sweatshirt (Adult XX-Large),powerrangerssweatshirtBlue-XXL,36,0,0.01%,0.00%,38,0,0.01%,0.00%,97.30%,0.00%,2,0,5.56%,0.00%,$107.90,$0.00,2,0
B07BWBFKFZ,B008VVELCS,Big Trouble in Little China Tank Top and Wig Costume Set (Adult X-Large),btlccostumeset-XL,16,0,0.01%,0.00%,17,0,0.00%,0.00%,94.12%,0.00%,2,0,12.50%,0.00%,$49.90,$0.00,2,0
B07CBJ5PRZ,B008XJ88LI,Karate Kid The DELUXE Cobra Kai Mens Replica Gi Costume (M/L),karatekidcobrakaidlxcostume-Deluxe,90,1,0.03%,0.03%,122,3,0.03%,0.07%,97.22%,100.00%,2,1,2.22%,100.00%,$95.42,$47.47,2,1
B07CBJ5PRZ,B008XJ88SG,Karate Kid The DELUXE Cobra Kai Mens Replica Gi Costume (X-Large),karatekidcobrakai-Deluxe-FBA,44,0,0.01%,0.00%,58,0,0.01%,0.00%,94.00%,0.00%,2,0,4.55%,0.00%,$105.90,$0.00,2,0
B07CBJ5PRZ,B008XJ88SG,Karate Kid The DELUXE Cobra Kai Mens Replica Gi Costume (X-Large),karatekidcobrakaidlxcostumetXL-Deluxe-XL,44,0,0.01%,0.00%,58,0,0.01%,0.00%,94.00%,0.00%,2,0,4.55%,0.00%,$99.90,$0.00,2,0
B00P3KL4OS,B0092U1SVY,"T-Line Men's Community TV Series Troy & Abed Morning Graphic T-Shirt, Royal Blue, X-Large",community007blue-XL,23,0,0.01%,0.00%,36,0,0.01%,0.00%,85.29%,0.00%,2,0,8.70%,0.00%,$27.90,$0.00,2,0
B01NH0FP93,B00939OHBW,TV Store Inflatable Adult Chub Suit ® Costume (Red),chubsuitcostume001-Red,39,3,0.01%,0.09%,52,5,0.01%,0.12%,90.24%,100.00%,2,1,5.13%,33.33%,$77.51,$38.56,2,1
B07CKGM6Q3,B0099R6RC0,Rocky Balboa Championship Belt on Waist Adult Black T-Shirt (Adult Large),rocky045WAIST-L,89,0,0.03%,0.00%,96,0,0.02%,0.00%,100.00%,0.00%,2,0,2.25%,0.00%,$49.90,$0.00,2,0
B07CKGM6Q3,B0099R6VEY,Rocky Balboa Championship Belt on Shoulder Adult Black T-Shirt (Adult X-Large),rocky045SHOULDER-XL,33,0,0.01%,0.00%,57,0,0.01%,0.00%,76.36%,0.00%,2,0,6.06%,0.00%,$49.90,$0.00,2,0
B009KTNA68,B009KTNA68,nWo New World Order Hollywood Hogan Complete Costume Set (Adult Large),hollywoodhogancostumeset-L,72,0,0.02%,0.00%,85,0,0.02%,0.00%,98.82%,0.00%,2,0,2.78%,0.00%,$99.98,$0.00,2,0
B07CR1X62V,B009OL2ZEK,The Heavyweights Tony Perkis Power Camp Hope Black Adult Sleeveless Tank Top (Adult Small),heavyweights001TANK-S,30,0,0.01%,0.00%,35,0,0.01%,0.00%,100.00%,0.00%,2,0,6.67%,0.00%,$37.90,$0.00,2,0
B00A6VG0DO,B00A6VG0DO,Dukes of Hazzard The 01 Orange Fitted Baseball Cap Hat (Adult Fitted Large/X-Large),dukh003-L/XL,34,1,0.01%,0.03%,41,1,0.01%,0.02%,95.12%,100.00%,2,0,5.88%,0.00%,$35.90,$0.00,2,0
B00A81NPXA,B00A81NPXA,Dr. Seuss Book Spanish One Fish Two Fish Un Pez Dos Peces Adult Light Blue T-shirt (Adult XX-Large),drseuss024-XXL,123,1,0.04%,0.03%,158,1,0.04%,0.02%,94.94%,100.00%,7,0,5.69%,0.00%,$69.65,$0.00,2,0
B00AEXP8RS,B00AEXP8RS,Dragon Ball Z Kame Symbol Orange Zip-Up Adult Hoodie Sweatshirt (Adult X-Large),dragonballzsweater001-XL,194,1,0.06%,0.03%,251,1,0.06%,0.02%,98.41%,100.00%,2,0,1.03%,0.00%,$108.00,$0.00,2,0
B07CM9C4K7,B00AFDZ638,The Big Bang Theory Soft Kitty Warm Kitty BLACK Mens T-Shirt (Adult XXX-Large),bigbang017BLACK-XXXL,18,0,0.01%,0.00%,23,0,0.01%,0.00%,100.00%,0.00%,2,0,11.11%,0.00%,$47.90,$0.00,2,0
B07CT7MP5V,B00AIXUAXG,TMNT Teenage Mutant Ninja Turtles Costume Green Michelangelo Toddler T-shirt (Orange Michelangelo) (Toddler 3T),tmnt016MIKEtoddler-3T,44,0,0.01%,0.00%,64,0,0.02%,0.00%,98.39%,0.00%,2,0,4.55%,0.00%,$33.98,$0.00,2,0
B07CT7MP5V,B00AIXUEVY,"TMNT Teenage Mutant Ninja Turtles Costume Green Toddler T-shirt (Toddler 2T, Leonardo (Blue))",tmnt016LEOtoddler-2T,158,1,0.05%,0.03%,184,1,0.05%,0.02%,98.68%,0.00%,2,0,1.27%,0.00%,$33.98,$0.00,2,0
B00AKHA6SE,B00AKHA6SE,True Vintage Charlie Brown and Snoopy Along for The Ride Juniors Burnout White and Navy T-Shirt with Striped Sleeves (Juniors Small),peanuts008jrs-S,33,2,0.01%,0.06%,48,3,0.01%,0.07%,85.42%,100.00%,2,0,6.06%,0.00%,$19.90,$0.00,2,0
B00AYL31U6,B00AYL37S2,Ferris Bueller's Day Off Caduceus Adult T-Shirt (Adult XX-Large) Army Green,ferris008green-XXL,8,0,0.00%,0.00%,12,0,0.00%,0.00%,85.71%,0.00%,2,0,25.00%,0.00%,$39.90,$0.00,2,0
B07BW8GTCF,B00AYL3BBK,STAR WARS Darth Vader Boombox Retro Adult Black T-Shirt (Adult X-Large),starwars041-XL,4,0,0.00%,0.00%,5,0,0.00%,0.00%,100.00%,0.00%,2,0,50.00%,0.00%,$33.90,$0.00,2,0
B07C9GBXFK,B00BHLHO1Y,The Big Bang Theory Space Invader Adult Orange T-Shirt (Adult X-Large),bigbang054-XL,8,0,0.00%,0.00%,9,0,0.00%,0.00%,100.00%,0.00%,2,0,25.00%,0.00%,$39.90,$0.00,2,0
B07C41N7CH,B00BHLHPEK,The Big Bang Theory Sheldon Cooper Opti Blocks Adult Mustard T-Shirt (Adult XX-Large),bigbang053-XXL,14,1,0.00%,0.03%,15,1,0.00%,0.02%,100.00%,100.00%,2,0,14.29%,0.00%,$39.90,$0.00,2,0
B07BYVP3B8,B00BMMFBHC,Fight Club Sock It to Me Tyler Durden White T-Shirt Tee (Large),fightclub003-L,27,0,0.01%,0.00%,32,0,0.01%,0.00%,89.29%,0.00%,2,0,7.41%,0.00%,$39.90,$0.00,2,0
B07BKP75CK,B00BOVS6V4,Top Gun Logo and Goose Name Adult Heather Navy T-Shirt (Adult XXL),topgun014-XXL,21,0,0.01%,0.00%,28,0,0.01%,0.00%,100.00%,0.00%,2,0,9.52%,0.00%,$43.90,$0.00,2,0
B07BZYWNJR,B00BUUMXUO,Duck Dynasty Phil Robertson Hap-pay Hap-pay Hap-pay Adult T-Shirt with Letters in Camo Print (Adult Medium),duckdynasty011-M,22,0,0.01%,0.00%,29,0,0.01%,0.00%,96.43%,0.00%,2,0,9.09%,0.00%,$33.90,$0.00,2,0
B07BKPKZ46,B00C1NZ4TG,WWE World Wrestling Entertainment Old School Macho Man Glasses Adult Heather Purple T-Shirt (Adult Small),wwe059purple-S,270,2,0.09%,0.06%,386,2,0.10%,0.05%,99.48%,100.00%,2,0,0.74%,0.00%,$33.90,$0.00,2,0
B00C2S8KKA,B00C1NZKDG,World Wrestling Entertainment WWE Old School Macho Man Glasses Adult Red Tank Top Shirt (Adult Medium),wwe060red-M,53,0,0.02%,0.00%,70,0,0.02%,0.00%,98.51%,0.00%,2,0,3.77%,0.00%,$37.90,$0.00,2,0
B019YJRS9S,B00CEJUR3A,The Big Bang Theory Sheldon Cooper Astrosmash Intellivision Video Game Adult Black T-Shirt (Adult Medium),astrosmash001-M,17,0,0.01%,0.00%,25,0,0.01%,0.00%,73.91%,0.00%,2,0,11.76%,0.00%,$25.90,$0.00,2,0
B019YJRS9S,B00CEJUUBE,The Big Bang Theory Sheldon Cooper Astrosmash Intellivision Video Game Adult Black T-Shirt (Adult XXX-Large),astrosmash001-XXXL,18,0,0.01%,0.00%,21,0,0.01%,0.00%,66.67%,0.00%,2,0,11.11%,0.00%,$25.90,$0.00,2,0
B07BZHJN8L,B00CP8M7F6,Adult M&M’S Character Big Face T-Shirt,mm001Norg-S,31,2,0.01%,0.06%,39,2,0.01%,0.05%,100.00%,100.00%,2,0,6.45%,0.00%,$45.90,$0.00,2,0
B07BZHJN8L,B00CP8M7NI,Adult M&M’S Character Big Face T-Shirt,mm001Norg-M,28,0,0.01%,0.00%,35,0,0.01%,0.00%,96.55%,0.00%,2,0,7.14%,0.00%,$45.90,$0.00,2,0
B07CFWYPKQ,B00CTSCEFU,Power Rangers The Long Sleeve Ranger Costume Blue T-Shirt (Adult X-Large),powerrangers015blue-XL,19,0,0.01%,0.00%,19,0,0.00%,0.00%,73.68%,0.00%,2,0,10.53%,0.00%,$57.90,$0.00,2,0
B07CFWYPKQ,B00CTSCKU4,Power Rangers The Long Sleeve Ranger Costume Yellow T-Shirt (Adult XX-Large),powerrangers015yellow-XXL,27,0,0.01%,0.00%,28,0,0.01%,0.00%,88.89%,0.00%,2,0,7.41%,0.00%,$57.90,$0.00,2,0
B07CP359R2,B00D98YYKW,Workaholics Demamp Camp Muscle Long Sleeve Adult Heather Gray T-Shirt (Adult Large),workaholics020-L,10,0,0.00%,0.00%,10,0,0.00%,0.00%,90.00%,0.00%,3,0,30.00%,0.00%,$59.85,$0.00,2,0
B00DEPMOOS,B00DEPMOOS,My Little Pony Rainbow Dash Badge and Charm Rainbow Lanyard,myponylanyard003,45,0,0.01%,0.00%,72,0,0.02%,0.00%,95.83%,0.00%,2,0,4.44%,0.00%,$16.00,$0.00,2,0
B005SVI37S,B00DL8MF5G,"Nerds Candy Juniors Tunic Tank Dress with Nerd Glasses (Juniors X-Small, Fuchsia Pink: Tropical Punch)",nerdstankdressFUCHSIA-XS,20,0,0.01%,0.00%,25,0,0.01%,0.00%,91.67%,0.00%,2,0,10.00%,0.00%,$55.90,$0.00,2,0
B005SVI37S,B00DL8MF9C,"Nerds Candy Juniors Tunic Tank Dress with Nerd Glasses (Juniors X-Large, Fuchsia Pink: Tropical Punch)",nerdstankdressFUCHSIA-XL,33,2,0.01%,0.06%,34,3,0.01%,0.07%,100.00%,100.00%,2,1,6.06%,50.00%,$55.62,$27.67,2,1
B00DNGZ96S,B00DNGYZ3G,Teenage Mutant Ninja Turtles TMNT Donatello Costume Green T-shirt with Purple Eye Mask (Adult X-Large),tmnt045Don-XL,99,0,0.03%,0.00%,137,0,0.04%,0.00%,97.76%,0.00%,2,0,2.02%,0.00%,$43.90,$0.00,2,0
B00DNGZ96S,B00DNGZ3M8,Teenage Mutant Ninja Turtles TMNT Michelangelo Costume Green T-shirt with Orange Eye Mask (Adult XXX-Large),tmnt045Mike-XXXL,34,1,0.01%,0.03%,42,1,0.01%,0.02%,97.44%,100.00%,2,0,5.88%,0.00%,$43.90,$0.00,2,0
B00DNIC4QO,B00DNICALI,Teenage Mutant Ninja Turtles TMNT Raphael Costume Juniors Green Tank Dress with Red Eye Mask (Juniors Small),tmnt047tankdressRaph-S,46,1,0.02%,0.03%,60,1,0.02%,0.02%,83.05%,100.00%,2,0,4.35%,0.00%,$45.90,$0.00,2,0
B00DNIC4QO,B00DNICGZS,Teenage Mutant Ninja Turtles TMNT Donatello Costume Juniors Green Tank Dress with Purple Eye Mask (Juniors X-Large),tmnt047tankdressDon-XL,11,0,0.00%,0.00%,14,0,0.00%,0.00%,100.00%,0.00%,2,0,18.18%,0.00%,$45.90,$0.00,2,0
B00DNIC4QO,B00DNICJP0,Teenage Mutant Ninja Turtles TMNT Michelangelo Costume Juniors Green Tank Dress with Orange Eye Mask (Juniors Medium),tmnt047tankdressMike-M,129,2,0.04%,0.06%,170,2,0.04%,0.05%,96.43%,100.00%,2,0,1.55%,0.00%,$50.90,$0.00,2,0
B00PP64988,B00DUVG50A,Sriracha Bottle Label Adult Red T-Shirt (Adult X-Large),sriracha001-XL,68,0,0.02%,0.00%,86,0,0.02%,0.00%,100.00%,0.00%,2,0,2.94%,0.00%,$39.90,$0.00,2,0
B00DVPOYX0,B00DVPOYX0,Double Dare Costume Goggles,doubledaregoggles,25,1,0.01%,0.03%,34,1,0.01%,0.02%,94.12%,100.00%,2,0,8.00%,0.00%,$9.90,$0.00,2,0
B07CGDXH3T,B00ET9V5KC,Pet Detective Hawaiian Ace Ventura Shirt & Wig Costume Set (Adult Small/medium),petdetectivecostume-S/M,77,0,0.03%,0.00%,87,0,0.02%,0.00%,100.00%,0.00%,2,0,2.60%,0.00%,$59.90,$0.00,2,0
B07CJYFD4H,B00FH8129I,Power Rangers The Green Tunic Tank Dress with Socks (Juniors X-Small),powerrangers017green-XS,101,0,0.03%,0.00%,121,0,0.03%,0.00%,100.00%,0.00%,2,0,1.98%,0.00%,$35.90,$0.00,2,0
B07C58YG3R,B00FI3OLMW,Jeffrey The Dude Zip Up Costume Cardigan Sweater (Adult Small),bigl032-S,73,1,0.02%,0.03%,98,1,0.03%,0.02%,100.00%,100.00%,2,0,2.74%,0.00%,$135.90,$0.00,2,0
B09542LZPC,B00FQLZKIK,"Ripple Junction Average Joes Dodgeball Costume 2 Pcs - Adult Yellow Jersey from Dodgeball Movie | Halloween Costume for Men & Women | Cosplay, Roleplay, Comic Con & Halloween Sports Costume",dodgeball003-XS,34,1,0.01%,0.03%,46,1,0.01%,0.02%,85.71%,100.00%,2,0,5.88%,0.00%,$94.98,$0.00,2,0
B0BPD3DTKT,B00FQS9CF0,"Breaking Bad Men's Los Pollos Hermanos Apron, Yellow, One Size",breakingbadapron001,651,7,0.22%,0.21%,907,8,0.23%,0.19%,0.45%,50.00%,2,2,0.31%,28.57%,$35.54,$35.54,2,2
B00FT6HRRO,B00FT6HTUE,Monsters University Roar Omega Roar Adult Dark Red T-Shirt (Adult Small),monstersinc009-S,22,0,0.01%,0.00%,27,0,0.01%,0.00%,92.31%,0.00%,2,0,9.09%,0.00%,$39.90,$0.00,2,0
B07CLD7979,B00FY6HQOI,Teenage Mutant Ninja Turtles Long Sleeve Michelangelo Costume Adult Green T-Shirt & Eye Mask (Adult XX-Large),tmnt056Mike-XXL,37,1,0.01%,0.03%,41,1,0.01%,0.02%,92.68%,100.00%,2,0,5.41%,0.00%,$45.90,$0.00,2,0
B07BV15X7N,B00FZ3LTV6,Power Rangers Red Baby Ranger Costume Romper Onesie (6-12 Months),powerrangers018red-6/12,62,0,0.02%,0.00%,67,0,0.02%,0.00%,100.00%,0.00%,2,0,3.23%,0.00%,$39.90,$0.00,2,0
B07BV15X7N,B00FZ3LUCY,Power Rangers Blue Baby Ranger Romper Onesie (18-24 Months),powerrangers018blue-18/24,52,0,0.02%,0.00%,53,0,0.01%,0.00%,100.00%,0.00%,2,0,3.85%,0.00%,$39.90,$0.00,2,0
B07BV15X7N,B00FZ3LVD2,Power Rangers Red Baby Ranger Romper Onesie (18-24 Months),powerrangers018red-18/24,73,1,0.02%,0.03%,87,1,0.02%,0.02%,100.00%,100.00%,2,0,2.74%,0.00%,$39.90,$0.00,2,0
B07BV15X7N,B00GABP1RK,"Power Rangers Baby Ranger Costume Romper Onesie (18-24 Months, Yellow)",powerrangers018yellow-18/24,66,0,0.02%,0.00%,81,0,0.02%,0.00%,95.06%,0.00%,2,0,3.03%,0.00%,$39.90,$0.00,2,0
B07BV15X7N,B00HJBEHOI,"Power Rangers Baby Ranger Costume Romper Onesie (18-24 Months, Green)",powerrangers018green-18/24,83,0,0.03%,0.00%,105,0,0.03%,0.00%,100.00%,0.00%,2,0,2.41%,0.00%,$39.90,$0.00,2,0
B07C9RZ551,B00IAZ13E4,Archer I'd Do Me Adult Silver T-Shirt (Adult XX-Large),archer002Silver-XXL,10,0,0.00%,0.00%,13,0,0.00%,0.00%,91.67%,0.00%,2,0,20.00%,0.00%,$43.90,$0.00,2,0
B00JQNFSVI,B00JQNFSVI,Inflatable Teen Chub Suit ® Costume (Blue),chubsuitcostume001Teen-Blue,34,0,0.01%,0.00%,42,0,0.01%,0.00%,100.00%,0.00%,2,0,5.88%,0.00%,$55.90,$0.00,2,0
B07CRCX3L4,B00JZZI2KQ,The Big Bang Theory Sheldon Bats Adult Green T-Shirt (Adult XXX-Large),bigbang072-XXXL,23,1,0.01%,0.03%,27,1,0.01%,0.02%,77.78%,0.00%,2,0,8.70%,0.00%,$39.90,$0.00,2,0
B07CS2G8DH,B00KIZRRHG,USA American Flag Juniors Tank Top (Juniors Medium),usatank001jrs-M,32,0,0.01%,0.00%,41,0,0.01%,0.00%,100.00%,0.00%,3,0,9.38%,0.00%,$27.00,$0.00,2,0
B071Y1QB36,B00M9JDV5Q,"Teenage Mutant Ninja Turtles Green Costume Skater Dress (Medium, Leonardo)",tmntskater001leo-M,87,1,0.03%,0.03%,123,1,0.03%,0.02%,97.44%,100.00%,2,0,2.30%,0.00%,$69.30,$0.00,2,0
B07CJ64PB9,B00MNRTOMI,Napoleon Dynamite Physical Education Adult Powder Blue T-Shirt (Adult X-Large),nap006-XL,16,1,0.01%,0.03%,18,1,0.00%,0.02%,100.00%,100.00%,2,1,12.50%,100.00%,$39.70,$19.75,2,1
B07C87QPG7,B00NMSYZLM,Mermaid Tail Blue Fin Costume (XXL),mermaidfin001BLUE-XXL,206,3,0.07%,0.09%,243,4,0.06%,0.09%,100.00%,100.00%,2,1,0.97%,33.33%,$39.70,$19.75,2,1
B07C8BRCYY,B00NO5EQA8,Captain America Shield Adult Navy Performance T-Shirt (Adult Small),captamerica031-S,30,0,0.01%,0.00%,34,0,0.01%,0.00%,100.00%,0.00%,2,0,6.67%,0.00%,$39.90,$0.00,2,0
B0727SF1GZ,B00NQGD192,Teenage Mutant Ninja Turtles Costume Green Juniors T-Shirt Tee,tmnt020m-XXL,38,0,0.01%,0.00%,53,0,0.01%,0.00%,94.34%,0.00%,2,0,5.26%,0.00%,$37.90,$0.00,2,0
B0727SF1GZ,B00NQGD2F0,Teenage Mutant Ninja Turtles Costume Green Juniors T-Shirt Tee,tmnt020d-XXL,19,0,0.01%,0.00%,25,0,0.01%,0.00%,92.00%,0.00%,2,0,10.53%,0.00%,$37.90,$0.00,2,0
B072Y9LPX3,B00OHH9MXI,Ripple Junction Hooters Girl Classic Waitress Role Play Costume Uniform Outfit w/Tank Top Shorts Adult Women's M Orange White,HJCO2021-HootersCostumeSet-M,"1,894",28,0.63%,0.86%,"2,323",38,0.60%,0.88%,3.36%,0.00%,2,1,0.11%,3.57%,$99.40,$49.45,2,1
B00OJOXTPQ,B00OJOXS6G,The Green Lantern Men's Performance Compression Athletic T-Shirt (Adult Medium),greenlantern028-M,16,0,0.01%,0.00%,17,0,0.00%,0.00%,100.00%,0.00%,2,0,12.50%,0.00%,$33.98,$0.00,2,0
B00OJOXUJG,B00OJOXZEG,DC Comics Superman Silver Logo Men's Performance Compression Athletic T-Shirt (Adult Large),super068-L,108,1,0.04%,0.03%,126,1,0.03%,0.02%,95.08%,100.00%,2,0,1.85%,0.00%,$39.90,$0.00,2,0
B07BM68Q4T,B00OJOY1N0,DC Comics Men's Performance Compression Athletic Costume T-Shirt (Adult X-Large) Black,batman094-XL,23,1,0.01%,0.03%,33,5,0.01%,0.12%,93.75%,100.00%,2,0,8.70%,0.00%,$39.90,$0.00,2,0
B07C58YG3R,B00PKSUISQ,Jeffrey The Dude Zip Up Costume Cardigan Sweater (Adult XXX-Large),bigl032-XXXL,51,1,0.02%,0.03%,65,1,0.02%,0.02%,97.96%,0.00%,2,0,3.92%,0.00%,$135.90,$0.00,2,0
B01NH0FP93,B00PSLZ9I4,TV Store Inflatable Teen Chub Suit ® Costume (Nude),chubsuitcostume001Teen-Nude,24,0,0.01%,0.00%,28,0,0.01%,0.00%,96.00%,0.00%,2,0,8.33%,0.00%,$59.90,$0.00,2,0
B07CLQK2JS,B00R20GCH6,I'm Hunting Cougars Adult Green T-Shirt,looneytunes027-M,5,0,0.00%,0.00%,9,0,0.00%,0.00%,66.67%,0.00%,2,0,40.00%,0.00%,$29.90,$0.00,2,0
B06ZY1Z4SF,B00U0HJU04,Ripple Junction Caddyshack Bushwood Country Club Heather Red T-Shirt (Adult XX-Large),caddy010-2X,51,0,0.02%,0.00%,58,0,0.01%,0.00%,98.21%,0.00%,2,0,3.92%,0.00%,$43.90,$0.00,2,0
B07CHXYD8B,B00WNGNRH2,Step Brothers Spring Break 84 Tropical Blend Adult Yellow T-Shirt (Adult Medium),stepbros011-M,10,0,0.00%,0.00%,11,0,0.00%,0.00%,100.00%,0.00%,2,0,20.00%,0.00%,$39.90,$0.00,2,0
B07CHXYD8B,B00WNGNVL4,Step Brothers Spring Break 84 Tropical Blend Adult Yellow T-Shirt (Adult X-Large),stepbros011-XL,29,0,0.01%,0.00%,34,0,0.01%,0.00%,96.77%,0.00%,2,0,6.90%,0.00%,$39.90,$0.00,2,0
B00YQ4DRBU,B00YQ4DSDM,Silicon Valley I Know HTML How to Meet Ladies Forest Green T-Shirt (Adult Small),siliconvalley003-S,11,0,0.00%,0.00%,13,0,0.00%,0.00%,100.00%,0.00%,3,0,27.27%,0.00%,$59.85,$0.00,2,0
B00YQ4DRBU,B00YQ4DW9C,Silicon Valley I Know HTML How to Meet Ladies Forest Green T-Shirt (Adult X-Large),siliconvalley003-XL,33,0,0.01%,0.00%,40,0,0.01%,0.00%,92.50%,0.00%,2,0,6.06%,0.00%,$39.90,$0.00,2,0
B00ZIY0WGK,B00ZIY103E,Peanuts Charlie Brown Polo Button Up Costume T-Shirt (Adult Medium),peanuts044-M,29,0,0.01%,0.00%,31,0,0.01%,0.00%,96.55%,0.00%,2,0,6.90%,0.00%,$39.90,$0.00,2,0
B07BLV9J5R,B00ZS9PSXM,Police Box Tardis Blueprint White T-Shirt (Adult X-Large),drwho071-XL,7,1,0.00%,0.03%,13,2,0.00%,0.05%,61.54%,100.00%,2,0,28.57%,0.00%,$25.90,$0.00,2,0
B013KR6DEQ,B012HJGIDE,Oktoberfest German Bavarian Trachten Costume Blue Plaid Shirt (X-Large),germanshirtBLUE-XL,15,0,0.00%,0.00%,15,0,0.00%,0.00%,84.62%,0.00%,2,0,13.33%,0.00%,$35.90,$0.00,2,0
B013KSH8PS,B013KSH8PS,Pretty Woman Costume Dress,prettywomandress,323,13,0.11%,0.40%,390,14,0.10%,0.32%,98.46%,100.00%,2,0,0.62%,0.00%,$79.90,$0.00,2,0
B0147HQ3WA,B0145PIKNO,Where's Waldo DELUXE Costume Set (Adult XX-Large),waldocostumeDELUXE-XXL,164,7,0.05%,0.21%,197,9,0.05%,0.21%,97.93%,100.00%,2,0,1.22%,0.00%,$61.90,$0.00,2,0
B0147HQ3WA,B0145Q35TW,Where's Waldo DELUXE Costume Set (Adult XXX-Large),waldocostumeDELUXE-XXXL,98,2,0.03%,0.06%,116,3,0.03%,0.07%,94.81%,0.00%,2,0,2.04%,0.00%,$63.90,$0.00,2,0
B013RYA7J4,B01497JTO2,Costume Agent Macho Man 3 Stars Wrestling Briefs (Adult XX-Large),machomanbriefs-XXL,8,0,0.00%,0.00%,9,0,0.00%,0.00%,100.00%,0.00%,2,0,25.00%,0.00%,$39.90,$0.00,2,0
B013RYA7J4,B01497JUT6,Costume Agent Macho Man 3 Stars Wrestling Briefs (Adult Small),machomanbriefs-S,127,0,0.04%,0.00%,163,0,0.04%,0.00%,92.64%,0.00%,2,0,1.57%,0.00%,$39.90,$0.00,2,0
B014WQCDSY,B014VCJMZ6,Oktoberfest German Bavarian Lederhosen Costume Shorts (40),oktoberfestlederhosenSHORTS-40,30,0,0.01%,0.00%,45,0,0.01%,0.00%,90.48%,0.00%,2,0,6.67%,0.00%,$119.98,$0.00,2,0
B014YXO2UM,B014YXO02W,Star Wars R2-D2 Robot Droid White and Blue Belt (Small 28-30),starwarsbelt001-S,36,1,0.01%,0.03%,45,1,0.01%,0.02%,100.00%,100.00%,2,0,5.56%,0.00%,$25.90,$0.00,2,0
B07BNJCCVN,B01596A662,Sheriff Woody Cowboy Costume Shirt (Large/X-Large) Multicolored,woodycostumeshirt-L-XL,118,4,0.04%,0.12%,146,5,0.04%,0.12%,97.73%,100.00%,2,0,1.69%,0.00%,$67.90,$0.00,2,0
B0164H11CS,B0164H1646,Friday After Next Top Flight Security Shirt and Whistle Costume Set (S/M),fridaysecurityset-S-M,28,0,0.01%,0.00%,32,0,0.01%,0.00%,90.63%,0.00%,2,0,7.14%,0.00%,$43.90,$0.00,2,0
B016J36LUY,B016J36ZBY,Dr. Seuss Grinch As Santa Next to Tree Long Sleeve Off-White Ugly Christmas Sweater (Adult X-Large),DS197-UglySweater-XL,40,0,0.01%,0.00%,42,0,0.01%,0.00%,100.00%,0.00%,2,0,5.00%,0.00%,$109.98,$0.00,2,0
B017OEFAOU,B017OEGWQ0,Red Hot Chili Peppers Logo White Ugly Christmas Sweater (Adult X-Large),uglysweater57-XL,20,0,0.01%,0.00%,22,0,0.01%,0.00%,100.00%,0.00%,2,0,10.00%,0.00%,$99.90,$0.00,2,0
B01BFNKSD4,B01BFNKSFW,Shopkins Love to Shop White T-Shirt (Toddler 6),shopkins004-6,34,0,0.01%,0.00%,43,0,0.01%,0.00%,100.00%,0.00%,2,0,5.88%,0.00%,$29.90,$0.00,2,0
B01BFNKSD4,B01BFNKVZY,Shopkins Love to Shop White T-Shirt (Toddler 4),shopkins004-4,31,0,0.01%,0.00%,35,0,0.01%,0.00%,100.00%,0.00%,2,0,6.45%,0.00%,$33.90,$0.00,2,0
B07CR1F94G,B01IC2QU4C,Bioworld Suicide Squad Harley Quinn Women's Costume Bomber Jacket (Small),suicidesquad010-S,254,3,0.08%,0.09%,347,4,0.09%,0.09%,99.41%,100.00%,2,0,0.79%,0.00%,$119.98,$0.00,2,0
