B07CKW1C13,B00N53T082,Junk Food The Hangover Human Tree Men's T-Shirt (Adult XXX-Large) Beige,junk187-XXXL,324,2,0.10%,0.06%,398,2,0.09%,0.04%,28.39%,0.00%,1,0,0.31%,0.00%,$24.95,$0.00,1,0
B00NMSZ3XG,B00NMSZ3XG,Anchorman Sex Panther Cologne 1.7 oz with Panther Bottle,sexpanthercologne003,19,1,0.01%,0.03%,29,1,0.01%,0.02%,96.55%,100.00%,1,0,5.26%,0.00%,$43.95,$0.00,1,0
B07C87QPG7,B00NMSZ6K6,Mermaid Tail Pink Fin Costume (XXL),mermaidfin001PINK-XXL,116,0,0.04%,0.00%,128,0,0.03%,0.00%,99.17%,0.00%,1,0,0.86%,0.00%,$19.95,$0.00,1,0
B07C87QPG7,B00NMSZ7SM,Mermaid Tail Black Fin Costume (XXL),mermaidfin001BLACK-XXL,165,2,0.05%,0.06%,181,3,0.04%,0.07%,98.83%,100.00%,1,0,0.61%,0.00%,$19.95,$0.00,1,0
B07C8BRCYY,B00NO5ER1Q,Captain America Shield Adult Navy Performance T-Shirt (Adult XXX-Large),captamerica031-XXXL,28,1,0.01%,0.03%,33,1,0.01%,0.02%,96.55%,0.00%,2,0,7.14%,0.00%,$39.90,$0.00,1,0
B07C4NS96P,B00NPB327O,Power Rangers Red Hooded Costume Sweatshirt (Adult XXX-Large),powerrangerssweatshirtRed-XXXL,51,1,0.02%,0.03%,54,1,0.01%,0.02%,100.00%,100.00%,1,0,1.96%,0.00%,$53.95,$0.00,1,0
B0727SF1GZ,B00NQGD192,Teenage Mutant Ninja Turtles Costume Green Juniors T-Shirt Tee,tmnt020m-XXL,23,0,0.01%,0.00%,34,0,0.01%,0.00%,91.18%,0.00%,1,0,4.35%,0.00%,$18.95,$0.00,1,0
B00O4R33J0,B00O18BIJO,Reversible Child Green and Green Superhero Costume Cape (Child),superherocape002CHILDgrn-grn,8,1,0.00%,0.03%,11,3,0.00%,0.07%,100.00%,100.00%,1,1,12.50%,100.00%,$7.87,$7.87,1,1
B00O4R33J0,B00O18BXK8,Reversible Child Orange and Green Superhero Costume Cape (Child),superherocape002CHILDorng-grn,16,0,0.00%,0.00%,19,0,0.00%,0.00%,84.62%,0.00%,1,0,6.25%,0.00%,$7.95,$0.00,1,0
B07BTS225F,B00O18C2OE,Reversible Adult Blue and Blue Superhero Costume Cape (Adult),superherocape002ADULTblu-blu,29,2,0.01%,0.06%,32,3,0.01%,0.07%,100.00%,100.00%,30,0,103.45%,0.00%,$388.50,$0.00,1,0
B00O2EMGHA,B00O2EMGHA,Doctor Who TARDIS Royal Blue Lounge Pants (Adult Small),drwho057-S,147,0,0.04%,0.00%,176,0,0.04%,0.00%,100.00%,0.00%,1,0,0.68%,0.00%,$27.95,$0.00,1,0
B07C87QPG7,B00O940VU2,Mermaid Tail Pink Fin Costume (L/XL),mermaidfin001PINK-L/XL,111,0,0.03%,0.00%,119,0,0.03%,0.00%,100.00%,0.00%,1,0,0.90%,0.00%,$19.95,$0.00,1,0
B00OE75QUO,B00OE75QUO,A League of Their Own Rockford Peaches Costume Socks,rockfordsocks001,13,0,0.00%,0.00%,14,0,0.00%,0.00%,78.57%,0.00%,1,0,7.69%,0.00%,$5.95,$0.00,1,0
B00OE75RQM,B00OE75RQM,Game of Thrones Khaleesi Daenerys Targaryen DELUXE Halloween Costume Wig Mermaid Elsa Cosplay,gameofthronesprincesswigDLX,153,2,0.05%,0.06%,172,2,0.04%,0.04%,98.26%,100.00%,1,1,0.65%,50.00%,$14.80,$14.80,1,1
B07BXLNHT4,B00OG9ED90,USA American Flag Lounge Pants Pajamas (Large),usa002-L,1,0,0.00%,0.00%,1,0,0.00%,0.00%,100.00%,0.00%,1,0,100.00%,0.00%,$25.95,$0.00,1,0
B00OH3MW9I,B00OH3NTSQ,"Sherlock Men's You're On The Side Of Angels T-Shirt, White, Large",sherlock008-L,6,0,0.00%,0.00%,6,0,0.00%,0.00%,100.00%,0.00%,1,0,16.67%,0.00%,$8.95,$0.00,1,0
B07BYL9V5X,B00OHSHMZ2,Oktoberfest German Beer Long Sleeve Men's Costume T-Shirt (XX-Large) White,oktoberfest001-XXL,3,0,0.00%,0.00%,5,0,0.00%,0.00%,100.00%,0.00%,1,0,33.33%,0.00%,$16.95,$0.00,1,0
B00OJOXSXY,B00OJOY72U,DC Comics Superman Men's Performance Compression Athletic Costume T-Shirt (Adult X-Large) Royal Blue,super069-XL,5,0,0.00%,0.00%,7,0,0.00%,0.00%,100.00%,0.00%,1,0,20.00%,0.00%,$24.95,$0.00,1,0
B00OJOXTPQ,B00OJOY8W4,The Green Lantern Men's Performance Compression Athletic T-Shirt (Adult Large),greenlantern028-L,24,0,0.01%,0.00%,29,0,0.01%,0.00%,100.00%,0.00%,1,0,4.17%,0.00%,$16.99,$0.00,1,0
B09RQ4KQPB,B00OPIT11W,RIC Flair Nature Boy Costume Robe and Wig Pink,ricflare001-pink,48,1,0.01%,0.03%,70,1,0.02%,0.02%,93.75%,100.00%,1,0,2.08%,0.00%,$39.95,$0.00,1,0
B07BV3CMVL,B00OWA907S,Bob's Burgers I Smell Fear On You Juniors White T-Shirt (Large),bobsburgers003-L,8,0,0.00%,0.00%,12,0,0.00%,0.00%,81.82%,0.00%,1,0,12.50%,0.00%,$20.00,$0.00,1,0
B07BR93CYY,B00PCZP9OK,Looney Tunes Tweety #Selfie Juniors Pink T-Shirt (Juniors Small),looneytunes026-S,15,0,0.00%,0.00%,17,0,0.00%,0.00%,82.35%,0.00%,1,0,6.67%,0.00%,$12.95,$0.00,1,0
B01NH0FP93,B00PSLMKX6,TV Store Inflatable Teen Chub Suit ® Costume (White),chubsuitcostume001Teen-White,30,1,0.01%,0.03%,33,1,0.01%,0.02%,92.31%,100.00%,1,0,3.33%,0.00%,$38.95,$0.00,1,0
B07BTQMBR5,B00PV0Q6ES,Top Gun Distressed Logo Off The Shoulder Gray Juniors Sweatshirt (Small),topgun021-S,8,0,0.00%,0.00%,11,0,0.00%,0.00%,100.00%,0.00%,1,0,12.50%,0.00%,$34.95,$0.00,1,0
B07CGVRC6V,B00Q7ALQXM,Doctor Who Tardis Sound Activated LED Light Up Adult T-Shirt (Adult Large) Black,drwho063-L,11,1,0.00%,0.03%,11,1,0.00%,0.02%,72.73%,100.00%,1,0,9.09%,0.00%,$16.95,$0.00,1,0
B07CLQK2JS,B00R20GCH6,I'm Hunting Cougars Adult Green T-Shirt,looneytunes027-M,6,0,0.00%,0.00%,6,0,0.00%,0.00%,75.00%,0.00%,1,0,16.67%,0.00%,$14.95,$0.00,1,0
B00S5H3TBW,B00S5H5OLU,Junk Food Star Wars Adult Heather Gray T-Shirt (Adult Medium),starwars111-M,1,0,0.00%,0.00%,1,0,0.00%,0.00%,100.00%,0.00%,1,0,100.00%,0.00%,$22.00,$0.00,1,0
B01MXGOAVH,B00U0HHGZ0,"Christmas Vacation Fun Old Fashioned Family Xmas Ugly Christmas Sweater (XL) Black, Red",CVSM2258-MooseHead-XL,133,0,0.04%,0.00%,166,0,0.04%,0.00%,99.40%,0.00%,1,0,0.75%,0.00%,$49.95,$0.00,1,0
B01MXGOAVH,B00U0HHJ1Q,"Christmas Vacation Fun Old Fashioned Family Xmas Ugly Christmas Sweater (2X) Black, Red",CVSM2258-MooseHead-FBA-2XL,35,0,0.01%,0.00%,39,0,0.01%,0.00%,94.59%,0.00%,1,0,2.86%,0.00%,$49.95,$0.00,1,0
B06ZY1Z4SF,B00U0HJVXK,Ripple Junction Caddyshack Bushwood Country Club Heather Red T-Shirt (Adult XXX-Large),caddy010-3X,19,1,0.01%,0.03%,22,1,0.01%,0.02%,100.00%,100.00%,1,0,5.26%,0.00%,$23.95,$0.00,1,0
B072333CSS,B00U0HOHEI,Luke's Diner Gilmore Girls Navy T-Shirt (Juniors 2X),gilmoregirls001-2X,60,1,0.02%,0.03%,74,1,0.02%,0.02%,100.00%,100.00%,4,0,6.67%,0.00%,$59.80,$0.00,1,0
B07ZQM86WS,B00U0HOQ2Q,Ripple Junction The Office Dunder Mifflin Blue Ugly Christmas Sweater (Large),OESM2439TV-DunderMifflinSweater-L,24,0,0.01%,0.00%,24,0,0.01%,0.00%,95.45%,0.00%,1,0,4.17%,0.00%,$39.95,$0.00,1,0
B00U0HVR7S,B00U0HVR7S,Seinfeld Festivus for The Rest of Us Pole Cream Ugly Christmas Sweater Long Sleeve(Adult Medium),uglysweater60-M,12,0,0.00%,0.00%,16,0,0.00%,0.00%,93.75%,0.00%,1,0,8.33%,0.00%,$49.95,$0.00,1,0
B072Y9LPX3,B00U0HXYX8,Ripple Junction Hooters Girl Classic Waitress Role Play Costume Uniform Outfit w/Tank Top Shorts Adult Women's SM Orange White,HJCO2021-HootersCostumeSet-S,"2,923",19,0.89%,0.54%,"3,812",19,0.90%,0.42%,2.20%,0.00%,1,0,0.03%,0.00%,$49.95,$0.00,1,0
B072Y9LPX3,B00U0HY8LU,Ripple Junction Hooters Girl Classic Waitress Role Play Costume Uniform Outfit w/Tank Top Shorts Adult Women's Plus Size 3XL Orange White,HJCO2021-HootersCostumeSet-3XL,897,7,0.27%,0.20%,"1,071",10,0.25%,0.22%,3.07%,0.00%,1,0,0.11%,0.00%,$49.95,$0.00,1,0
B07771937D,B00U0HYPE0,Bobs Burgers Louise Appreciate Your Lack of Sarcasm Christmas Sweater (Adult 3X-Large),BQSM3410TV-BobsBurgersLouise-3XL,15,0,0.00%,0.00%,17,0,0.00%,0.00%,88.24%,0.00%,1,0,6.67%,0.00%,$44.99,$0.00,1,0
B07JDW253J,B00U0HYWRA,Ripple Junction Elf Buddy Santa I Know Him Pattern Ugly Christmas Sweater (Adult XX-Large),ElfSantaUCS-ELSM2301-XXL,15,0,0.00%,0.00%,16,0,0.00%,0.00%,100.00%,0.00%,1,0,6.67%,0.00%,$44.95,$0.00,1,0
B077715LQ7,B00U0I3C1G,Grateful Dead Bears with Steal Your Face Ornaments Christmas Sweater (4X-Large),GDSM2659TV-GratefullDeadBear-4XL,8,0,0.00%,0.00%,12,0,0.00%,0.00%,100.00%,0.00%,2,0,25.00%,0.00%,$119.98,$0.00,1,0
B0BZJN2CBB,B00U0I6MOU,Ripple Junction Krampus Knit Ugly Christmas Sweater Black,KRSM2011-KrampusSweater-XL,37,0,0.01%,0.00%,43,0,0.01%,0.00%,97.67%,0.00%,1,0,2.70%,0.00%,$59.95,$0.00,1,0
B0BZJN2CBB,B00U0I6T7K,Ripple Junction Krampus Knit Ugly Christmas Sweater Black,KRSM2011-KrampusSweater-3XL,27,0,0.01%,0.00%,39,0,0.01%,0.00%,92.31%,0.00%,1,0,3.70%,0.00%,$59.95,$0.00,1,0
B07CQYQS5F,B00VGR4I72,Ripple Junction Doctor Who Comic Covers Racerback Juniors Tank (Juniors X-Large) Multicoloured,drwho069-XL,7,0,0.00%,0.00%,7,0,0.00%,0.00%,85.71%,0.00%,1,0,14.29%,0.00%,$14.95,$0.00,1,0
B07CHXYD8B,B00WNGNTFW,Step Brothers Spring Break 84 Tropical Blend Adult Yellow T-Shirt (Adult Large),stepbros011-L,2,0,0.00%,0.00%,2,0,0.00%,0.00%,100.00%,0.00%,1,0,50.00%,0.00%,$19.95,$0.00,1,0
B07BYKQYYJ,B00WNGNWL8,Step Brothers It's Better in The Bahamas Adult T-Shirt (Adult XX-Large) Turquoise Green,stepbros012-XXL,11,1,0.00%,0.03%,15,1,0.00%,0.02%,92.86%,100.00%,2,0,18.18%,0.00%,$39.90,$0.00,1,0
B07BYKQYYJ,B00WNGO1KE,Step Brothers It's Better in The Bahamas Adult T-Shirt (Adult Large) Turquoise Green,stepbros012-L,36,2,0.01%,0.06%,40,2,0.01%,0.04%,91.67%,100.00%,1,0,2.78%,0.00%,$19.95,$0.00,1,0
B00WTGAOPY,B00WTGAZF8,USA American Flag Cape (Adult),americanflagcape001-adult,30,0,0.01%,0.00%,36,0,0.01%,0.00%,86.11%,0.00%,1,0,3.33%,0.00%,$11.99,$0.00,1,0
B07C1V1L1M,B00X1OPM2I,Teenage Mutant Ninja Turtles Pizza Neon Adult Black T-Shirt (Adult Large),tmnt004-L,11,0,0.00%,0.00%,16,0,0.00%,0.00%,93.75%,0.00%,1,0,9.09%,0.00%,$19.95,$0.00,1,0
B00Y3EBJM2,B00Y3EBQEI,Fast N Loud Gas Monkey Garage Sleeveless Shirt (Adult Medium) Black,gasmonkeygarage001-M,19,0,0.01%,0.00%,25,0,0.01%,0.00%,84.00%,0.00%,1,0,5.26%,0.00%,$39.99,$0.00,1,0
B07BNVJTTK,B00YQ3XI92,Silicon Valley Bitcoin in Binary Blue T-Shirt (Adult X-Large),siliconvalley004-XL,4,0,0.00%,0.00%,5,0,0.00%,0.00%,100.00%,0.00%,1,0,25.00%,0.00%,$19.95,$0.00,1,0
B00YQ4DRBU,B00YQ4DUCG,Silicon Valley I Know HTML How to Meet Ladies Forest Green T-Shirt (Adult Large),siliconvalley003-L,18,0,0.01%,0.00%,22,0,0.01%,0.00%,100.00%,0.00%,1,0,5.56%,0.00%,$19.95,$0.00,1,0
B00YQ4DRBU,B00YQ4DXE6,Silicon Valley I Know HTML How to Meet Ladies Forest Green T-Shirt (Adult XX-Large),siliconvalley003-XXL,5,0,0.00%,0.00%,5,0,0.00%,0.00%,100.00%,0.00%,1,0,20.00%,0.00%,$19.95,$0.00,1,0
B00YQ4DRBU,B00YQ4DYIG,Silicon Valley I Know HTML How to Meet Ladies Forest Green T-Shirt (Adult XXX-Large),siliconvalley003-XXXL,3,0,0.00%,0.00%,4,0,0.00%,0.00%,100.00%,0.00%,1,0,33.33%,0.00%,$19.95,$0.00,1,0
B0921M6DNW,B00YQ4SE6S,Impact Aerosmith Aero Force Men's White Short Sleeve Tee,aerosmith002-M,521,9,0.16%,0.26%,627,10,0.15%,0.22%,11.65%,12.50%,1,0,0.19%,0.00%,$24.95,$0.00,1,0
B07CH3TYY6,B00YYVLYLA,Silicon Valley Erlich Bachman Aviato Logo Light Blue T-Shirt (Adult XX-Large),siliconvalley005-XXL,12,0,0.00%,0.00%,18,0,0.00%,0.00%,100.00%,0.00%,1,0,8.33%,0.00%,$19.95,$0.00,1,0
B07CH3TYY6,B00YYVLZI2,Silicon Valley Erlich Bachman Aviato Logo Light Blue T-Shirt (Adult Small),siliconvalley005-S,11,0,0.00%,0.00%,15,0,0.00%,0.00%,100.00%,0.00%,1,0,9.09%,0.00%,$19.95,$0.00,1,0
B07CH3TYY6,B00YYVM91O,Silicon Valley Erlich Bachman Aviato Logo Light Blue T-Shirt (Adult Large),siliconvalley005-L,24,0,0.01%,0.00%,29,0,0.01%,0.00%,100.00%,0.00%,1,0,4.17%,0.00%,$19.95,$0.00,1,0
B00ZIY0WGK,B00ZIY103E,Peanuts Charlie Brown Polo Button Up Costume T-Shirt (Adult Medium),peanuts044-M,32,0,0.01%,0.00%,35,0,0.01%,0.00%,100.00%,0.00%,1,0,3.13%,0.00%,$19.95,$0.00,1,0
B00ZIY0WGK,B00ZIY434C,Peanuts Charlie Brown Polo Button Up Costume T-Shirt (Adult XX-Large),peanuts044-XXL,31,0,0.01%,0.00%,33,0,0.01%,0.00%,93.55%,0.00%,1,0,3.23%,0.00%,$27.95,$0.00,1,0
B07BLV9J5R,B00ZS9PSXM,Police Box Tardis Blueprint White T-Shirt (Adult X-Large),drwho071-XL,7,0,0.00%,0.00%,13,0,0.00%,0.00%,66.67%,0.00%,1,0,14.29%,0.00%,$12.95,$0.00,1,0
B07GC722RG,B010MR9LJG,Dodgeball Average Joe's Adult Yellow Jersey Costume Set (XXX-Large),dodgeball003-XXXL,17,0,0.01%,0.00%,18,0,0.00%,0.00%,100.00%,0.00%,1,0,5.88%,0.00%,$49.99,$0.00,1,0
B07BSRMTMV,B012EEADH4,Napoleon Dynamite Rex Kwon Do Black Polo T-Shirt (Adult Small),nap027-S,42,0,0.01%,0.00%,46,0,0.01%,0.00%,95.56%,0.00%,1,0,2.38%,0.00%,$27.95,$0.00,1,0
B07CMV2TQW,B012EEF3IS,Masters of The Universe I Am She Ra White Hoodie with Cape (Juniors Medium),he020-M,88,1,0.03%,0.03%,111,2,0.03%,0.04%,99.10%,100.00%,1,0,1.14%,0.00%,$36.95,$0.00,1,0
B07BVRDM88,B012H8AOB2,Rockford Peaches AAGPBL Baseball Girls Costume Dress (2T) Pink,leagueoftheirownGIRLS-2T,86,0,0.03%,0.00%,112,0,0.03%,0.00%,94.23%,0.00%,1,0,1.16%,0.00%,$35.95,$0.00,1,0
B07BVRDM88,B012H8AR0U,Rockford Peaches AAGPBL Baseball Girls Costume Dress (7/8),leagueoftheirownGIRLS-7/8,93,2,0.03%,0.06%,109,2,0.03%,0.04%,98.99%,100.00%,1,0,1.08%,0.00%,$35.95,$0.00,1,0
B013KR6DEQ,B012HJGIDE,Oktoberfest German Bavarian Trachten Costume Blue Plaid Shirt (X-Large),germanshirtBLUE-XL,15,0,0.00%,0.00%,15,0,0.00%,0.00%,84.62%,0.00%,1,0,6.67%,0.00%,$17.95,$0.00,1,0
B013KR6DEQ,B012HJGIR0,Oktoberfest German Bavarian Trachten Costume Green Plaid Shirt (X-Large),germanshirtGREEN-XL,9,0,0.00%,0.00%,12,0,0.00%,0.00%,100.00%,0.00%,1,0,11.11%,0.00%,$17.95,$0.00,1,0
B013KR6DEQ,B012HJGLUY,Oktoberfest German Bavarian Trachten Costume Red Plaid Shirt (XX-Large),germanshirtRED-XXL,4,0,0.00%,0.00%,7,0,0.00%,0.00%,100.00%,0.00%,1,0,25.00%,0.00%,$17.95,$0.00,1,0
B012TX8R2I,B012TX8R2I,Battlestar Galactica TV Series Razor Marines Chest Logo Patch,battlestarpatch,10,0,0.00%,0.00%,13,0,0.00%,0.00%,76.92%,0.00%,1,0,10.00%,0.00%,$9.95,$0.00,1,0
B07BZDK1ZK,B012U5GV5A,Hulkamania Hulk Hogan Yellow Costume Wrestling Weight Belt (Yellow),hulkamaniawrestlingbelt-yellow,128,1,0.04%,0.03%,161,1,0.04%,0.02%,98.76%,100.00%,1,0,0.78%,0.00%,$14.95,$0.00,1,0
B07BMLDMJV,B013H5POBO,Men's Red Athletic Running Shorts (Large/X-Large),runningshorts001RED-L-XL,8,0,0.00%,0.00%,9,0,0.00%,0.00%,88.89%,0.00%,1,0,12.50%,0.00%,$12.95,$0.00,1,0
B07C92QPVC,B013TDGWW4,Friday Night Lights Panthers Cheer Uniform Sublimated White T-Shirt Tee (Juniors Medium),fridaynight009-M,2,0,0.00%,0.00%,2,0,0.00%,0.00%,50.00%,0.00%,1,0,50.00%,0.00%,$14.95,$0.00,1,0
B013RYA7J4,B01497JUT6,Costume Agent Macho Man 3 Stars Wrestling Briefs (Adult Small),machomanbriefs-S,96,0,0.03%,0.00%,116,0,0.03%,0.00%,99.14%,0.00%,1,0,1.04%,0.00%,$19.95,$0.00,1,0
B0147FOJS2,B014GD687K,Oktoberfest Drindl Bavarian German Beer Girl Blue Maid Costume Dress (12),oktoberfestmaid001BLUE-12,1,0,0.00%,0.00%,3,0,0.00%,0.00%,100.00%,0.00%,1,0,100.00%,0.00%,$27.95,$0.00,1,0
B0147FOJS2,B014GD6EM4,Oktoberfest Drindl Bavarian German Beer Girl Blue Maid Costume Dress (18),oktoberfestmaid001BLUE-18,4,0,0.00%,0.00%,6,0,0.00%,0.00%,100.00%,0.00%,1,0,25.00%,0.00%,$27.95,$0.00,1,0
B09KS7MZVT,B014LRDAVI,Marvel Captain America Sublimated Long Sleeve Costume T-Shirt (Adult Large),captamerica038-L,38,0,0.01%,0.00%,46,0,0.01%,0.00%,95.56%,0.00%,1,0,2.63%,0.00%,$19.99,$0.00,1,0
B014V92V16,B014V92V16,STAR WARS Boba Fett Mascot Hat Green,starwarshat002,46,0,0.01%,0.00%,63,0,0.01%,0.00%,26.98%,0.00%,1,0,2.17%,0.00%,$9.95,$0.00,1,0
B014WQCDSY,B014VCJO9K,Oktoberfest German Bavarian Lederhosen Costume Shorts (32),oktoberfestlederhosenSHORTS-32,57,1,0.02%,0.03%,77,1,0.02%,0.02%,100.00%,100.00%,1,0,1.75%,0.00%,$59.99,$0.00,1,0
B014WQCDSY,B014VCJV66,Oktoberfest German Bavarian Lederhosen Costume Shorts (44),oktoberfestlederhosenSHORTS-44,12,0,0.00%,0.00%,20,0,0.00%,0.00%,89.47%,0.00%,1,0,8.33%,0.00%,$59.99,$0.00,1,0
B0153WI2W2,B0153WI2UE,Starsky and Hutch Paul Michael Glaser Costume Cardigan Sweater (Adult XXX-Large) Beige,starskyhutch001-XXXL,19,0,0.01%,0.00%,22,0,0.01%,0.00%,95.24%,0.00%,1,0,5.26%,0.00%,$62.95,$0.00,1,0
B0153WI2W2,B0153WIBHS,Starsky and Hutch Paul Michael Glaser Costume Cardigan Sweater (Adult Small) Beige,starskyhutch001-S,9,1,0.00%,0.03%,10,1,0.00%,0.02%,66.67%,100.00%,1,0,11.11%,0.00%,$62.95,$0.00,1,0
B0153WI2W2,B0153WIENY,Starsky and Hutch Paul Michael Glaser Costume Cardigan Sweater (Adult X-Large) Beige,starskyhutch001-XL,172,0,0.05%,0.00%,220,0,0.05%,0.00%,99.54%,0.00%,2,0,1.16%,0.00%,$125.90,$0.00,1,0
B0157CXBDS,B0157CWW92,"Sriracha Sauce Bottle Costume Shirt and Hat (Adult Large) Red, Green",sriracha005-L,11,0,0.00%,0.00%,13,0,0.00%,0.00%,100.00%,0.00%,1,0,9.09%,0.00%,$34.95,$0.00,1,0
B0157CXBDS,B0157DQ8IC,"Sriracha Sauce Bottle Costume Shirt and Hat (Adult Medium) Red, Green",sriracha005-M,2,0,0.00%,0.00%,4,0,0.00%,0.00%,100.00%,0.00%,1,0,50.00%,0.00%,$34.95,$0.00,1,0
B07BZHJN8L,B015EICWUI,M&M M&M's Candy Blue Silly Character Face Adult T-Shirt (X-Small),mm001Nblu-XS,45,1,0.01%,0.03%,47,1,0.01%,0.02%,100.00%,0.00%,1,0,2.22%,0.00%,$22.95,$0.00,1,0
B015WVJEXU,B015HNK60I,Dress Up Party Costume FEDORA Hat (White),dresshat001HAT3-White,8,0,0.00%,0.00%,8,0,0.00%,0.00%,87.50%,0.00%,1,0,12.50%,0.00%,$10.95,$0.00,1,0
B07BN67R4V,B015JT8832,Step Brothers I Teabagged Your Drum Set Black T-Shirt (Adult Large),stepbros015-L,4,1,0.00%,0.03%,6,1,0.00%,0.02%,83.33%,0.00%,1,0,25.00%,0.00%,$19.95,$0.00,1,0
B0B57GXNFF,B015QK0EDG,TV Store Sheriff Woody Adult Halloween Costume Cowboy Vest,toystorywoodyvest-XL-XXL,31,1,0.01%,0.03%,53,1,0.01%,0.02%,96.00%,100.00%,1,0,3.23%,0.00%,$39.95,$0.00,1,0
B0B57GXNFF,B015QK0JSQ,TV Store Sheriff Woody Adult Halloween Costume Cowboy Vest,toystorywoodyvest-M-L,26,0,0.01%,0.00%,30,0,0.01%,0.00%,96.43%,0.00%,1,0,3.85%,0.00%,$39.95,$0.00,1,0
B015TM9RUW,B015TM9RUW,My Little Pony Group Sleigh Ride Snowflakes Royal Blue Sweatshirt (Adult Small),mypony091-S,15,0,0.00%,0.00%,17,0,0.00%,0.00%,100.00%,0.00%,1,0,6.67%,0.00%,$12.95,$0.00,1,0
B016J36LUY,B016J36XRU,Dr. Seuss Grinch As Santa Next to Tree Long Sleeve Off-White Ugly Christmas Sweater (Adult Medium),DS197-UglySweater-M,21,0,0.01%,0.00%,28,0,0.01%,0.00%,96.43%,0.00%,1,0,4.76%,0.00%,$54.99,$0.00,1,0
B016J36LUY,B016J36ZBY,Dr. Seuss Grinch As Santa Next to Tree Long Sleeve Off-White Ugly Christmas Sweater (Adult X-Large),DS197-UglySweater-XL,36,0,0.01%,0.00%,39,0,0.01%,0.00%,100.00%,0.00%,1,0,2.78%,0.00%,$54.99,$0.00,1,0
B016OSW5HM,B016N7AN1Y,Star Wars Stormtrooper Armor Print Adult White Boxer Shorts (Medium),starwars145-M,11,0,0.00%,0.00%,13,0,0.00%,0.00%,100.00%,0.00%,1,0,9.09%,0.00%,$9.95,$0.00,1,0
B016N7AOGS,B016N7AOGS,Star Wars Stormtrooper Armor Print Adult White Boxer Shorts (Large),starwars145-L,39,0,0.01%,0.00%,52,0,0.01%,0.00%,94.23%,0.00%,1,0,2.56%,0.00%,$9.95,$0.00,1,0
B0170TBOOY,B0170TBNUO,Teenage Mutant Ninja Turtles Pizza Adult Green One Piece Pajama Onesie Jumpsuit (Adult Medium),NK0165-HoodedOPPjs-M,32,0,0.01%,0.00%,37,0,0.01%,0.00%,100.00%,0.00%,1,0,3.13%,0.00%,$39.95,$0.00,1,0
B0170TBOOY,B0170TBPUM,Teenage Mutant Ninja Turtles Pizza Adult Green One Piece Pajama Onesie Jumpsuit (Adult XX-Large),NK0165-HoodedOPPjs-XXL,17,0,0.01%,0.00%,23,0,0.01%,0.00%,91.30%,0.00%,1,0,5.88%,0.00%,$39.95,$0.00,1,0
B07BNS1Z3J,B0170TBWAK,The Simpsons Multi Character Collage Blue T-Shirt Tee (Adult X-Large),SM0045-SimpsonsTshirt-XL,49,1,0.01%,0.03%,62,2,0.01%,0.04%,95.08%,100.00%,1,0,2.04%,0.00%,$21.95,$0.00,1,0
B01755FCVO,B0170TBXCC,Doctor Who Exterminate Adult Navy One Piece Pajama Onesie Jumpsuit (Adult Medium),DW0158-HoodedOPPJs-M,7,0,0.00%,0.00%,7,0,0.00%,0.00%,100.00%,0.00%,1,0,14.29%,0.00%,$24.95,$0.00,1,0
B017OEF2VG,B017OEFCK2,"A Christmas Story Fragile Leg Lamp Light Up Green Ugly Christmas Sweater, Long Sleeve (Adult Large)",uglysweater52-L,50,0,0.02%,0.00%,55,0,0.01%,0.00%,98.08%,0.00%,1,0,2.00%,0.00%,$67.99,$0.00,1,0
B017OEF20C,B017OEG5EY,Let's Get Baked Happy Gingerbread Adult Green Ugly Christmas Sweater,uglysweater55-XXL,4,0,0.00%,0.00%,4,0,0.00%,0.00%,66.67%,0.00%,1,0,25.00%,0.00%,$49.95,$0.00,1,0
B017OEF20C,B017OEG8LE,Let's Get Baked Happy Gingerbread Adult Green Ugly Christmas Sweater,uglysweater55-S,3,0,0.00%,0.00%,3,0,0.00%,0.00%,100.00%,0.00%,1,0,33.33%,0.00%,$49.95,$0.00,1,0
B017OEF20C,B017OEGA26,Let's Get Baked Happy Gingerbread Adult Green Ugly Christmas Sweater,uglysweater55-XL,5,0,0.00%,0.00%,9,0,0.00%,0.00%,100.00%,0.00%,1,0,20.00%,0.00%,$49.95,$0.00,1,0
B017OEF20C,B017OEGBIO,Let's Get Baked Happy Gingerbread Adult Green Ugly Christmas Sweater,uglysweater55-L,38,0,0.01%,0.00%,45,0,0.01%,0.00%,100.00%,0.00%,2,0,5.26%,0.00%,$99.90,$0.00,1,0
B017OEF20C,B017OEGDC8,Let's Get Baked Happy Gingerbread Adult Green Ugly Christmas Sweater,uglysweater55-M,1,0,0.00%,0.00%,2,0,0.00%,0.00%,0.00%,0.00%,1,0,100.00%,0.00%,$49.95,$0.00,1,0
B017OEFAOU,B017OEGQF2,Red Hot Chili Peppers Logo White Ugly Christmas Sweater (Adult 3X-Large),uglysweater57-3XL,13,1,0.00%,0.03%,13,1,0.00%,0.02%,84.62%,100.00%,1,0,7.69%,0.00%,$49.95,$0.00,1,0
B017OEFAOU,B017OEGWQ0,Red Hot Chili Peppers Logo White Ugly Christmas Sweater (Adult X-Large),uglysweater57-XL,19,0,0.01%,0.00%,21,0,0.00%,0.00%,90.00%,0.00%,1,0,5.26%,0.00%,$49.95,$0.00,1,0
B017OEFAOU,B017OEGYI6,Red Hot Chili Peppers Logo White Ugly Christmas Sweater (Adult Medium),uglysweater57-M,29,0,0.01%,0.00%,30,0,0.01%,0.00%,100.00%,0.00%,1,0,3.45%,0.00%,$49.95,$0.00,1,0
B018T9SRQ2,B018RHDCAW,Navy 3D Reindeer Moose Ugly Christmas Sweater (Adult Large),ucs3d002-L,40,1,0.01%,0.03%,41,1,0.01%,0.02%,100.00%,100.00%,1,0,2.50%,0.00%,$67.95,$0.00,1,0
B018T9SSNE,B018T9SQYU,Shopkins I Am Cupcake Chic Girls Hot Pink T-Shirt (Youth X-Small),shopkins002-XS,30,0,0.01%,0.00%,39,0,0.01%,0.00%,100.00%,0.00%,1,0,3.33%,0.00%,$14.95,$0.00,1,0
B07BT15HGJ,B01B5I06KE,"Costume Agent The Hangover Alan Costume - 6 Pcs The Hangover Costume with T-Shirt, Glasses, Baby Carrier, Wig, Beard and Mustache for Men Halloween Costume & Themed Birthday Party (Adult 3X-Large)",alanbabycarriercostumeDELUXE-3XL,17,0,0.01%,0.00%,22,0,0.01%,0.00%,95.45%,0.00%,1,0,5.88%,0.00%,$68.95,$0.00,1,0
B07BLJD6FC,B01B6MQN5Q,Hulkamania World Champ Costume Yellow Snapsuit Infant Onesie Baby Romper (24 Months),hulk006-24,32,0,0.01%,0.00%,34,0,0.01%,0.00%,100.00%,0.00%,1,0,3.13%,0.00%,$19.95,$0.00,1,0
B01BFNKSD4,B01BFNKSFW,Shopkins Love to Shop White T-Shirt (Toddler 6),shopkins004-6,25,0,0.01%,0.00%,31,0,0.01%,0.00%,96.00%,0.00%,1,0,4.00%,0.00%,$14.95,$0.00,1,0
B01BFNKSD4,B01BFNKVZY,Shopkins Love to Shop White T-Shirt (Toddler 4),shopkins004-4,34,0,0.01%,0.00%,38,0,0.01%,0.00%,100.00%,0.00%,1,0,2.94%,0.00%,$16.95,$0.00,1,0
B07C1567CX,B01DTJD5FK,Family Guy Quagmire Caution Party in Progress Royal Blue T-Shirt (Adult XXX-Large),fam064-3XL,1,0,0.00%,0.00%,1,0,0.00%,0.00%,100.00%,0.00%,1,0,100.00%,0.00%,$16.95,$0.00,1,0
B01FECW0DI,B01FECW09M,STAR WARS The Force Awakens Poster Black T-Shirt (Adult Large),starwars160-L,3,0,0.00%,0.00%,5,0,0.00%,0.00%,100.00%,0.00%,1,0,33.33%,0.00%,$10.00,$0.00,1,0
B01GGAVFJW,B01GGAVFJW,Donald Trump & Hillary Clinton We Are F*cked Either Way Flip Coin,wearefuckedcoin,9,0,0.00%,0.00%,9,0,0.00%,0.00%,100.00%,0.00%,1,0,11.11%,0.00%,$3.95,$0.00,1,0
B07CN77BHQ,B01GOUAO9Q,Seinfeld #1 Dad Light Blue Mens T-Shirt (XXX-Large),sein034-3XL,27,1,0.01%,0.03%,28,1,0.01%,0.02%,92.59%,100.00%,1,0,3.70%,0.00%,$17.95,$0.00,1,0
B01GQSWHEG,B01GQSWHEG,Girls Clip On Led Purple Flash Party Hair Braid Accessory,flashbraid-purple,1,0,0.00%,0.00%,1,0,0.00%,0.00%,100.00%,0.00%,1,0,100.00%,0.00%,$2.95,$0.00,1,0
B07CR1F94G,B01IC2QU4C,Bioworld Suicide Squad Harley Quinn Women's Costume Bomber Jacket (Small),suicidesquad010-S,266,3,0.08%,0.09%,322,4,0.08%,0.09%,100.00%,100.00%,1,0,0.38%,0.00%,$59.99,$0.00,1,0
B01J6J5AIM,B01IW4TM54,STAR WARS Galaxy Reversible Hooded Poncho Cape (Adult Large) Black,starwars162-L,17,0,0.01%,0.00%,21,0,0.00%,0.00%,100.00%,0.00%,1,0,5.88%,0.00%,$34.95,$0.00,1,0
B01J6J58SO,B01J6J5EXS,M&M's Chocolate Candy Character Face Yellow T-Shirt (Juniors XX-Large),mm003JRSyellow-XXL,95,0,0.03%,0.00%,130,0,0.03%,0.00%,97.64%,0.00%,1,0,1.05%,0.00%,$23.95,$0.00,1,0
B01J6J58SO,B01J6J5KJQ,M&M's Chocolate Candy Character Face Orange T-Shirt (Juniors Small),mm003JRSorange-S,120,0,0.04%,0.00%,139,0,0.03%,0.00%,98.75%,0.00%,5,0,4.17%,0.00%,$119.75,$0.00,1,0
B01J6J58SO,B01J6J5MVC,M&M's Chocolate Candy Character Face Red T-Shirt (Juniors Medium),mm003JRSred-M,12,0,0.00%,0.00%,17,0,0.00%,0.00%,100.00%,0.00%,1,0,8.33%,0.00%,$23.95,$0.00,1,0
B01J6J58SO,B01J6J5OBU,M&M's Chocolate Candy Character Face Blue T-Shirt,mm003JRSblue-XXL,49,1,0.01%,0.03%,56,1,0.01%,0.02%,100.00%,100.00%,1,0,2.04%,0.00%,$23.95,$0.00,1,0
B07BNVPY2K,B01JSFN2Y8,DC Comics Suicide Squad Harley Quinn DELUXE Sequins Panty (Small) Red/Blue,suicidesquad004-S,594,12,0.18%,0.34%,815,26,0.19%,0.57%,99.75%,96.15%,1,0,0.17%,0.00%,$27.95,$0.00,1,0
B01JSH2E7C,B01JSFN4V4,Suicide Squad Harley Quinn Bravo Detainee Burn After Use Womans Costume Tank (Large) Light Heather Gray,suicidesquad006-L,26,0,0.01%,0.00%,30,0,0.01%,0.00%,93.33%,0.00%,1,0,3.85%,0.00%,$17.95,$0.00,1,0
B07BJ3598R,B01JSI0XVA,Beavis Costume Set (Adult Large),beaviscostume-L,57,1,0.02%,0.03%,64,1,0.02%,0.02%,100.00%,100.00%,1,0,1.75%,0.00%,$25.95,$0.00,1,0
B01KKO7ZLW,B01KKO84VM,STAR WARS Stormtrooper Top and Pants Costume Set (Women's XX-Large),starwars164-XXL,159,0,0.05%,0.00%,182,0,0.04%,0.00%,99.45%,0.00%,1,0,0.63%,0.00%,$29.95,$0.00,1,0
B01KKO7ZLW,B01KKO86WE,STAR WARS Stormtrooper Top and Pants Costume Set (Women's X-Large),starwars164-XL,15,0,0.00%,0.00%,16,0,0.00%,0.00%,100.00%,0.00%,1,0,6.67%,0.00%,$29.95,$0.00,1,0
B01KM9948M,B01KM9948M,amscan Mad Hatter Boyshorts Multicolor,846473-MadhatterBoyshorts,22,1,0.01%,0.03%,29,1,0.01%,0.02%,96.55%,100.00%,1,0,4.55%,0.00%,$5.24,$0.00,1,0
B01KXXCKOW,B01KU2BGQE,Top Gun Volleyball Champion T-Shirt (Adult 2X) Heathered Blue,topgun025-2X,12,0,0.00%,0.00%,12,0,0.00%,0.00%,100.00%,0.00%,1,0,8.33%,0.00%,$21.95,$0.00,1,0
B0CBSWQ4J8,B01LBRLC98,Superhero Cosplay Halloween Costume Black Boots,100578BLACK-XL,55,1,0.02%,0.03%,63,2,0.01%,0.04%,95.74%,100.00%,1,0,1.82%,0.00%,$76.95,$0.00,1,0
B01NH0695P,B01LDNKQVK,Lift Me Walking Carrying Halloween Costume,220621-youth,61,0,0.02%,0.00%,78,0,0.02%,0.00%,100.00%,0.00%,1,0,1.64%,0.00%,$11.95,$0.00,1,0
B01LR5WXUG,B01LR5WXUG,Blonde Halloween Costume Cosplay Hair Wig,1139,17,0,0.01%,0.00%,24,0,0.01%,0.00%,83.33%,0.00%,1,0,5.88%,0.00%,$9.95,$0.00,1,0
B01LX25DNZ,B01LWQI6TF,Sparkly Sequin Mermaid Gold Corset (Small),20355-GLD-S,12,1,0.00%,0.03%,13,1,0.00%,0.02%,100.00%,0.00%,1,0,8.33%,0.00%,$19.95,$0.00,1,0
B01LZTF3AW,B01LX7MHKZ,Star Wars at-at Reindeer Ugly Christmas Sweater (Adult XXXX-Large),starwars168-4X,23,0,0.01%,0.00%,27,0,0.01%,0.00%,92.31%,0.00%,1,0,4.35%,0.00%,$49.95,$0.00,1,0
B001ULD8I4,B01LX8SPTU,Sanford and Son You Big Dummy T-Shirt (Adult 5X-Large) Navy,sanford034-5X,31,0,0.01%,0.00%,38,0,0.01%,0.00%,100.00%,0.00%,1,0,3.23%,0.00%,$21.95,$0.00,1,0
